A1: 期数 | B1: 时间 | C1: 言论题目 | D1: 评论类型 | E1: 作者 | F1: 版面位置
A2: =COUNTA($B$2:B2) -> 1 | B2: 12116. | C2: 教育与职业的商品化 | D2: 时论 | E2: 文唤 | F2: 第1版
A3: =COUNTA($B$2:B3) -> 2 | B3: 12117. | C3: 奉天市医院开放感言 | D3: 论说 | E3: 匿名 | F3: 第1版
A4: =COUNTA($B$2:B4) -> 3 | B4: 12118. | C4: 奥大利军械事件（上） | D4: 时论 | E4: 匿名 | F4: 第1版
A5: =COUNTA($B$2:B5) -> 4 | B5: 12121. | C5: 奥大利军械事件（下） | D5: 时论 | E5: 匿名 | F5: 第1版
A6: =COUNTA($B$2:B6) -> 5 | B6: 12122. | C6: 我国学术界应有之自觉 | D6: 论说 | E6: 匿名 | F6: 第1版
A7: =COUNTA($B$2:B7) -> 6 | B7: 12123. | C7: 我国学术界应有之自觉（续） | D7: 论说 | E7: 匿名 | F7: 第1版
A8: =COUNTA($B$2:B8) -> 7 | B8: 12124. | C8: 萧伯纳与讽刺 | D8: 时论 | E8: 徐卓* | F8: 第1版
A9: =COUNTA($B$2:B9) -> 8 | B9: 12125. | C9: 救济农村 | D9: 论说 | E9: 匿名 | F9: 第1版
A10: =COUNTA($B$2:B10) -> 9 | B10: 12127. | C10: 两大国际事件之观察 | D10: 时论 | E10: 匿名 | F10: 第1版
A11: =COUNTA($B$2:B11) -> 10 | B11: 12128. | C11: 礼让臆说 | D11: 论说 | E11: 匿名 | F11: 第1版
A12: =COUNTA($B$2:B12) -> 11 | B12: 12129. | C12: 技术政治 | D12: 时论 | E12: 匿名 | F12: 第1版
A13: =COUNTA($B$2:B13) -> 12 | B13: 12130. | C13: 为失业者危 | D13: 时论 | E13: 匿名 | F13: 第1版
A14: =COUNTA($B$2:B14) -> 13 | B14: 12131. | C14: 美利坚之金融恐慌（上） | D14: 时论 | E14: 匿名 | F14: 第1版
A15: =COUNTA($B$2:B15) -> 14 | B15: 12132. | C15: 美利坚之金融恐慌（下） | D15: 时论 | E15: 匿名 | F15: 第1版
A16: =COUNTA($B$2:B16) -> 15 | B16: 12134. | C16: 花会极宜彻底禁止 | D16: 论说 | E16: 匿名 | F16: 第1版
A17: =COUNTA($B$2:B17) -> 16 | B17: 12135. | C17: 青年学生当自勉 | D17: 论说 | E17: 匿名 | F17: 第1版
A18: =COUNTA($B$2:B18) -> 17 | B18: 12136. | C18: 鸦片专卖 | D18: 时论 | E18: 匿名 | F18: 第1版
A19: =COUNTA($B$2:B19) -> 18 | B19: 12137. | C19: 德意志反动政权之前瞻 | D19: 时论 | E19: 匿名 | F19: 第1版
A20: =COUNTA($B$2:B20) -> 19 | B20: 12138. | C20: 中国废两改元后感想 | D20: 时论 | E20: 锡桢 | F20: 第1版
A21: =COUNTA($B$2:B21) -> 20 | B21: 12139. | C21: 裁军会议与英国 | D21: 时论 | E21: 匿名 | F21: 第1版
A22: =COUNTA($B$2:B22) -> 21 | B22: 12141. | C22: 我国医学宜振兴 | D22: 论说 | E22: 匿名 | F22: 第1版
A23: =COUNTA($B$2:B23) -> 22 | B23: 12142. | C23: 德意志恢复旧国旗 | D23: 时论 | E23: 匿名 | F23: 第1版
A24: =COUNTA($B$2:B24) -> 23 | B24: 12143. | C24: 剿匪之善后 | D24: 论说 | E24: 匿名 | F24: 第1版
A25: =COUNTA($B$2:B25) -> 24 | B25: 12144. | C25: 中国行政院长问题应速决 | D25: 时论 | E25: 匿名 | F25: 第1版
A26: =COUNTA($B$2:B26) -> 25 | B26: 12145. | C26: 中国开放政权的希望 | D26: 时论 | E26: 匿名 | F26: 第1版
A27: =COUNTA($B$2:B27) -> 26 | B27: 12146. | C27: 兴特勒的成功 | D27: 时论 | E27: 匿名 | F27: 第1版
A28: =COUNTA($B$2:B28) -> 27 | B28: 12148. | C28: 读江苏事业志感言 | D28: 时论 | E28: 浩然 | F28: 第1版
A29: =COUNTA($B$2:B29) -> 28 | B29: 12149. | C29: 顺兴当劫案感言 | D29: 论说 | E29: 匿名 | F29: 第1版
A30: =COUNTA($B$2:B30) -> 29 | B30: 12151. | C30: 中国提前召集国民大会 | D30: 时论 | E30: 匿名 | F30: 第1版
A31: =COUNTA($B$2:B31) -> 30 | B31: 12152. | C31: 德国排斥犹太人 | D31: 短评 | E31: 傲霜庵 | F31: 第1版
C32: 谣言中之杰作 | D32: 短评 | E32: 傲霜庵 | F32: 第1版
C33: 四英人被绑事件 | D33: 短评 | E33: 傲霜庵 | F33: 第1版
A34: =COUNTA($B$2:B34) -> 31 | B34: 12153. | C34: 政治之需要（一） | D34: 论说 | E34: 匿名 | F34: 第1版
A35: =COUNTA($B$2:B35) -> 32 | B35: 12155. | C35: 京东铁路竟被遮断 | D35: 论说 | E35: 傲霜庵 | F35: 第1版
A36: =COUNTA($B$2:B36) -> 33 | B36: 12156. | C36: 美国将兴大海军 | D36: 短评 | E36: 傲霜庵 | F36: 第1版
A37: =COUNTA($B$2:B37) -> 34 | B37: 12157. | C37: 从速肃清八股余毒 | D37: 时论 | E37: 匿名 | F37: 第1版
A38: =COUNTA($B$2:B38) -> 35 | B38: 12158. | C38: 中国设惩贪专庭感言 | D38: 论说 | E38: 匿名 | F38: 第1版
A39: =COUNTA($B$2:B39) -> 36 | B39: 12159. | C39: 张学良出洋 | D39: 短评 | E39: 傲霜庵 | F39: 第1版
A40: =COUNTA($B$2:B40) -> 37 | B40: 12160. | C40: 牺牲之罪恶 | D40: 论说 | E40: 匿名 | F40: 第1版
A41: =COUNTA($B$2:B41) -> 38 | B41: 12162. | C41: 国币范围之扩大 | D41: 短评 | E41: 傲霜庵 | F41: 第1版
C42: 美国酒禁已开 | D42: 短评 | E42: 傲霜庵 | F42: 第1版
C43: 大豆新种之试植 | D43: 短评 | E43: 傲霜庵 | F43: 第1版
A44: =COUNTA($B$2:B44) -> 39 | B44: 12163. | C44: 失业问题 | D44: 论说 | E44: 匿名 | F44: 第1版
A45: =COUNTA($B$2:B45) -> 40 | B45: 12164. | C45: 满洲国与西人被绑 | D45: 论说 | E45: 傲霜庵 | F45: 第1版
A46: =COUNTA($B$2:B46) -> 41 | B46: 12165. | C46: 我们要个负责任的政府 | D46: 时论 | E46: 转录天津《益世報》 | F46: 第1版
A47: =COUNTA($B$2:B47) -> 42 | B47: 12166. | C47: 敬读执政教书 | D47: 短评 | E47: 傲霜庵 | F47: 第1版
C48: 醉汉估价之铁路 | D48: 短评 | E48: 傲霜庵 | F48: 第1版
C49: 财政益行稳固 | D49: 短评 | E49: 傲霜庵 | F49: 第1版
C50: 世界不安时代 | D50: 短评 | E50: 傲霜庵 | F50: 第1版
A51: =COUNTA($B$2:B51) -> 43 | B51: 12167. | C51: 自卫团组织之注意 | D51: 论说 | E51: 匿名 | F51: 第1版
A52: =COUNTA($B$2:B52) -> 44 | B52: 12169. | C52: 政府应负抗日供应全责 | D52: 时论 | E52: 转录天津《益世報》 | F52: 第1版
A53: =COUNTA($B$2:B53) -> 45 | B53: 12170. | C53: 美京预商之前途 | D53: 论说 | E53: 傲霜庵 | F53: 第1版
A54: =COUNTA($B$2:B54) -> 46 | B54: 12171. | C54: 极东之女面狮身像 | D54: 论说 | E54: 傲霜庵 | F54: 第1版
A55: =COUNTA($B$2:B55) -> 47 | B55: 12172. | C55: 生活艰难之所由来 | D55: 论说 | E55: 匿名 | F55: 第1版
A56: =COUNTA($B$2:B56) -> 48 | B56: 12173. | C56: 致治在得人 | D56: 论说 | E56: 匿名 | F56: 第1版
A57: =COUNTA($B$2:B57) -> 49 | B57: 12176. | C57: 杂论（一） | D57: 论说 | E57: 匿名 | F57: 第1版
A58: =COUNTA($B$2:B58) -> 50 | B58: 12177. | C58: 中国为政者勿忘农民 | D58: 时论 | E58: 匿名 | F58: 第1版
A59: =COUNTA($B$2:B59) -> 51 | B59: 12178. | C59: 陈独秀等一案判决议 | D59: 时论 | E59: 匿名 | F59: 第1版
A60: =COUNTA($B$2:B60) -> 52 | B60: 12179. | C60: 黄金为崇（上） | D60: 时论 | E60: 匿名 | F60: 第1版
A61: =COUNTA($B$2:B61) -> 53 | B61: 12180. | C61: 黄金为崇（下） | D61: 时论 | E61: 匿名 | F61: 第1版
A62: =COUNTA($B$2:B62) -> 54 | B62: 12181. | C62: 时局的趋势 | D62: 论说 | E62: 匿名 | F62: 第1版
A63: =COUNTA($B$2:B63) -> 55 | B63: 12183. | C63: 中国农村衰颓之因果 | D63: 时论 | E63: 匿名 | F63: 第1版
A64: =COUNTA($B$2:B64) -> 56 | B64: 12184. | C64: 世界经济战与中国（上） | D64: 时论 | E64: 顾季高 | F64: 第1版
A65: =COUNTA($B$2:B65) -> 57 | B65: 12185. | C65: 世界经济战与中国（下） | D65: 时论 | E65: 顾季高 | F65: 第1版
A66: =COUNTA($B$2:B66) -> 58 | B66: 12186. | C66: 消弭隐患之私见 | D66: 论说 | E66: 匿名 | F66: 第1版
A67: =COUNTA($B$2:B67) -> 59 | B67: 12187. | C67: 复兴农村委员会召开 | D67: 时论 | E67: 匿名 | F67: 第1版
A68: =COUNTA($B$2:B68) -> 60 | B68: 12188. | C68: 德京马战山出现 | D68: 短评 | E68: 傲霜庵 | F68: 第1版
C69: 张学良抵罗马 | D69: 短评 | E69: 傲霜庵 | F69: 第1版
C70: 南京与苏俄卖路 | D70: 短评 | E70: 傲霜庵 | F70: 第1版
A71: =COUNTA($B$2:B71) -> 61 | B71: 12190. | C71: 中国政治之实际画 | D71: 时论 | E71: 匿名 | F71: 第1版
A72: =COUNTA($B$2:B72) -> 62 | B72: 12191. | C72: 惊异之见闻 | D72: 论说 | E72: 匿名 | F72: 第1版
A73: =COUNTA($B$2:B73) -> 63 | B73: 12192. | C73: 苏俄外交之大转机 | D73: 论说 | E73: 傲霜庵 | F73: 第1版
A74: =COUNTA($B$2:B74) -> 64 | B74: 12193. | C74: 苏俄外交之大转机（续） | D74: 论说 | E74: 傲霜庵 | F74: 第1版
A75: =COUNTA($B$2:B75) -> 65 | B75: 12194. | C75: 双管齐下之危险 | D75: 短评 | E75: 傲霜庵 | F75: 第1版
C76: 日军已渡辽河 | D76: 短评 | E76: 傲霜庵 | F76: 第1版
C77: 朱伶被砲弹光顾 | D77: 短评 | E77: 傲霜庵 | F77: 第1版
C78: 党国之颠倒本末 | D78: 短评 | E78: 傲霜庵 | F78: 第1版
C79: 华行政院将组民食委员会 | D79: 短评 | E79: 傲霜庵 | F79: 第1版
A80: =COUNTA($B$2:B80) -> 66 | B80: 12195. | C80: 限制军人当选总统问题 | D80: 时论 | E80: 匿名 | F80: 第1版
A81: =COUNTA($B$2:B81) -> 67 | B81: 12197. | C81: 德俄和亲 | D81: 时论 | E81: 匿名 | F81: 第1版
A82: =COUNTA($B$2:B82) -> 68 | B82: 12198. | C82: 妄费与浪费 | D82: 论说 | E82: 匿名 | F82: 第1版
A83: =COUNTA($B$2:B83) -> 69 | B83: 12199. | C83: 无意义之极 国人对与内战之谬误观念 | D83: 论说 | E83: 匿名 | F83: 第1版
A84: =COUNTA($B$2:B84) -> 70 | B84: 12200. | C84: 军缩前途悲观 | D84: 时论 | E84: 匿名 | F84: 第1版
A85: =COUNTA($B$2:B85) -> 71 | B85: 12201. | C85: 中国乡村工作 | D85: 时论 | E85: 梁漱溟 | F85: 第1版
A86: =COUNTA($B$2:B86) -> 72 | B86: 12202. | C86: 中国贩卖妇孺问题（上） | D86: 时论 | E86: 垒 | F86: 第1版
A87: =COUNTA($B$2:B87) -> 73 | B87: 12204. | C87: 中国贩卖妇孺问题（下） | D87: 时论 | E87: 垒 | F87: 第1版
A88: =COUNTA($B$2:B88) -> 74 | B88: 12205. | C88: 中外同庆升平 | D88: 短评 | E88: 傲霜庵 | F88: 第1版
C89: 一面抵抗的破产 | D89: 短评 | E89: 傲霜庵 | F89: 第1版
C90: 废止地方党费 | D90: 短评 | E90: 傲霜庵 | F90: 第1版
A91: =COUNTA($B$2:B91) -> 75 | B91: 12206. | C91: 薄税敛赘说 | D91: 论说 | E91: 匿名 | F91: 第1版
A92: =COUNTA($B$2:B92) -> 76 | B92: 12207. | C92: 老冯崛起反对中央 | D92: 论说 | E92: 傲霜庵 | F92: 第1版
A93: =COUNTA($B$2:B93) -> 77 | B93: 12208. | C93: 极东和平之曙光 | D93: 论说 | E93: 傲霜庵 | F93: 第1版
A94: =COUNTA($B$2:B94) -> 78 | B94: 12209. | C94: 论公众防疫 | D94: 论说 | E94: 匿名 | F94: 第1版
A95: =COUNTA($B$2:B95) -> 79 | B95: 12211. | C95: 冯玉祥通电与国事前途 | D95: 论说 | E95: 匿名 | F95: 第1版
A96: =COUNTA($B$2:B96) -> 80 | B96: 12212. | C96: 汽车极宜设法取缔 | D96: 论说 | E96: 匿名 | F96: 第1版
A97: =COUNTA($B$2:B97) -> 81 | B97: 12213. | C97: 主义救国 | D97: 时论 | E97: 匿名 | F97: 第1版
A98: =COUNTA($B$2:B98) -> 82 | B98: 12214. | C98: 中国全国代表会展期 | D98: 时论 | E98: 匿名 | F98: 第1版
A99: =COUNTA($B$2:B99) -> 83 | B99: 12215. | C99: 吴稚晖先生 | D99: 短评 | E99: 傲霜庵 | F99: 第1版
C100: 汪精卫先生 | D100: 短评 | E100: 傲霜庵 | F100: 第1版
C101: 冯玉祥将军 | D101: 短评 | E101: 傲霜庵 | F101: 第1版
C102: 宋孙等诸将领 | D102: 短评 | E102: 傲霜庵 | F102: 第1版
A103: =COUNTA($B$2:B103) -> 84 | B103: 12216. | C103: 如有力则 | D103: 论说 | E103: 则 | F103: 第1版
A104: =COUNTA($B$2:B104) -> 85 | B104: 12218. | C104: 世界经济会议 | D104: 论说 | E104: 傲霜庵 | F104: 第1版
A105: =COUNTA($B$2:B105) -> 86 | B105: 12219. | C105: 男女生活观 | D105: 论说 | E105: 匿名 | F105: 第1版
A106: =COUNTA($B$2:B106) -> 87 | B106: 12220. | C106: 官吏之解剖 | D106: 论说 | E106: 匿名 | F106: 第1版
A107: =COUNTA($B$2:B107) -> 88 | B107: 12221. | C107: 美金五千万借款的讨论 | D107: 时论 | E107: 转录天津《益世報》 | F107: 第1版
A108: =COUNTA($B$2:B108) -> 89 | B108: 12222. | C108: 调剂中国农村金融 | D108: 时论 | E108: 匿名 | F108: 第1版
A109: =COUNTA($B$2:B109) -> 90 | B109: 12223. | C109: 砂漠政策 | D109: 论说 | E109: 丐 | F109: 第1版
A110: =COUNTA($B$2:B110) -> 91 | B110: 12225. | C110: 伦敦会议之奇观 | D110: 论说 | E110: 傲霜庵 | F110: 第1版
C111: 老冯将离张垣 | D111: 论说 | E111: 傲霜庵 | F111: 第1版
C112: 殖品地之危机 | D112: 论说 | E112: 傲霜庵 | F112: 第1版
A113: =COUNTA($B$2:B113) -> 94 | B113: 12227. | C113: 官吏之保障与法定储备 | D113: 论说 | E113: 匿名 | F113: 第1版
A114: =COUNTA($B$2:B114) -> 95 | B114: 12228. | C114: 流寇史观 | D114: 论说 | E114: 匿名 | F114: 第1版
A115: =COUNTA($B$2:B115) -> 96 | B115: 12229. | C115: 评大桥次长弹劾案 | D115: 论说 | E115: 傲霜庵 | F115: 第1版
A116: =COUNTA($B$2:B116) -> 97 | B116: 12230. | C116: 反对层出不穷的外债 | D116: 时论 | E116: 转录华报 | F116: 第1版
A117: =COUNTA($B$2:B117) -> 98 | B117: 12232. | C117: 中国农村之根本问题 | D117: 时论 | E117: 匿名 | F117: 第1版
A118: =COUNTA($B$2:B118) -> 99 | B118: 12233. | C118: 打倒贪官污吏 | D118: 论说 | E118: 傲霜庵 | F118: 第1版
A119: =COUNTA($B$2:B119) -> 100 | B119: 12234. | C119: 打倒贪官污吏 | D119: 论说 | E119: 傲霜庵 | F119: 第1版
A120: =COUNTA($B$2:B120) -> 101 | B120: 12235. | C120: 利用民族特长以谋发展 | D120: 论说 | E120: 匿名 | F120: 第1版
A121: =COUNTA($B$2:B121) -> 102 | B121: 12236. | C121: 说运动 | D121: 论说 | E121: 匿名 | F121: 第1版
A122: =COUNTA($B$2:B122) -> 103 | B122: 12237. | C122: 防救水灾勿忘治本 | D122: 时论 | E122: 匿名 | F122: 第1版
A123: =COUNTA($B$2:B123) -> 104 | B123: 12239. | C123: 为马案进一辞 | D123: 论说 | E123: 儒丐 | F123: 第1版
A124: =COUNTA($B$2:B124) -> 105 | B124: 12240. | C124: 水患极宜预防 | D124: 论说 | E124: 匿名 | F124: 第1版
A125: =COUNTA($B$2:B125) -> 106 | B125: 12241. | C125: 美国与世界经济 | D125: 时论 | E125: 宝 | F125: 第1版
A126: =COUNTA($B$2:B126) -> 107 | B126: 12242. | C126: 大连会议成功 | D126: 短评 | E126: 傲霜庵 | F126: 第1版
C127: 东北舰队之改名 | D127: 短评 | E127: 傲霜庵 | F127: 第1版
C128: 市长与舰队司令 | D128: 短评 | E128: 傲霜庵 | F128: 第1版
C129: 北铁股价之悬殊 | D129: 短评 | E129: 傲霜庵 | F129: 第1版
A130: =COUNTA($B$2:B130) -> 108 | B130: 12243. | C130: 县治 | D130: 论说 | E130: 匿名 | F130: 第1版
A131: =COUNTA($B$2:B131) -> 109 | B131: 12244. | C131: 对美二万万之借款 | D131: 短评 | E131: 傲霜庵 | F131: 第1版
C132: 察事渐成僵局 | D132: 短评 | E132: 傲霜庵 | F132: 第1版
C133: 南辕北辙之会议 | D133: 短评 | E133: 傲霜庵 | F133: 第1版
C134: 德京怪飞行机 | D134: 短评 | E134: 傲霜庵 | F134: 第1版
A135: =COUNTA($B$2:B135) -> 110 | B135: 12246. | C135: 争民之战 | D135: 时论 | E135: 匿名 | F135: 第1版
A136: =COUNTA($B$2:B136) -> 111 | B136: 12247. | C136: 大法小廉 | D136: 论说 | E136: 匿名 | F136: 第1版
A137: =COUNTA($B$2:B137) -> 112 | B137: 12248. | C137: 抗捐军起于四川 | D137: 时论 | E137: 匿名 | F137: 第1版
A138: =COUNTA($B$2:B138) -> 113 | B138: 12249. | C138: 日货与世界市场 | D138: 论说 | E138: 傲霜庵 | F138: 第1版
A139: =COUNTA($B$2:B139) -> 114 | B139: 12250. | C139: 新疆之不幸事件 | D139: 时论 | E139: 匿名 | F139: 第1版
A140: =COUNTA($B$2:B140) -> 115 | B140: 12251. | C140: 国际智识 | D140: 论说 | E140: 匿名 | F140: 第1版
A141: =COUNTA($B$2:B141) -> 116 | B141: 12253. | C141: 教育上重实轻文的趋势 | D141: 时论 | E141: 匿名 | F141: 第1版
A142: =COUNTA($B$2:B142) -> 117 | B142: 12254. | C142: 劳力之于满洲国 | D142: 论说 | E142: 匿名 | F142: 第1版
A143: =COUNTA($B$2:B143) -> 118 | B143: 12255. | C143: 世界之于中国 | D143: 短评 | E143: 傲霜庵 | F143: 第1版
C144: 美法希望通汇 | D144: 短评 | E144: 傲霜庵 | F144: 第1版
C145: 满洲国大官返国 | D145: 短评 | E145: 傲霜庵 | F145: 第1版
C146: 法国之新领土 | D146: 短评 | E146: 傲霜庵 | F146: 第1版
A147: =COUNTA($B$2:B147) -> 119 | B147: 12256. | C147: 对扩充空军的怀疑（上） | D147: 时论 | E147: 转录天津《益世報》 | F147: 第1版
A148: =COUNTA($B$2:B148) -> 120 | B148: 12257. | C148: 对扩充空军的怀疑（下） | D148: 时论 | E148: 转录天津《益世報》 | F148: 第1版
A149: =COUNTA($B$2:B149) -> 121 | B149: 12258. | C149: 敬告青年 | D149: 论说 | E149: 匿名 | F149: 第1版
A150: =COUNTA($B$2:B150) -> 122 | B150: 12260. | C150: 祝满洲博览会开幕 | D150: 论说 | E150: 傲霜庵 | F150: 第1版
A151: =COUNTA($B$2:B151) -> 123 | B151: 12261. | C151: 清心寡欲 | D151: 论说 | E151: 匿名 | F151: 第1版
A152: =COUNTA($B$2:B152) -> 124 | B152: 12262. | C152: 汤某断不可赦 | D152: 短评 | E152: 傲霜庵 | F152: 第1版
C153: 摩登将军学航空 | D153: 短评 | E153: 傲霜庵 | F153: 第1版
C154: 中国太平洋景象 | D154: 短评 | E154: 傲霜庵 | F154: 第1版
C155: 突泉县将改名 | D155: 短评 | E155: 傲霜庵 | F155: 第1版
A156: =COUNTA($B$2:B156) -> 125 | B156: 12263. | C156: 无业与失业 | D156: 论说 | E156: 匿名 | F156: 第1版
A157: =COUNTA($B$2:B157) -> 126 | B157: 12264. | C157: 弟武藤元帅 | D157: 论说 | E157: 傲霜庵 | F157: 第1版
A158: =COUNTA($B$2:B158) -> 127 | B158: 12265. | C158: 故宫舞弊案 | D158: 时论 | E158: 匿名 | F158: 第1版
A159: =COUNTA($B$2:B159) -> 128 | B159: 12267. | C159: 投资二十万元 | D159: 短评 | E159: 傲霜庵 | F159: 第1版
C160: 古物可望追回 | D160: 短评 | E160: 傲霜庵 | F160: 第1版
C161: 欧美与战争胁危 | D161: 短评 | E161: 傲霜庵 | F161: 第1版
A162: =COUNTA($B$2:B162) -> 129 | B162: 12268. | C162: 论苛捐杂税之必宜黜免 | D162: 论说 | E162: 匿名 | F162: 第1版
A163: =COUNTA($B$2:B163) -> 130 | B163: 12269. | C163: 美代表赴英之旅费问题 | D163: 时论 | E163: 转录天津《大公报》 | F163: 第1版
A164: =COUNTA($B$2:B164) -> 131 | B164: 12270. | C164: 满洲国贸易兴旺 | D164: 短评 | E164: 傲霜庵 | F164: 第1版
C165: 爱因斯坦与英人 | D165: 短评 | E165: 傲霜庵 | F165: 第1版
C166: 甘地又入狱 | D166: 短评 | E166: 傲霜庵 | F166: 第1版
A167: =COUNTA($B$2:B167) -> 132 | B167: 12271. | C167: 发展中国农村教育 | D167: 时论 | E167: 匿名 | F167: 第1版
A168: =COUNTA($B$2:B168) -> 133 | B168: 12272. | C168: 南洋九屿问题 | D168: 论说 | E168: 傲霜庵 | F168: 第1版
A169: =COUNTA($B$2:B169) -> 134 | B169: 12274. | C169: 万泉河畔大惨剧 | D169: 论说 | E169: 傲霜庵 | F169: 第1版
A170: =COUNTA($B$2:B170) -> 135 | B170: 12275. | C170: 整肃军纪之必要 | D170: 论说 | E170: 匿名 | F170: 第1版
A171: =COUNTA($B$2:B171) -> 136 | B171: 12276. | C171: 满洲国之无形承认 | D171: 论说 | E171: 傲霜庵 | F171: 第1版
A172: =COUNTA($B$2:B172) -> 137 | B172: 12277. | C172: 点金有术之中国 | D172: 短评 | E172: 傲霜庵 | F172: 第1版
C173: 日军尽回长城线 | D173: 短评 | E173: 傲霜庵 | F173: 第1版
C174: 中国与九岛屿 | D174: 短评 | E174: 傲霜庵 | F174: 第1版
A175: =COUNTA($B$2:B175) -> 138 | B175: 12278. | C175: 不供内战 | D175: 时论 | E175: 转录天津《益世報》 | F175: 第1版
A176: =COUNTA($B$2:B176) -> 139 | B176: 12279. | C176: 论廉洁 | D176: 时论 | E176: 楚 | F176: 第1版
A177: =COUNTA($B$2:B177) -> 140 | B177: 12281. | C177: 满日实业垦谈会 | D177: 论说 | E177: 傲霜庵 | F177: 第1版
A178: =COUNTA($B$2:B178) -> 141 | B178: 12282. | C178: 论取缔游民 | D178: 论说 | E178: 匿名 | F178: 第1版
A179: =COUNTA($B$2:B179) -> 142 | B179: 12283. | C179: 古巴革命政潮 | D179: 短评 | E179: 傲霜庵 | F179: 第1版
C180: 犹太人禁止洗澡 | D180: 短评 | E180: 傲霜庵 | F180: 第1版
C181: 徐世昌抵大连？ | D181: 短评 | E181: 傲霜庵 | F181: 第1版
A182: =COUNTA($B$2:B182) -> 143 | B182: 12284. | C182: 旧医尚可改造耶？ | D182: 时论 | E182: 匿名 | F182: 第1版
A183: =COUNTA($B$2:B183) -> 144 | B183: 12285. | C183: 中国与航空计划 | D183: 论说 | E183: 傲霜庵 | F183: 第1版
A184: =COUNTA($B$2:B184) -> 145 | B184: 12286. | C184: 中国与航空计划 | D184: 论说 | E184: 傲霜庵 | F184: 第1版
A185: =COUNTA($B$2:B185) -> 146 | B185: 12288. | C185: 中国外交之转机 | D185: 短评 | E185: 傲霜庵 | F185: 第1版
C186: 洋人，洋楼，洋服 | D186: 短评 | E186: 傲霜庵 | F186: 第1版
A187: =COUNTA($B$2:B187) -> 147 | B187: 12289. | C187: 诤臣诤友 | D187: 论说 | E187: 匿名 | F187: 第1版
A188: =COUNTA($B$2:B188) -> 148 | B188: 12290. | C188: 老优冯玉祥 | D188: 论说 | E188: 傲霜庵 | F188: 第1版
A189: =COUNTA($B$2:B189) -> 149 | B189: 12291. | C189: 芝城博览会中的中国 | D189: 时论 | E189: 转录天津《益世報》 | F189: 第1版
A190: =COUNTA($B$2:B190) -> 150 | B190: 12292. | C190: 甘地又被释放 | D190: 短评 | E190: 傲霜庵 | F190: 第1版
C191: 宋子文将访日本 | D191: 短评 | E191: 傲霜庵 | F191: 第1版
C192: 下落究竟如何 | D192: 短评 | E192: 傲霜庵 | F192: 第1版
A193: =COUNTA($B$2:B193) -> 151 | B193: 12293. | C193: 国联合作与国家组织 | D193: 时论 | E193: 匿名 | F193: 第1版
A194: =COUNTA($B$2:B194) -> 152 | B194: 12295. | C194: 宋子文不登岸 | D194: 短评 | E194: 傲霜庵 | F194: 第1版
C195: 衣食皆仰给外洋 | D195: 短评 | E195: 傲霜庵 | F195: 第1版
C196: 棉被借款之影响 | D196: 短评 | E196: 傲霜庵 | F196: 第1版
C197: 悲剧 | D197: 短评 | E197: 傲霜庵 | F197: 第1版
A198: =COUNTA($B$2:B198) -> 153 | B198: 12296. | C198: 导民 | D198: 论说 | E198: 匿名 | F198: 第1版
A199: =COUNTA($B$2:B199) -> 154 | B199: 12297. | C199: 黄河问题 | D199: 时论 | E199: 匿名 | F199: 第1版
A200: =COUNTA($B$2:B200) -> 155 | B200: 12298. | C200: 对筹印四库珍本之希望 | D200: 时论 | E200: 匿名 | F200: 第1版
A201: =COUNTA($B$2:B201) -> 156 | B201: 12299. | C201: 黄河水灾与赈济 | D201: 论说 | E201: 傲霜庵 | F201: 第1版
A202: =COUNTA($B$2:B202) -> 157 | B202: 12300. | C202: 一千六百八十万剿赤费 | D202: 时论 | E202: 匿名 | F202: 第1版
A203: =COUNTA($B$2:B203) -> 158 | B203: 12303. | C203: 论盂兰盆 | D203: 论说 | E203: 匿名 | F203: 第1版
A204: =COUNTA($B$2:B204) -> 159 | B204: 12304. | C204: 独占盈利之是非 | D204: 论说 | E204: 傲霜庵 | F204: 第1版
A205: =COUNTA($B$2:B205) -> 160 | B205: 12305. | C205: 民主？寡头？独裁？ | D205: 时论 | E205: 匿名 | F205: 第1版
A206: =COUNTA($B$2:B206) -> 161 | B206: 12306. | C206: 收拾察哈之新教训 | D206: 时论 | E206: 转录天津《大公报》 | F206: 第1版
A207: =COUNTA($B$2:B207) -> 162 | B207: 12307. | C207: 南昌号匪案解决 | D207: 论说 | E207: 傲霜庵 | F207: 第1版
A208: =COUNTA($B$2:B208) -> 163 | B208: 12309. | C208: 怎样利用天下物力财力？ | D208: 时论 | E208: 匿名 | F208: 第1版
A209: =COUNTA($B$2:B209) -> 164 | B209: 12310. | C209: 是非利害 | D209: 论说 | E209: 匿名 | F209: 第1版
A210: =COUNTA($B$2:B210) -> 165 | B210: 12311. | C210: 法人触手与满洲国 | D210: 论说 | E210: 傲霜庵 | F210: 第1版
A211: =COUNTA($B$2:B211) -> 166 | B211: 12314. | C211: 古巴革命与美国 | D211: 短评 | E211: 傲霜庵 | F211: 第1版
C212: 日本外相易人 | D212: 短评 | E212: 傲霜庵 | F212: 第1版
C213: 抗日英雄之末路 | D213: 短评 | E213: 傲霜庵 | F213: 第1版
A214: =COUNTA($B$2:B214) -> 167 | B214: 12316. | C214: 英文满报之谬论 | D214: 论说 | E214: 傲霜庵 | F214: 第1版
A215: =COUNTA($B$2:B215) -> 168 | B215: 12317. | C215: 崇俭 | D215: 论说 | E215: 匿名 | F215: 第1版
A216: =COUNTA($B$2:B216) -> 169 | B216: 12318. | C216: 人类的大敌来临 | D216: 短评 | E216: 傲霜庵 | F216: 第1版
C217: 五太太与头彩 | D217: 短评 | E217: 傲霜庵 | F217: 第1版
C218: 美棉转售日商 | D218: 短评 | E218: 傲霜庵 | F218: 第1版
A219: =COUNTA($B$2:B219) -> 170 | B219: 12319. | C219: 驳京津泰晤士报 | D219: 论说 | E219: 傲霜庵 | F219: 第1版
A220: =COUNTA($B$2:B220) -> 171 | B220: 12320. | C220: 今后之川局 | D220: 时论 | E220: 都 | F220: 第1版
A221: =COUNTA($B$2:B221) -> 172 | B221: 12321. | C221: 须防杂军窜扰 | D221: 短评 | E221: 傲霜庵 | F221: 第1版
C222: 华北形式无变化 | D222: 短评 | E222: 傲霜庵 | F222: 第1版
C223: 蒋介石与东北军 | D223: 短评 | E223: 傲霜庵 | F223: 第1版
C224: 日本对华排货 | D224: 短评 | E224: 傲霜庵 | F224: 第1版
A225: =COUNTA($B$2:B225) -> 173 | B225: 12323. | C225: 丰收成灾时代 | D225: 论说 | E225: 傲霜庵 | F225: 第1版
A226: =COUNTA($B$2:B226) -> 174 | B226: 12324. | C226: 狱囚之教诲与感化 | D226: 论说 | E226: 匿名 | F226: 第1版
A227: =COUNTA($B$2:B227) -> 175 | B227: 12325. | C227: 方吉等流寇尾声 | D227: 短评 | E227: 傲霜庵 | F227: 第1版
C228: 孙陈相见与地下 | D228: 短评 | E228: 傲霜庵 | F228: 第1版
C229: 中国最初之女警 | D229: 短评 | E229: 傲霜庵 | F229: 第1版
C230: 领海外反战会 | D230: 短评 | E230: 傲霜庵 | F230: 第1版
A231: =COUNTA($B$2:B231) -> 176 | B231: 12327. | C231: 纵的中欧观 | D231: 时论 | E231: 匿名 | F231: 第1版
A232: =COUNTA($B$2:B232) -> 177 | B232: 12328. | C232: 北铁交涉之前途 | D232: 短评 | E232: 傲霜庵 | F232: 第1版
C233: 百斯笃入兆南城 | D233: 短评 | E233: 傲霜庵 | F233: 第1版
C234: 国联之自白无能 | D234: 短评 | E234: 傲霜庵 | F234: 第1版
A235: =COUNTA($B$2:B235) -> 178 | B235: 12330. | C235: 顾维钧与中日外交（上） | D235: 论说 | E235: 傲霜庵 | F235: 第1版
A236: =COUNTA($B$2:B236) -> 179 | B236: 12331. | C236: 顾维钧与中日外交（下） | D236: 论说 | E236: 傲霜庵 | F236: 第1版
A237: =COUNTA($B$2:B237) -> 180 | B237: 12333. | C237: 横与目前之严重问题 | D237: 论说 | E237: 匿名 | F237: 第1版
A238: =COUNTA($B$2:B238) -> 181 | B238: 12334. | C238: 蒋公使赴日回任 | D238: 短评 | E238: 傲霜庵 | F238: 第1版
C239: 奥相被刺与欧洲 | D239: 短评 | E239: 傲霜庵 | F239: 第1版
C240: 满洲国货飞机 | D240: 短评 | E240: 傲霜庵 | F240: 第1版
C241: 自然之与人间 | D241: 短评 | E241: 傲霜庵 | F241: 第1版
A242: =COUNTA($B$2:B242) -> 182 | B242: 12335. | C242: 中国统治经济之考察 | D242: 时论 | E242: 匿名 | F242: 第1版
A243: =COUNTA($B$2:B243) -> 183 | B243: 12337. | C243: 中国发行关税券 | D243: 时论 | E243: 匿名 | F243: 第1版
A244: =COUNTA($B$2:B244) -> 184 | B244: 12338. | C244: 论农村经济 | D244: 论说 | E244: 匿名 | F244: 第1版
A245: =COUNTA($B$2:B245) -> 185 | B245: 12339. | C245: 中国与双十节 | D245: 短评 | E245: 傲霜庵 | F245: 第1版
C246: 此逻辑绝无矛盾 | D246: 短评 | E246: 傲霜庵 | F246: 第1版
C247: 借款大王宋子文 | D247: 短评 | E247: 傲霜庵 | F247: 第1版
C248: 偿以县茶如何 | D248: 短评 | E248: 傲霜庵 | F248: 第1版
A249: =COUNTA($B$2:B249) -> 186 | B249: 12340. | C249: 外交文书捏造案 | D249: 论说 | E249: 傲霜庵 | F249: 第1版
A250: =COUNTA($B$2:B250) -> 187 | B250: 12341. | C250: 欧洲暗潮益急 | D250: 短评 | E250: 傲霜庵 | F250: 第1版
C251: 国联大会闭幕 | D251: 短评 | E251: 傲霜庵 | F251: 第1版
C252: 中日共同剿匪 | D252: 短评 | E252: 傲霜庵 | F252: 第1版
A253: =COUNTA($B$2:B253) -> 188 | B253: 12342. | C253: 丰收成灾之我见 | D253: 论说 | E253: 儒丐 | F253: 第1版
A254: =COUNTA($B$2:B254) -> 189 | B254: 12345. | C254: 依附 | D254: 论说 | E254: 匿名 | F254: 第1版
A255: =COUNTA($B$2:B255) -> 190 | B255: 12346. | C255: 满日文化委员会 | D255: 论说 | E255: 傲霜庵 | F255: 第1版
A256: =COUNTA($B$2:B256) -> 191 | B256: 12347. | C256: 国际联盟破产矣 | D256: 短评 | E256: 傲霜庵 | F256: 第1版
C257: 希望苏俄反省 | D257: 短评 | E257: 傲霜庵 | F257: 第1版
C258: 老冯与其部下 | D258: 短评 | E258: 傲霜庵 | F258: 第1版
A259: =COUNTA($B$2:B259) -> 192 | B259: 12348. | C259: 中国人口问题之严重 | D259: 时论 | E259: 匿名 | F259: 第1版
A260: =COUNTA($B$2:B260) -> 193 | B260: 12349. | C260: 关于中国改良省府政制 | D260: 时论 | E260: 匿名 | F260: 第1版
A261: =COUNTA($B$2:B261) -> 194 | B261: 12351. | C261: 剿黑 | D261: 时论 | E261: 匿名 | F261: 第1版
A262: =COUNTA($B$2:B262) -> 195 | B262: 12352. | C262: 统治经济之影响 | D262: 论说 | E262: 匿名 | F262: 第1版
A263: =COUNTA($B$2:B263) -> 196 | B263: 12353. | C263: 当人眼中之满洲国 | D263: 论说 | E263: 傲霜庵 | F263: 第1版
A264: =COUNTA($B$2:B264) -> 197 | B264: 12354. | C264: 故宫舞弊案之新波澜 | D264: 时论 | E264: 匿名 | F264: 第1版
A265: =COUNTA($B$2:B265) -> 198 | B265: 12355. | C265: 法兰西内阁更动 | D265: 短评 | E265: 傲霜庵 | F265: 第1版
C266: 宋财神将辞职 | D266: 短评 | E266: 傲霜庵 | F266: 第1版
C267: 美国苏俄日本 | D267: 短评 | E267: 傲霜庵 | F267: 第1版
C268: 香港与孔诞日 | D268: 短评 | E268: 傲霜庵 | F268: 第1版
C269: 株民谊割须赈灾 | D269: 短评 | E269: 傲霜庵 | F269: 第1版
A270: =COUNTA($B$2:B270) -> 199 | B270: 12356. | C270: 美俄接近之经济的动向 | D270: 时论 | E270: 转录天津《大公报》 | F270: 第1版
A271: =COUNTA($B$2:B271) -> 200 | B271: 12358. | C271: 孙殿英军如何安置 | D271: 时论 | E271: 匿名 | F271: 第1版
A272: =COUNTA($B$2:B272) -> 201 | B272: 12359. | C272: 论民力当休养 | D272: 论说 | E272: 匿名 | F272: 第1版
A273: =COUNTA($B$2:B273) -> 202 | B273: 12360. | C273: 内蒙古自治问题 | D273: 论说 | E273: 傲霜庵 | F273: 第1版
A274: =COUNTA($B$2:B274) -> 203 | B274: 12361. | C274: 内蒙古自治问题（续） | D274: 论说 | E274: 傲霜庵 | F274: 第1版
A275: =COUNTA($B$2:B275) -> 204 | B275: 12362. | C275: 黄金国之买金 | D275: 短评 | E275: 傲霜庵 | F275: 第1版
C276: 独裁之与自由 | D276: 短评 | E276: 傲霜庵 | F276: 第1版
C277: 殖民地分解作用 | D277: 短评 | E277: 傲霜庵 | F277: 第1版
C278: 华北兵饷问题 | D278: 短评 | E278: 傲霜庵 | F278: 第1版
A279: =COUNTA($B$2:B279) -> 205 | B279: 12363. | C279: 英国与对满投资 | D279: 短评 | E279: 傲霜庵 | F279: 第1版
C280: 满苏抗争之余波 | D280: 短评 | E280: 傲霜庵 | F280: 第1版
C281: 返满者项背相望 | D281: 短评 | E281: 傲霜庵 | F281: 第1版
C282: 孔祥熙任为财长 | D282: 短评 | E282: 傲霜庵 | F282: 第1版
A283: =COUNTA($B$2:B283) -> 206 | B283: 12365. | C283: 究竟做何打算？ | D283: 时论 | E283: 转录天津《大公报》 | F283: 第1版
A284: =COUNTA($B$2:B284) -> 207 | B284: 12366. | C284: 室内卫生清洁问题 | D284: 论说 | E284: 匿名 | F284: 第1版
A285: =COUNTA($B$2:B285) -> 208 | B285: 12367. | C285: 自力报复与国力制裁 | D285: 时论 | E285: 匿名 | F285: 第1版
A286: =COUNTA($B$2:B286) -> 209 | B286: 12368. | C286: 对孔财长的希望 | D286: 时论 | E286: 匿名 | F286: 第1版
A287: =COUNTA($B$2:B287) -> 210 | B287: 12369. | C287: 四川匪祸已成燎原 | D287: 时论 | E287: 匿名 | F287: 第1版
A288: =COUNTA($B$2:B288) -> 211 | B288: 12370. | C288: 中国今日之财政 | D288: 时论 | E288: 匿名 | F288: 第1版
A289: =COUNTA($B$2:B289) -> 212 | B289: 12372. | C289: 日俄果相战乎？ | D289: 论说 | E289: 匿名 | F289: 第1版
A290: =COUNTA($B$2:B290) -> 213 | B290: 12373. | C290: 日俄果相战乎？（续） | D290: 论说 | E290: 匿名 | F290: 第1版
A291: =COUNTA($B$2:B291) -> 214 | B291: 12374. | C291: 党国内人间地狱 | D291: 短评 | E291: 傲霜庵 | F291: 第1版
C292: 褐衫当声势大振 | D292: 短评 | E292: 傲霜庵 | F292: 第1版
C293: 国联日暮途穷 | D293: 短评 | E293: 傲霜庵 | F293: 第1版
A294: =COUNTA($B$2:B294) -> 215 | B294: 12375. | C294: 中国之穷干与硬干 | D294: 时论 | E294: 匿名 | F294: 第1版
A295: =COUNTA($B$2:B295) -> 216 | B295: 12376. | C295: 西南新独立运动 | D295: 短评 | E295: 傲霜庵 | F295: 第1版
C296: 亲日派与欧美派 | D296: 短评 | E296: 傲霜庵 | F296: 第1版
C297: 日印交涉未成功 | D297: 短评 | E297: 傲霜庵 | F297: 第1版
A298: =COUNTA($B$2:B298) -> 217 | B298: 12377. | C298: 英人与对华政策 | D298: 说论 | E298: 傲霜庵 | F298: 第1版
A299: =COUNTA($B$2:B299) -> 218 | B299: 12379. | C299: 吾美俄复交观 | D299: 短评 | E299: 傲霜庵 | F299: 第1版
C300: 中国与统制经济 | D300: 短评 | E300: 傲霜庵 | F300: 第1版
C301: 美国的闲电报 | D301: 短评 | E301: 傲霜庵 | F301: 第1版
A302: =COUNTA($B$2:B302) -> 219 | B302: 12380. | C302: 美国农潮之剖解 | D302: 时论 | E302: 匿名 | F302: 第1版
A303: =COUNTA($B$2:B303) -> 220 | B303: 12381. | C303: 苏俄与宗教自由 | D303: 论说 | E303: 傲霜庵 | F303: 第1版
A304: =COUNTA($B$2:B304) -> 221 | B304: 12382. | C304: 南京与新政权 | D304: 短评 | E304: 傲霜庵 | F304: 第1版
C305: 十一月十二日 | D305: 短评 | E305: 傲霜庵 | F305: 第1版
C306: 我是满洲国人 | D306: 短评 | E306: 傲霜庵 | F306: 第1版
C307: 狱中当选之将军 | D307: 短评 | E307: 傲霜庵 | F307: 第1版
A308: =COUNTA($B$2:B308) -> 222 | B308: 12383. | C308: 如何避免时代的悲剧 | D308: 时论 | E308: 匿名 | F308: 第1版
A309: =COUNTA($B$2:B309) -> 223 | B309: 12384. | C309: 箴中国人之三大病（上） | D309: 时论 | E309: 转录天津《益世報》 | F309: 第1版
A310: =COUNTA($B$2:B310) -> 224 | B310: 12386. | C310: 箴中国人之三大病（下） | D310: 时论 | E310: 转录天津《益世報》 | F310: 第1版
A311: =COUNTA($B$2:B311) -> 225 | B311: 12387. | C311: 无线电王莅奉 | D311: 短评 | E311: 傲霜庵 | F311: 第1版
C312: 法国内阁又更动 | D312: 短评 | E312: 傲霜庵 | F312: 第1版
C313: 党内又竟生党 | D313: 短评 | E313: 傲霜庵 | F313: 第1版
A314: =COUNTA($B$2:B314) -> 226 | B314: 12388. | C314: 时局演变的必然性 | D314: 时论 | E314: 转录天津《大公报》 | F314: 第1版
A315: =COUNTA($B$2:B315) -> 227 | B315: 12389. | C315: 从历史上观闽变 | D315: 时论 | E315: 匿名 | F315: 第1版
A316: =COUNTA($B$2:B316) -> 228 | B316: 12390. | C316: 闽省之机会均等 | D316: 短评 | E316: 傲霜庵 | F316: 第1版
C317: 吴稚晖之闽变观 | D317: 短评 | E317: 傲霜庵 | F317: 第1版
C318: 背景化之日本 | D318: 短评 | E318: 傲霜庵 | F318: 第1版
C319: 美总统渐入绝境 | D319: 短评 | E319: 傲霜庵 | F319: 第1版
A320: =COUNTA($B$2:B320) -> 229 | B320: 12391. | C320: 闽变与其重要性 | D320: 短评 | E320: 傲霜庵 | F320: 第1版
A321: =COUNTA($B$2:B321) -> 230 | B321: 12393. | C321: 如何救济中国棉被（上） | D321: 时论 | E321: 匿名 | F321: 第1版
A322: =COUNTA($B$2:B322) -> 231 | B322: 12394. | C322: 如何救济中国棉被（下） | D322: 时论 | E322: 匿名 | F322: 第1版
A323: =COUNTA($B$2:B323) -> 232 | B323: 12395. | C323: 老冯之无本钱 | D323: 短评 | E323: 傲霜庵 | F323: 第1版
C324: 自由通商之今昔 | D324: 短评 | E324: 傲霜庵 | F324: 第1版
A325: =COUNTA($B$2:B325) -> 233 | B325: 12396. | C325: 评满俄建设事业 | D325: 论说 | E325: 傲霜庵 | F325: 第1版
A326: =COUNTA($B$2:B326) -> 234 | B326: 12397. | C326: 国联与改组案 | D326: 短评 | E326: 傲霜庵 | F326: 第1版
C327: 须防内战之扩大 | D327: 短评 | E327: 傲霜庵 | F327: 第1版
C328: 爱尔兰将独立 | D328: 短评 | E328: 傲霜庵 | F328: 第1版
C329: 美国竟为饮酒国 | D329: 短评 | E329: 傲霜庵 | F329: 第1版
C330: 满洲国捐赈灾民 | D330: 短评 | E330: 傲霜庵 | F330: 第1版
A331: =COUNTA($B$2:B331) -> 235 | B331: 12398. | C331: 闽变中标榜之经济主义 | D331: 时论 | E331: 匿名 | F331: 第1版
A332: =COUNTA($B$2:B332) -> 236 | B332: 12400. | C332: 论计口授田 | D332: 时论 | E332: 子明 | F332: 第1版
A333: =COUNTA($B$2:B333) -> 237 | B333: 12401. | C333: 战机逼在眉睫 | D333: 短评 | E333: 傲霜庵 | F333: 第1版
C334: 张学良将回国 | D334: 短评 | E334: 傲霜庵 | F334: 第1版
C335: 中国与香水脂粉 | D335: 短评 | E335: 傲霜庵 | F335: 第1版
C336: 南京将gong于应付 | D336: 短评 | E336: 傲霜庵 | F336: 第1版
C337: 满美金融体提携 | D337: 短评 | E337: 傲霜庵 | F337: 第1版
C338: 买金政策失败 | D338: 短评 | E338: 傲霜庵 | F338: 第1版
A339: =COUNTA($B$2:B339) -> 238 | B339: 12402. | C339: 须输入中国资本 | D339: 论说 | E339: 傲霜庵 | F339: 第1版
A340: =COUNTA($B$2:B340) -> 239 | B340: 12403. | C340: 张学良受大勋章 | D340: 论说 | E340: 傲霜庵 | F340: 第1版
C341: 分闽为四省 | D341: 论说 | E341: 傲霜庵 | F341: 第1版
C342: 英货衰败之原因 | D342: 论说 | E342: 傲霜庵 | F342: 第1版
A343: =COUNTA($B$2:B343) -> 242 | B343: 12404. | C343: 中国之所谓计划者 | D343: 时论 | E343: 转录《北平晨报》 | F343: 第1版
A344: =COUNTA($B$2:B344) -> 243 | B344: 12405. | C344: 新邦教育之基础 | D344: 论说 | E344: 傲霜庵 | F344: 第1版
A345: =COUNTA($B$2:B345) -> 244 | B345: 12407. | C345: 新邦教育之基础（续） | D345: 论说 | E345: 傲霜庵 | F345: 第1版
A346: =COUNTA($B$2:B346) -> 245 | B346: 12408. | C346: 拉滨线完全告成 | D346: 短评 | E346: 傲霜庵 | F346: 第1版
C347: 呜呼 绝对不确 | D347: 短评 | E347: 傲霜庵 | F347: 第1版
C348: 党歌将替国歌 | D348: 短评 | E348: 傲霜庵 | F348: 第1版
C349: 刻薄的宣传办法 | D349: 短评 | E349: 傲霜庵 | F349: 第1版
C350: 秘书仅限三十人 | D350: 短评 | E350: 傲霜庵 | F350: 第1版
A351: =COUNTA($B$2:B351) -> 246 | B351: 12409. | C351: 让贤 | D351: 时论 | E351: 匿名 | F351: 第1版
A352: =COUNTA($B$2:B352) -> 247 | B352: 12410. | C352: 中国煤矿业之危机 | D352: 时论 | E352: 匿名 | F352: 第1版
A353: =COUNTA($B$2:B353) -> 248 | B353: 12412. | C353: 胡汉民氏之今昔 | D353: 时论 | E353: 转录天津《大公报》 | F353: 第1版
A354: =COUNTA($B$2:B354) -> 249 | B354: 12415. | C354: 贪污处死刑 | D354: 时论 | E354: 转录天津《益世報》 | F354: 第1版
A355: =COUNTA($B$2:B355) -> 250 | B355: 12416. | C355: 闽府惨遭重击 | D355: 短评 | E355: 傲霜庵 | F355: 第1版
C356: 北满铁路之冥顽 | D356: 短评 | E356: 傲霜庵 | F356: 第1版
C357: 斤斤与意气之争 | D357: 短评 | E357: 傲霜庵 | F357: 第1版
A358: =COUNTA($B$2:B358) -> 251 | B358: 12417. | C358: 政治急进经济缓缓进 | D358: 时论 | E358: 匿名 | F358: 第1版
A359: =COUNTA($B$2:B359) -> 252 | B359: 12418. | C359: 送岁之辞 | D359: 论说 | E359: 匿名 | F359: 第1版
A360: =COUNTA($B$2:B360) -> 253 | B360: 12425. | C360: 广西民团之利弊观 | D360: 时论 | E360: 匿名 | F360: 第1版
A361: =COUNTA($B$2:B361) -> 254 | B361: 12426. | C361: 四委员南行之报告 | D361: 时论 | E361: 匿名 | F361: 第1版
A362: =COUNTA($B$2:B362) -> 255 | B362: 12428. | C362: 请先废一种最苛之捐 | D362: 时论 | E362: 匿名 | F362: 第1版
A363: =COUNTA($B$2:B363) -> 256 | B363: 12429. | C363: 将如何救济农村经济 | D363: 论说 | E363: 匿名 | F363: 第1版
A364: =COUNTA($B$2:B364) -> 257 | B364: 12430. | C364: 论中国整理田赋 | D364: 时论 | E364: 转录《时事新报》 | F364: 第1版
A365: =COUNTA($B$2:B365) -> 258 | B365: 12431. | C365: 如何挽救新疆局面（上） | D365: 时论 | E365: 匿名 | F365: 第1版
A366: =COUNTA($B$2:B366) -> 259 | B366: 12432. | C366: 如何挽救新疆局面（下） | D366: 时论 | E366: 匿名 | F366: 第1版
A367: =COUNTA($B$2:B367) -> 260 | B367: 12433. | C367: 美国国会开会之前观察（上） | D367: 时论 | E367: 匿名 | F367: 第1版
A368: =COUNTA($B$2:B368) -> 261 | B368: 12435. | C368: 美国国会开会之前观察（下） | D368: 时论 | E368: 匿名 | F368: 第1版
A369: =COUNTA($B$2:B369) -> 262 | B369: 12436. | C369: 矛盾 | D369: 论说 | E369: 匿名 | F369: 第1版
A370: =COUNTA($B$2:B370) -> 263 | B370: 12437. | C370: 闽变告一段落后之政局 | D370: 时论 | E370: 匿名 | F370: 第1版
A371: =COUNTA($B$2:B371) -> 264 | B371: 12438. | C371: 胡汉民之八项主张 | D371: 时论 | E371: 匿名 | F371: 第1版
A372: =COUNTA($B$2:B372) -> 265 | B372: 12439. | C372: 帝制之必然性 | D372: 论说 | E372: 匿名 | F372: 第1版
A373: =COUNTA($B$2:B373) -> 266 | B373: 12442. | C373: 何以治私（上） | D373: 时论 | E373: 匿名 | F373: 第1版
A374: =COUNTA($B$2:B374) -> 267 | B374: 12443. | C374: 何以治私（下） | D374: 时论 | E374: 匿名 | F374: 第1版
A375: =COUNTA($B$2:B375) -> 268 | B375: 12444. | C375: 保富 | D375: 论说 | E375: 匿名 | F375: 第1版
A376: =COUNTA($B$2:B376) -> 269 | B376: 12445. | C376: 现今中国高等教育界应有之任务 | D376: 论说 | E376: 匿名 | F376: 第1版
A377: =COUNTA($B$2:B377) -> 270 | B377: 12446. | C377: 望孙殿英氏自重 | D377: 时论 | E377: 匿名 | F377: 第1版
A378: =COUNTA($B$2:B378) -> 271 | B378: 12447. | C378: 新名词 旧事情 | D378: 时论 | E378: 蒋廷黻---转录天津《大公报》 | F378: 第1版
A379: =COUNTA($B$2:B379) -> 272 | B379: 12449. | C379: 货币战争与中国经济 | D379: 时论 | E379: 慎 | F379: 第1版
A380: =COUNTA($B$2:B380) -> 273 | B380: 12450. | C380: 论裁减自卫团 | D380: 时论 | E380: 匿名 | F380: 第1版
A381: =COUNTA($B$2:B381) -> 274 | B381: 12451. | C381: 中国四中全会的总检讨 | D381: 时论 | E381: 转录天津《益世報》 | F381: 第1版
A382: =COUNTA($B$2:B382) -> 275 | B382: 12452. | C382: 民族意识 | D382: 论说 | E382: 傲霜庵 | F382: 第1版
A383: =COUNTA($B$2:B383) -> 276 | B383: 12453. | C383: 美元平价之裁减 | D383: 短评 | E383: 傲霜庵 | F383: 第1版
C384: 张学良运仍背叛 | D384: 短评 | E384: 傲霜庵 | F384: 第1版
C385: 四十万之大奉天 | D385: 短评 | E385: 傲霜庵 | F385: 第1版
C386: 法国之快车内阁 | D386: 论说 | E386: 傲霜庵 | F386: 第1版
A387: =COUNTA($B$2:B387) -> 278 | B387: 12454. | C387: *尔问题与法德纠纷 | D387: 时论 | E387: 匿名 | F387: 第1版
A388: =COUNTA($B$2:B388) -> 279 | B388: 12456. | C388: 百六十年之藏事史鉴 | D388: 时论 | E388: 匿名 | F388: 第1版
A389: =COUNTA($B$2:B389) -> 280 | B389: 12457. | C389: 箴贪吏 | D389: 论说 | E389: 匿名 | F389: 第1版
A390: =COUNTA($B$2:B390) -> 281 | B390: 12458. | C390: 呜呼不承认主义 | D390: 短评 | E390: 傲霜庵 | F390: 第1版
C391: 苏俄党人之软化 | D391: 短评 | E391: 傲霜庵 | F391: 第1版
C392: 世界罹恐日病 | D392: 短评 | E392: 傲霜庵 | F392: 第1版
A393: =COUNTA($B$2:B393) -> 282 | B393: 12459. | C393: 满洲国与驻外员 | D393: 论说 | E393: 傲霜庵 | F393: 第1版
A394: =COUNTA($B$2:B394) -> 283 | B394: 12460. | C394: 啓连年号私议 | D394: 短评 | E394: 傲霜庵 | F394: 第1版
C395: 法国与大暴动 | D395: 短评 | E395: 傲霜庵 | F395: 第1版
C396: 各种恩恤事件 | D396: 短评 | E396: 傲霜庵 | F396: 第1版
C397: 新疆独立消息 | D397: 短评 | E397: 傲霜庵 | F397: 第1版
A398: =COUNTA($B$2:B398) -> 284 | B398: 12461. | C398: 极东运动大会 | D398: 论说 | E398: 傲霜庵 | F398: 第1版
A399: =COUNTA($B$2:B399) -> 285 | B399: 12463. | C399: 英法间贸易动突之认识 | D399: 时论 | E399: 匿名 | F399: 第1版
A400: =COUNTA($B$2:B400) -> 286 | B400: 12468. | C400: 巴尔干公约 | D400: 时论 | E400: 匿名 | F400: 第1版
A401: =COUNTA($B$2:B401) -> 287 | B401: 12470. | C401: 大暴动后之奥国 | D401: 短评 | E401: 傲霜庵 | F401: 第1版
C402: 群龙有首的内阁 | D402: 短评 | E402: 傲霜庵 | F402: 第1版
C403: 比国皇帝崩逝 | D403: 短评 | E403: 傲霜庵 | F403: 第1版
C404: 赤求益赤之北铁 | D404: 短评 | E404: 傲霜庵 | F404: 第1版
A405: =COUNTA($B$2:B405) -> 288 | B405: 12471. | C405: 大典前臣民所应知之事项 | D405: 论说 | E405: 匿名 | F405: 第1版
A406: =COUNTA($B$2:B406) -> 289 | B406: 12472. | C406: 万国陲政会议 | D406: 论说 | E406: 傲霜庵 | F406: 第1版
A407: =COUNTA($B$2:B407) -> 290 | B407: 12473. | C407: 万国陲政会议（续） | D407: 论说 | E407: 傲霜庵 | F407: 第1版
A408: =COUNTA($B$2:B408) -> 291 | B408: 12474. | C408: 四川剿匪之前途 | D408: 时论 | E408: 匿名 | F408: 第1版
A409: =COUNTA($B$2:B409) -> 292 | B409: 12475. | C409: 敬祝执政万寿 | D409: 短评 | E409: 傲霜庵 | F409: 第1版
C410: 今年凌汛堪虞 | D410: 短评 | E410: 傲霜庵 | F410: 第1版
C411: 世界大乱之祸源 | D411: 短评 | E411: 傲霜庵 | F411: 第1版
C412: 法国、德国、中国 | D412: 短评 | E412: 傲霜庵 | F412: 第1版
C413: 五万元与鸠山 | D413: 短评 | E413: 傲霜庵 | F413: 第1版
A414: =COUNTA($B$2:B414) -> 293 | B414: 12477. | C414: 自抗日---知日 | D414: 论说 | E414: 傲霜庵 | F414: 第1版
A415: =COUNTA($B$2:B415) -> 294 | B415: 12478. | C415: 苏俄变更态度 | D415: 短评 | E415: 傲霜庵 | F415: 第1版
C416: 英美与承认问题 | D416: 短评 | E416: 傲霜庵 | F416: 第1版
C417: 评中立水带 | D417: 短评 | E417: 傲霜庵 | F417: 第1版
A418: =COUNTA($B$2:B418) -> 295 | B418: 12482. | C418: 英军入侵滇边葫芦王地 | D418: 时论 | E418: 廷 | F418: 第1版
A419: =COUNTA($B$2:B419) -> 296 | B419: 12484. | C419: 帝制与世界舆论 | D419: 论说 | E419: 傲霜庵 | F419: 第1版
A420: =COUNTA($B$2:B420) -> 297 | B420: 12485. | C420: 匪之解剖 | D420: 论说 | E420: 匿名 | F420: 第1版
A421: =COUNTA($B$2:B421) -> 298 | B421: 12486. | C421: 英议员之愚论 | D421: 短评 | E421: 傲霜庵 | F421: 第1版
C422: 帝制与南京政府 | D422: 短评 | E422: 傲霜庵 | F422: 第1版
C423: 日飞机被击事件 | D423: 短评 | E423: 傲霜庵 | F423: 第1版
C424: 评论中国宪法草案 | D424: 短评 | E424: 傲霜庵 | F424: 第1版
C425: 不容混为一谈 | D425: 短评 | E425: 傲霜庵 | F425: 第1版
A426: =COUNTA($B$2:B426) -> 299 | B426: 12487. | C426: 德国欲订商约 | D426: 短评 | E426: 傲霜庵 | F426: 第1版
C427: 难产的北铁交涉 | D427: 短评 | E427: 傲霜庵 | F427: 第1版
C428: 飞行非复冒险 | D428: 短评 | E428: 傲霜庵 | F428: 第1版
C429: 失业者与灾民 | D429: 短评 | E429: 傲霜庵 | F429: 第1版
C430: 砍伐天坛古柏 | D430: 短评 | E430: 傲霜庵 | F430: 第1版
A431: =COUNTA($B$2:B431) -> 300 | B431: 12488. | C431: 如何应付美国白银政策 | D431: 时论 | E431: 转录天津《大公报》 | F431: 第1版
A432: =COUNTA($B$2:B432) -> 301 | B432: 12489. | C432: 门户闭锁机会不均 | D432: 论说 | E432: 傲霜庵 | F432: 第1版
A433: =COUNTA($B$2:B433) -> 302 | B433: 12491. | C433: 建设时期之入超 | D433: 短评 | E433: 傲霜庵 | F433: 第1版
C434: 余款一千五百万 | D434: 短评 | E434: 傲霜庵 | F434: 第1版
C435: 弭兵是一种幻想 | D435: 短评 | E435: 傲霜庵 | F435: 第1版
C436: 亲美政策之代价 | D436: 短评 | E436: 傲霜庵 | F436: 第1版
A437: =COUNTA($B$2:B437) -> 303 | B437: 12492. | C437: 吸集游资以供建设 | D437: 论说 | E437: 匿名 | F437: 第1版
A438: =COUNTA($B$2:B438) -> 304 | B438: 12493. | C438: 蒋介石与西南派 | D438: 短评 | E438: 傲霜庵 | F438: 第1版
C439: 独裁文化之世界潮流 | D439: 短评 | E439: 傲霜庵 | F439: 第1版
C440: 中国化之贪污丑（chou)案 | D440: 短评 | E440: 傲霜庵 | F440: 第1版
C441: 美总统与失业者 | D441: 短评 | E441: 傲霜庵 | F441: 第1版
A442: =COUNTA($B$2:B442) -> 308 | B442: 12494. | C442: 华侨问题之严重 | D442: 时论 | E442: 匿名 | F442: 第1版
A443: =COUNTA($B$2:B443) -> 309 | B443: 12495. | C443: 俄飞机越境降落 | D443: 短评 | E443: 傲霜庵 | F443: 第1版
C444: 代书肆大宣传 | D444: 短评 | E444: 傲霜庵 | F444: 第1版
C445: 鸦片是好名词 | D445: 短评 | E445: 傲霜庵 | F445: 第1版
C446: 有是有的不要紧 | D446: 短评 | E446: 傲霜庵 | F446: 第1版
A447: =COUNTA($B$2:B447) -> 313 | B447: 12498. | C447: 中国与满洲帝国 | D447: 短评 | E447: 傲霜庵 | F447: 第1版
C448: 送郑熙两使东游 | D448: 短评 | E448: 傲霜庵 | F448: 第1版
C449: 大典影片遍与欧美 | D449: 短评 | E449: 傲霜庵 | F449: 第1版
A450: =COUNTA($B$2:B450) -> 316 | B450: 12499. | C450: 所谓承认满洲国谣言 | D450: 时评 | E450: 转录天津《益世報》 | F450: 第1版
A451: =COUNTA($B$2:B451) -> 317 | B451: 12500. | C451: 恩赦 | D451: 论说 | E451: 匿名 | F451: 第1版
A452: =COUNTA($B$2:B452) -> 318 | B452: 12501. | C452: 棉麦借款之教训 | D452: 时论 | E452: 转录天津《大公报》 | F452: 第1版
A453: =COUNTA($B$2:B453) -> 319 | B453: 12502. | C453: 外交老狯之英国 | D453: 论说 | E453: 傲霜庵 | F453: 第1版
A454: =COUNTA($B$2:B454) -> 320 | B454: 12503. | C454: 所谓新生活运动 | D454: 短评 | E454: 傲霜庵 | F454: 第1版
C455: 函馆大火之惨烈 | D455: 短评 | E455: 傲霜庵 | F455: 第1版
C456: 全国参事官会议 | D456: 短评 | E456: 傲霜庵 | F456: 第1版
C457: 外交药方甚多 | D457: 短评 | E457: 傲霜庵 | F457: 第1版
A458: =COUNTA($B$2:B458) -> 324 | B458: 12505. | C458: 党国与满洲帝国 | D458: 短评 | E458: 傲霜庵 | F458: 第1版
C459: 东西弄气球之儿戏 | D459: 短评 | E459: 傲霜庵 | F459: 第1版
C460: 斩获敌人颇多 | D460: 短评 | E460: 傲霜庵 | F460: 第1版
C461: 驻华使馆果南还？ | D461: 短评 | E461: 傲霜庵 | F461: 第1版
A462: =COUNTA($B$2:B462) -> 328 | B462: 12506. | C462: 华北劳工渡满感言 | D462: 论说 | E462: 匿名 | F462: 第1版
A463: =COUNTA($B$2:B463) -> 329 | B463: 12507. | C463: 不能与日本相战 | D463: 短评 | E463: 傲霜庵 | F463: 第1版
C464: 狱囚大半归来 | D464: 短评 | E464: 傲霜庵 | F464: 第1版
C465: 欧洲政局益纷乱 | D465: 短评 | E465: 傲霜庵 | F465: 第1版
C466: 大奉天节节进行 | D466: 短评 | E466: 傲霜庵 | F466: 第1版
A467: =COUNTA($B$2:B467) -> 333 | B467: 12508. | C467: 康藏问题之剖视 | D467: 时论 | E467: 转录上海《时事新报》 | F467: 第1版
A468: =COUNTA($B$2:B468) -> 334 | B468: 12509. | C468: 中国已承认满洲国 | D468: 论说 | E468: 傲霜庵 | F468: 第1版
A469: =COUNTA($B$2:B469) -> 335 | B469: 12510. | C469: 中国已承认满洲国（续） | D469: 论说 | E469: 傲霜庵 | F469: 第1版
A470: =COUNTA($B$2:B470) -> 336 | B470: 12512. | C470: 棉麦借款之减少 | D470: 短评 | E470: 傲霜庵 | F470: 第1版
C471: 评耕款善后办法 | D471: 短评 | E471: 傲霜庵 | F471: 第1版
C472: 不景气中之例外 | D472: 短评 | E472: 傲霜庵 | F472: 第1版
C473: 日本停止愚计 | D473: 短评 | E473: 傲霜庵 | F473: 第1版
A474: =COUNTA($B$2:B474) -> 340 | B474: 12513. | C474: 因循诿卸粉饰 | D474: 论说 | E474: 匿名 | F474: 第1版
A475: =COUNTA($B$2:B475) -> 341 | B475: 12514. | C475: 文明之矛盾性 | D475: 短评 | E475: 傲霜庵 | F475: 第1版
C476: 无题 | D476: 短评 | E476: 傲霜庵 | F476: 第1版
C477: 白宫与国会对峙 | D477: 短评 | E477: 傲霜庵 | F477: 第1版
C478: 黄河为世界疫源？ | D478: 短评 | E478: 傲霜庵 | F478: 第1版
A479: =COUNTA($B$2:B479) -> 345 | B479: 12515. | C479: 勉哉青年学子 | D479: 论说 | E479: 儒丐 | F479: 第1版
A480: =COUNTA($B$2:B480) -> 346 | B480: 12517. | C480: 哀植物园树木 | D480: 论说 | E480: 傲霜庵 | F480: 第1版
A481: =COUNTA($B$2:B481) -> 347 | B481: 12519. | C481: 公开荐举议---从古代荐举制度想到今日官邪的就正 | D481: 时论 | E481: 胡适 | F481: 第1版
A482: =COUNTA($B$2:B482) -> 348 | B482: 12520. | C482: 穷则变 变则通 | D482: 论说 | E482: 匿名 | F482: 第1版
A483: =COUNTA($B$2:B483) -> 349 | B483: 12521. | C483: 辜仁发案与江苏行政 | D483: 论说 | E483: 匿名 | F483: 第1版
A484: =COUNTA($B$2:B484) -> 350 | B484: 12522. | C484: “满洲国”得罪南京 | D484: 短评 | E484: 傲霜庵 | F484: 第1版
C485: 满洲之今昔比较 | D485: 短评 | E485: 傲霜庵 | F485: 第1版
C486: 国联础石之失踪 | D486: 短评 | E486: 傲霜庵 | F486: 第1版
C487: 日本玩具袭美国 | D487: 短评 | E487: 傲霜庵 | F487: 第1版
A488: =COUNTA($B$2:B488) -> 354 | B488: 12523. | C488: 国联专家与中国教育 | D488: 时论 | E488: 匿名 | F488: 第1版
A489: =COUNTA($B$2:B489) -> 355 | B489: 12524. | C489: 四境骚然将不国 | D489: 短评 | E489: 傲霜庵 | F489: 第1版
C490: 新生活的面面观 | D490: 短评 | E490: 傲霜庵 | F490: 第1版
A491: =COUNTA($B$2:B491) -> 357 | B491: 12526. | C491: 康藏的纠纷 | D491: 时论 | E491: 转录天津《益世報》 | F491: 第1版
A492: =COUNTA($B$2:B492) -> 358 | B492: 12527. | C492: 收买民枪与保卫治安 | D492: 论说 | E492: 匿名 | F492: 第1版
A493: =COUNTA($B$2:B493) -> 359 | B493: 12528. | C493: 尖锐化之英日商战 | D493: 时论 | E493: 匿名 | F493: 第1版
A494: =COUNTA($B$2:B494) -> 360 | B494: 12529. | C494: 已经通车又通邮 | D494: 短评 | E494: 傲霜庵 | F494: 第1版
C495: 彩票之与满洲国 | D495: 短评 | E495: 傲霜庵 | F495: 第1版
A496: =COUNTA($B$2:B496) -> 362 | B496: 12530. | C496: 满洲国的春色 | D496: 短评 | E496: 傲霜庵 | F496: 第1版
C497: 极东三国之将来 | D497: 短评 | E497: 傲霜庵 | F497: 第1版
C498: 苏俄投降资本国 | D498: 短评 | E498: 傲霜庵 | F498: 第1版
A499: =COUNTA($B$2:B499) -> 365 | B499: 12533. | C499: 直线外交时代 | D499: 论说 | E499: 傲霜庵 | F499: 第1版
A500: =COUNTA($B$2:B500) -> 366 | B500: 12534. | C500: 农民之困苦 | D500: 论说 | E500: 匿名 | F500: 第1版
A501: =COUNTA($B$2:B501) -> 367 | B501: 12535. | C501: 欧洲裁兵之绝望 | D501: 短评 | E501: 傲霜庵 | F501: 第1版
C502: 英国提议裁空军？ | D502: 短评 | E502: 傲霜庵 | F502: 第1版
C503: 各国之对华援助 | D503: 短评 | E503: 傲霜庵 | F503: 第1版
C504: 古怪趣味之国术 | D504: 短评 | E504: 傲霜庵 | F504: 第1版
A505: =COUNTA($B$2:B505) -> 371 | B505: 12536. | C505: 中国此刻尚不到有宪法成功的时候 | D505: 时论 | E505: 梁漱溟 | F505: 第1版
A506: =COUNTA($B$2:B506) -> 372 | B506: 12537. | C506: 风筝 舞后 外交 | D506: 短评 | E506: 傲霜庵 | F506: 第1版
C507: 中国伦理之矛盾 | D507: 短评 | E507: 傲霜庵 | F507: 第1版
C508: 特使前后回国 | D508: 短评 | E508: 傲霜庵 | F508: 第1版
A509: =COUNTA($B$2:B509) -> 375 | B509: 12538. | C509: 参加运动之失败 | D509: 论说 | E509: 傲霜庵 | F509: 第1版
C510: 苏俄孩子之命名 | D510: 论说 | E510: 傲霜庵 | F510: 第1版
A511: =COUNTA($B$2:B511) -> 377 | B511: 12541. | C511: 谋治安必先安定生活 | D511: 论说 | E511: 匿名 | F511: 第1版
A512: =COUNTA($B$2:B512) -> 378 | B512: 12542. | C512: 日本与东亚领导权 | D512: 论说 | E512: 傲霜庵 | F512: 第1版
A513: =COUNTA($B$2:B513) -> 379 | B513: 12543. | C513: 日本与东亚领导权（续） | D513: 论说 | E513: 傲霜庵 | F513: 第1版
A514: =COUNTA($B$2:B514) -> 380 | B514: 12544. | C514: 建设西北 | D514: 时论 | E514: 转录天津《益世報》 | F514: 第1版
A515: =COUNTA($B$2:B515) -> 381 | B515: 12545. | C515: 糖人儿之危机-幻灭的前夜 | D515: 时论 | E515: 转录《新闻报》 | F515: 第1版
A516: =COUNTA($B$2:B516) -> 382 | B516: 12547. | C516: 菲律宾的独立 | D516: 时论 | E516: 转录天津《益世報》 | F516: 第1版
A517: =COUNTA($B$2:B517) -> 383 | B517: 12548. | C517: 训练与指导 | D517: 论说 | E517: 匿名 | F517: 第1版
A518: =COUNTA($B$2:B518) -> 384 | B518: 12549. | C518: 中国旧疾复发 | D518: 短评 | E518: 傲霜庵 | F518: 第1版
C519: 一视经济为转移 | D519: 短评 | E519: 傲霜庵 | F519: 第1版
C520: 中日劳资之提携 | D520: 短评 | E520: 傲霜庵 | F520: 第1版
A521: =COUNTA($B$2:B521) -> 387 | B521: 12550. | C521: 中国仍旧疑罹 | D521: 短评 | E521: 傲霜庵 | F521: 第1版
C522: 对华政策新语 | D522: 短评 | E522: 傲霜庵 | F522: 第1版
C523: 党魁末路之萧条 | D523: 短评 | E523: 傲霜庵 | F523: 第1版
C524: 果为玩弄女生 | D524: 短评 | E524: 傲霜庵 | F524: 第1版
A525: =COUNTA($B$2:B525) -> 391 | B525: 12551. | C525: 日英商战尖锐化（4.19也有一个） | D525: 论说 | E525: 傲霜庵 | F525: 第1版
A526: =COUNTA($B$2:B526) -> 392 | B526: 12552. | C526: 英国之自杀政策 | D526: 短评 | E526: 傲霜庵 | F526: 第1版
C527: 中日经济的接近 | D527: 短评 | E527: 傲霜庵 | F527: 第1版
C528: 中国果图毁邮票？ | D528: 短评 | E528: 傲霜庵 | F528: 第1版
C529: 呜呼盗卖古物案 | D529: 短评 | E529: 傲霜庵 | F529: 第1版
A530: =COUNTA($B$2:B530) -> 396 | B530: 12554. | C530: 骇人听闻的上海自杀案 | D530: 时论 | E530: 转录天津《大公报》 | F530: 第1版
A531: =COUNTA($B$2:B531) -> 397 | B531: 12555. | C531: 现状之可虑者三 | D531: 论说 | E531: 匿名 | F531: 第1版
A532: =COUNTA($B$2:B532) -> 398 | B532: 12556. | C532: 日货倾销平议 | D532: 短评 | E532: 傲霜庵 | F532: 第1版
C533: 日澳两国之亲善 | D533: 短评 | E533: 傲霜庵 | F533: 第1版
C534: 国联与通邮问题 | D534: 短评 | E534: 傲霜庵 | F534: 第1版
C535: 高等军事顾问 | D535: 短评 | E535: 傲霜庵 | F535: 第1版
C536: 今年之二大飞行 | D536: 短评 | E536: 傲霜庵 | F536: 第1版
A537: =COUNTA($B$2:B537) -> 403 | B537: 12557. | C537: 日皇帝使满在即 | D537: 短评 | E537: 傲霜庵 | F537: 第1版
C538: 治安渐次恢复 | D538: 短评 | E538: 傲霜庵 | F538: 第1版
C539: 裁军会议之？钟 | D539: 短评 | E539: 傲霜庵 | F539: 第1版
A540: =COUNTA($B$2:B540) -> 406 | B540: 12558. | C540: 国人应多去日本游历考察 | D540: 时论 | E540: 转录天津《益世報》 | F540: 第1版
A541: =COUNTA($B$2:B541) -> 407 | B541: 12559. | C541: 论阿刺伯半岛上之战争 | D541: 时论 | E541: 恒 | F541: 第1版
A542: =COUNTA($B$2:B542) -> 408 | B542: 12561. | C542: 中国中学会考风潮 | D542: 时论 | E542: 转录《庸报》 | F542: 第1版
A543: =COUNTA($B$2:B543) -> 409 | B543: 12562. | C543: 清洁 | D543: 论说 | E543: 匿名 | F543: 第1版
A544: =COUNTA($B$2:B544) -> 410 | B544: 12563. | C544: 满洲国又多承认 | D544: 短评 | E544: 傲霜庵 | F544: 第1版
C545: 国联决议通邮 | D545: 短评 | E545: 傲霜庵 | F545: 第1版
C546: 冯玉祥下山东游 | D546: 短评 | E546: 傲霜庵 | F546: 第1版
C547: 男多于女之中国 | D547: 短评 | E547: 傲霜庵 | F547: 第1版
A548: =COUNTA($B$2:B548) -> 414 | B548: 12564. | C548: 亡国的心理 | D548: 时论 | E548: 匿名 | F548: 第1版
C549: 萨国与国联决议 | D549: 时论 | E549: 傲 | F549: 第1版
A550: =COUNTA($B$2:B550) -> 416 | B550: 12565. | C550: 中国今年之灾害 | D550: 时论 | E550: 延 | F550: 第1版
A551: =COUNTA($B$2:B551) -> 417 | B551: 12566. | C551: 中国财政会议与苛捐杂税 | D551: 时论 | E551: 转录天津《大公报》 | F551: 第1版
A552: =COUNTA($B$2:B552) -> 418 | B552: 12568. | C552: 组织与效率 | D552: 时论 | E552: 转录《北平晨报》 | F552: 第1版
A553: =COUNTA($B$2:B553) -> 419 | B553: 12569. | C553: 不良份子 | D553: 论说 | E553: 匿名 | F553: 第1版
A554: =COUNTA($B$2:B554) -> 420 | B554: 12570. | C554: 敬悼东乡元帅 | D554: 论说 | E554: 傲霜庵 | F554: 第1版
A555: =COUNTA($B$2:B555) -> 421 | B555: 12571. | C555: 美国的复兴工作及其批评者 | D555: 时论 | E555: 匿名 | F555: 第1版
A556: =COUNTA($B$2:B556) -> 422 | B556: 12572. | C556: 关于保存满洲文字 | D556: 论说 | E556: 儒丐 | F556: 第1版
A557: =COUNTA($B$2:B557) -> 423 | B557: 12573. | C557: 盖棺之老东乡 | D557: 短评 | E557: 傲霜庵 | F557: 第1版
C558: 义首相危言耸听 | D558: 短评 | E558: 傲霜庵 | F558: 第1版
C559: 俄兵之不法射击 | D559: 短评 | E559: 傲霜庵 | F559: 第1版
C560: 排斥面子之是非 | D560: 短评 | E560: 傲霜庵 | F560: 第1版
C561: 美国当面之谜题 | D561: 短评 | E561: 傲霜庵 | F561: 第1版
A562: =COUNTA($B$2:B562) -> 428 | B562: 12575. | C562: 封锁邮政之孤立 | D562: 短评 | E562: 傲霜庵 | F562: 第1版
C563: 东乡今日国葬 | D563: 短评 | E563: 傲霜庵 | F563: 第1版
C564: 裁军会议之喜剧 | D564: 短评 | E564: 傲霜庵 | F564: 第1版
C565: 张学良与张学狼 | D565: 短评 | E565: 傲霜庵 | F565: 第1版
C566: 巨人金富贵入关 | D566: 短评 | E566: 傲霜庵 | F566: 第1版
A567: =COUNTA($B$2:B567) -> 433 | B567: 12577. | C567: 农村复兴之希望 | D567: 论说 | E567: 匿名 | F567: 第1版
A568: =COUNTA($B$2:B568) -> 434 | B568: 12579. | C568: 说整齐（上） | D568: 时论 | E568: 汪精卫 | F568: 第1版
A569: =COUNTA($B$2:B569) -> 435 | B569: 12580. | C569: 说整齐（下） | D569: 时论 | E569: 汪精卫 | F569: 第1版
A570: =COUNTA($B$2:B570) -> 436 | B570: 12582. | C570: 改革汉字之商榷 | D570: 时论 | E570: 转录天津《益世報》 | F570: 第1版
A571: =COUNTA($B$2:B571) -> 437 | B571: 12583. | C571: 恭迎秩父宫莅奉 | D571: 论说 | E571: 傲霜庵 | F571: 第1版
A572: =COUNTA($B$2:B572) -> 438 | B572: 12584. | C572: 秩父宫谦抑美德 | D572: 短评 | E572: 傲霜庵 | F572: 第1版
C573: 假和尚之口头禅 | D573: 短评 | E573: 傲霜庵 | F573: 第1版
C574: 德意首相将相会 | D574: 短评 | E574: 傲霜庵 | F574: 第1版
C575: 东西之间外交 | D575: 短评 | E575: 傲霜庵 | F575: 第1版
A576: =COUNTA($B$2:B576) -> 442 | B576: 12585. | C576: 恭送秩父宫殿下回国 | D576: 短评 | E576: 傲霜庵 | F576: 第1版
C577: 老冯又回来了 | D577: 短评 | E577: 傲霜庵 | F577: 第1版
C578: 匪首陆续落网 | D578: 短评 | E578: 傲霜庵 | F578: 第1版
A579: =COUNTA($B$2:B579) -> 445 | B579: 12589. | C579: 水工试验 | D579: 时论 | E579: 转录《庸报》 | F579: 第1版
A580: =COUNTA($B$2:B580) -> 446 | B580: 12590. | C580: 盗匪与游民 | D580: 论说 | E580: 匿名 | F580: 第1版
A581: =COUNTA($B$2:B581) -> 447 | B581: 12591. | C581: 苏俄内部之隐患 | D581: 短评 | E581: 傲霜庵 | F581: 第1版
C582: 满洲国的祥瑞 | D582: 短评 | E582: 傲霜庵 | F582: 第1版
C583: 冯玉祥与佛教 | D583: 短评 | E583: 傲霜庵 | F583: 第1版
A584: =COUNTA($B$2:B584) -> 450 | B584: 12592. | C584: 日本与军备平等 | D584: 短评 | E584: 傲霜庵 | F584: 第1版
C585: 意奥接近德国 | D585: 短评 | E585: 傲霜庵 | F585: 第1版
C586: 教育费之激增 | D586: 短评 | E586: 傲霜庵 | F586: 第1版
A587: =COUNTA($B$2:B587) -> 453 | B587: 12593. | C587: 大连防空大操演 | D587: 短评 | E587: 傲霜庵 | F587: 第1版
C588: 芬兰与萨尔瓦多 | D588: 短评 | E588: 傲霜庵 | F588: 第1版
C589: “民主”与“摩登” | D589: 短评 | E589: 傲霜庵 | F589: 第1版
C590: 预算案将发表 | D590: 短评 | E590: 傲霜庵 | F590: 第1版
A591: =COUNTA($B$2:B591) -> 457 | B591: 12594. | C591: 山东乡村建设研究院最近工作概述（上） | D591: 时论 | E591: 梁漱溟---转录天津《大公报》 | F591: 第1版
A592: =COUNTA($B$2:B592) -> 458 | B592: 12596. | C592: 山东乡村建设研究院最近工作概述（下） | D592: 时论 | E592: 梁漱溟---转录天津《大公报》 | F592: 第1版
A593: =COUNTA($B$2:B593) -> 459 | B593: 12597. | C593: 勗官吏 | D593: 论说 | E593: 匿名 | F593: 第1版
A594: =COUNTA($B$2:B594) -> 460 | B594: 12598. | C594: 英国与顺天号案 | D594: 论说 | E594: 傲霜庵 | F594: 第1版
A595: =COUNTA($B$2:B595) -> 461 | B595: 12599. | C595: 共同军费九百万 | D595: 短评 | E595: 傲霜庵 | F595: 第1版
C596: 英国将大扩军备 | D596: 短评 | E596: 傲霜庵 | F596: 第1版
C597: 国内第一疫都 | D597: 短评 | E597: 傲霜庵 | F597: 第1版
A598: =COUNTA($B$2:B598) -> 464 | B598: 12600. | D598: 短评 | E598: 傲霜庵 | F598: 第1版
A599: =COUNTA($B$2:B599) -> 465 | B599: 12601. | C599: 到四川去？ | D599: 时论 | E599: 转录《时事新报》 | F599: 第1版
A600: =COUNTA($B$2:B600) -> 466 | B600: 12603. | C600: 皇上拨币一万元 | D600: 短评 | E600: 傲霜庵 | F600: 第1版
C601: 初次通车之惨剧 | D601: 短评 | E601: 傲霜庵 | F601: 第1版
C602: 永定河水暴涨 | D602: 短评 | E602: 转录《庸报》 | F602: 第1版
A603: =COUNTA($B$2:B603) -> 469 | B603: 12604. | C603: 防水 | D603: 论说 | E603: 匿名 | F603: 第1版
A604: =COUNTA($B$2:B604) -> 470 | B604: 12605. | C604: 德国清党运动 | D604: 论说 | E604: 傲霜庵 | F604: 第1版
A605: =COUNTA($B$2:B605) -> 471 | B605: 12606. | C605: 罔田奉旨组内阁 | D605: 论说 | E605: 傲霜庵 | F605: 第1版
A606: =COUNTA($B$2:B606) -> 472 | B606: 12607. | C606: 日内阁完成在即 | D606: 短评 | E606: 傲霜庵 | F606: 第1版
C607: 中国方面之误解 | D607: 短评 | E607: 傲霜庵 | F607: 第1版
C608: 益世报出言不仁 | D608: 短评 | E608: 傲霜庵 | F608: 第1版
C609: 评开眼运动 | D609: 短评 | E609: 傲霜庵 | F609: 第1版
A610: =COUNTA($B$2:B610) -> 476 | B610: 12608. | C610: 上海各银行投资农村之计划 | D610: 时论 | E610: 转录天津《益世報》 | F610: 第1版
A611: =COUNTA($B$2:B611) -> 477 | B611: 12610. | C611: 日内阁完全成立 | D611: 短评 | E611: 傲霜庵 | F611: 第1版
C612: 当局与交通地狱 | D612: 短评 | E612: 傲霜庵 | F612: 第1版
C613: 水深火热之分配 | D613: 短评 | E613: 傲霜庵 | F613: 第1版
A614: =COUNTA($B$2:B614) -> 480 | B614: 12611. | C614: 危险 | D614: 论说 | E614: 匿名 | F614: 第1版
A615: =COUNTA($B$2:B615) -> 481 | B615: 12612. | C615: 民族复兴的一个条件 | D615: 论说 | E615: 蒋廷黻---转录天津《大公报》 | F615: 第1版
A616: =COUNTA($B$2:B616) -> 482 | B616: 12613. | C616: 事实为极雄辩 | D616: 短评 | E616: 傲霜庵 | F616: 第1版
C617: 英法与欧洲政局 | D617: 短评 | E617: 傲霜庵 | F617: 第1版
C618: 日本击雨而落 | D618: 短评 | E618: 傲霜庵 | F618: 第1版
A619: =COUNTA($B$2:B619) -> 485 | B619: 12614. | C619: 中国领土完整之疑问 | D619: 论说 | E619: 傲霜庵 | F619: 第1版
B620: 12615. | C620: 美禁白银出口 | D620: 时论 | E620: 天放---转录《新闻报》 | F620: 第1版
A621: =COUNTA($B$2:B621) -> 487 | B621: 12617. | C621: 霪霖二月未停止 | D621: 短评 | E621: 傲霜庵 | F621: 第1版
C622: 顾维钧自认失败 | D622: 短评 | E622: 傲霜庵 | F622: 第1版
C623: 极奇怪的缩军案 | D623: 短评 | E623: 傲霜庵 | F623: 第1版
A624: =COUNTA($B$2:B624) -> 490 | B624: 12618. | C624: 共济时艰 | D624: 论说 | E624: 匿名 | F624: 第1版
A625: =COUNTA($B$2:B625) -> 491 | B625: 12619. | C625: 居里夫人逝世所感 | D625: 时论 | E625: 转录《新闻报》 | F625: 第1版
A626: =COUNTA($B$2:B626) -> 492 | B626: 12620. | C626: 美国大罢工风潮 | D626: 短评 | E626: 傲霜庵 | F626: 第1版
C627: 建设公债一千万 | D627: 短评 | E627: 傲霜庵 | F627: 第1版
C628: 祈雨之与班禅 | D628: 短评 | E628: 傲霜庵 | F628: 第1版
A629: =COUNTA($B$2:B629) -> 495 | B629: 12621. | C629: 哈阜与大水挣扎 | D629: 短评 | E629: 傲霜庵 | F629: 第1版
C630: 太平洋佛教大会 | D630: 短评 | E630: 傲霜庵 | F630: 第1版
C631: 新京南京比较观 | D631: 短评 | E631: 傲霜庵 | F631: 第1版
A632: =COUNTA($B$2:B632) -> 498 | B632: 12622. | C632: 对新加坡华侨进一解 | D632: 时论 | E632: 梦蕉---转录《新闻报》 | F632: 第1版
A633: =COUNTA($B$2:B633) -> 499 | B633: 12624. | C633: 弹劾问题之论争 | D633: 时论 | E633: 转录天津《大公报》 | F633: 第1版
A634: =COUNTA($B$2:B634) -> 500 | B634: 12625. | C634: 无欲实难 | D634: 论说 | E634: 匿名 | F634: 第1版
A635: =COUNTA($B$2:B635) -> 501 | B635: 12626. | C635: 英军之入境演习（上） | D635: 论说 | E635: 傲霜庵 | F635: 第1版
A636: =COUNTA($B$2:B636) -> 502 | B636: 12627. | C636: 英军之入境演习（下） | D636: 论说 | E636: 傲霜庵 | F636: 第1版
A637: =COUNTA($B$2:B637) -> 503 | B637: 12628. | C637: 奥京发生大惨剧 | D637: 论说 | E637: 傲霜庵 | F637: 第1版
C638: 逆转半世纪之中国 | D638: 论说 | E638: 傲霜庵 | F638: 第1版
A639: =COUNTA($B$2:B639) -> 505 | B639: 12629. | C639: 变乱后之奥国 | D639: 短评 | E639: 傲霜庵 | F639: 第1版
C640: 破落户与暴发户 | D640: 短评 | E640: 傲霜庵 | F640: 第1版
C641: 英军不复越境 | D641: 短评 | E641: 傲霜庵 | F641: 第1版
A642: =COUNTA($B$2:B642) -> 508 | B642: 12631. | C642: 为会考失败的青年呼冤 | D642: 时论 | E642: 转录天津《大公报》 | F642: 第1版
A643: =COUNTA($B$2:B643) -> 509 | B643: 12632. | C643: 国界国防与大同之世 | D643: 论说 | E643: 匿名 | F643: 第1版
A644: =COUNTA($B$2:B644) -> 510 | B644: 12633. | C644: 救济灾黎之急务 | D644: 短评 | E644: 傲霜庵 | F644: 第1版
C645: 奉天与交通地狱 | D645: 短评 | E645: 傲霜庵 | F645: 第1版
C646: 欧洲之火山奥国 | D646: 短评 | E646: 傲霜庵 | F646: 第1版
A647: =COUNTA($B$2:B647) -> 513 | B647: 12634. | C647: 日本与明年海会 | D647: 短评 | E647: 傲霜庵 | F647: 第1版
C648: 满日电话开通 | D648: 短评 | E648: 傲霜庵 | F648: 第1版
C649: 打破迷信之是非 | D649: 短评 | E649: 傲霜庵 | F649: 第1版
C650: 老总统病逝渖重 | D650: 短评 | E650: 傲霜庵 | F650: 第1版
A651: =COUNTA($B$2:B651) -> 517 | B651: 12635. | C651: 整理荣氏事业感言 | D651: 时论 | E651: 远哉---转录《新闻报》 | F651: 第1版
A652: =COUNTA($B$2:B652) -> 518 | B652: 12636. | C652: 今后之中欧情势 | D652: 时论 | E652: 转录《晨报》 | F652: 第1版
A653: =COUNTA($B$2:B653) -> 519 | B653: 12638. | C653: 敬悼兴登堡国葬 | D653: 论说 | E653: 傲霜庵 | F653: 第1版
A654: =COUNTA($B$2:B654) -> 520 | B654: 12639. | C654: 灾与匪 | D654: 论说 | E654: 匿名 | F654: 第1版
A655: =COUNTA($B$2:B655) -> 521 | B655: 12640. | C655: 中国财政预算之检讨 | D655: 时论 | E655: 转录《时事新报》 | F655: 第1版
A656: =COUNTA($B$2:B656) -> 522 | B656: 12641. | C656: 论整理田赋与减轻附加 | D656: 时论 | E656: 转录《华北日报》 | F656: 第1版
A657: =COUNTA($B$2:B657) -> 523 | B657: 12642. | C657: 修正宪稿中行政体制问题 | D657: 时论 | E657: 转录天津《大公报》 | F657: 第1版
A658: =COUNTA($B$2:B658) -> 524 | B658: 12643. | C658: 希特勒之雨总统 | D658: 短评 | E658: 傲霜庵 | F658: 第1版
C659: 奥德意三角恋爱 | D659: 短评 | E659: 傲霜庵 | F659: 第1版
C660: 英国视察团来满 | D660: 短评 | E660: 傲霜庵 | F660: 第1版
C661: 妇女国货年失败 | D661: 短评 | E661: 傲霜庵 | F661: 第1版
A662: =COUNTA($B$2:B662) -> 528 | B662: 12645. | C662: 中国农村合作事业 | D662: 时论 | E662: 转录天津《益世報》 | F662: 第1版
A663: =COUNTA($B$2:B663) -> 529 | B663: 12646. | C663: 惩贪之不可缓 | D663: 论说 | E663: 匿名 | F663: 第1版
A664: =COUNTA($B$2:B664) -> 530 | B664: 12647. | C664: 售路交涉决裂？ | D664: 短评 | E664: 傲霜庵 | F664: 第1版
C665: 陈独秀与苏俄 | D665: 短评 | E665: 傲霜庵 | F665: 第1版
C666: 假象国境之交错 | D666: 短评 | E666: 傲霜庵 | F666: 第1版
C667: 中国摩登化日极 | D667: 短评 | E667: 傲霜庵 | F667: 第1版
A668: =COUNTA($B$2:B668) -> 534 | B668: 12648. | C668: 美国宣布白银国有 | D668: 时论 | E668: 转录天津《益世報》 | F668: 第1版
A669: =COUNTA($B$2:B669) -> 535 | B669: 12649. | C669: 打倒鬼怪影片 | D669: 论说 | E669: 傲霜庵 | F669: 第1版
A670: =COUNTA($B$2:B670) -> 536 | B670: 12650. | C670: 量小力大欲无穷 | D670: 短评 | E670: 傲霜庵 | F670: 第1版
C671: 中国究难统一 | D671: 短评 | E671: 傲霜庵 | F671: 第1版
C672: 今年龙王发疯了 | D672: 短评 | E672: 傲霜庵 | F672: 第1版
A673: =COUNTA($B$2:B673) -> 539 | B673: 12652. | C673: 乡村建设与社会教育 | D673: 时论 | E673: 梁漱溟 | F673: 第1版
A674: =COUNTA($B$2:B674) -> 540 | B674: 12653. | C674: 绑票勒赎感言 | D674: 论说 | E674: 匿名 | F674: 第1版
A675: =COUNTA($B$2:B675) -> 541 | B675: 12663. | C675: 满洲国初次试验 | D675: 短评 | E675: 傲霜庵 | F675: 第1版
C676: 张任川省主席？ | D676: 短评 | E676: 傲霜庵 | F676: 第1版
C677: 一触即发之危机 | D677: 短评 | E677: 傲霜庵 | F677: 第1版
C678: 物价之昂贵惊人 | D678: 短评 | E678: 傲霜庵 | F678: 第1版
A679: =COUNTA($B$2:B679) -> 545 | B679: 12664. | C679: 中国之贫民法律扶助会 | D679: 时论 | E679: 转录天津《益世報》 | F679: 第1版
A680: =COUNTA($B$2:B680) -> 546 | B680: 12666. | C680: 中国之学会与进步 | D680: 时论 | E680: 转录天津《益世報》 | F680: 第1版
A681: =COUNTA($B$2:B681) -> 547 | B681: 12667. | C681: 惜时惜费 | D681: 论说 | E681: 匿名 | F681: 第1版
A682: =COUNTA($B$2:B682) -> 548 | B682: 12668. | C682: 夺还肉票之速度 | D682: 论说 | E682: 傲霜庵 | F682: 第1版
A683: =COUNTA($B$2:B683) -> 549 | B683: 12669. | C683: 中国省府合署办公与整饬吏治 | D683: 时论 | E683: 转录天津《大公报》 | F683: 第1版
A684: =COUNTA($B$2:B684) -> 550 | B684: 12670. | C684: 北铁有地雷发现 | D684: 短评 | E684: 傲霜庵 | F684: 第1版
C685: 大？业与舰队移驻 | D685: 短评 | E685: 傲霜庵 | F685: 第1版
C686: 木乃伊与其遗子 | D686: 短评 | E686: 傲霜庵 | F686: 第1版
C687: 辟作和平部是非 | D687: 短评 | E687: 傲霜庵 | F687: 第1版
A688: =COUNTA($B$2:B688) -> 554 | B688: 12671. | C688: 老宰相之飞行视察 | D688: 短评 | E688: 傲霜庵 | F688: 第1版
C689: 苏俄之参加国联 | D689: 短评 | E689: 傲霜庵 | F689: 第1版
C690: 鱼翅进口惊人 | D690: 短评 | E690: 傲霜庵 | F690: 第1版
A691: =COUNTA($B$2:B691) -> 557 | B691: 12673. | C691: 萨尔问题 | D691: 时论 | E691: 转录《庸报》 | F691: 第1版
A692: =COUNTA($B$2:B692) -> 558 | B692: 12674. | C692: 研究科学以解决一切 | D692: 论说 | E692: 匿名 | F692: 第1版
A693: =COUNTA($B$2:B693) -> 559 | B693: 12675. | C693: 上丁祀孔日感言 | D693: 短评 | E693: 傲霜庵 | F693: 第1版
C694: 王道乐土吾未信 | D694: 短评 | E694: 傲霜庵 | F694: 第1版
C695: 教科书供不敷需 | D695: 短评 | E695: 傲霜庵 | F695: 第1版
A696: =COUNTA($B$2:B696) -> 562 | B696: 12677. | C696: 康藏界务与西康建省 | D696: 时论 | E696: 延---转录《申报》 | F696: 第1版
A697: =COUNTA($B$2:B697) -> 563 | B697: 12678. | C697: 三味一体之间是非 | D697: 短评 | E697: 傲霜庵 | F697: 第1版
C698: 国联家庭的丑剧 | D698: 短评 | E698: 傲霜庵 | F698: 第1版
C699: 五十万年前女骨 | D699: 短评 | E699: 傲霜庵 | F699: 第1版
A700: =COUNTA($B$2:B700) -> 566 | B700: 12680. | C700: 新疆现状渐不可耐 | D700: 时论 | E700: 转录天津《大公报》 | F700: 第1版
A701: =COUNTA($B$2:B701) -> 567 | B701: 12681. | C701: 调查清洁与卫生展览 | D701: 论说 | E701: 匿名 | F701: 第1版
A702: =COUNTA($B$2:B702) -> 568 | B702: 12682. | C702: 欢迎日本联合舰队 | D702: 短评 | E702: 傲霜庵 | F702: 第1版
C703: 郭泰祺之大谬误 | D703: 短评 | E703: 傲霜庵 | F703: 第1版
A704: =COUNTA($B$2:B704) -> 570 | B704: 12683. | C704: 苏俄已参加国联 | D704: 短评 | E704: 傲霜庵 | F704: 第1版
C705: 中国失败所由来 | D705: 短评 | E705: 傲霜庵 | F705: 第1版
C706: 西方文明之一断面 | D706: 短评 | E706: 傲霜庵 | F706: 第1版
C707: 世界最危险之国 | D707: 短评 | E707: 傲霜庵 | F707: 第1版
A708: =COUNTA($B$2:B708) -> 574 | B708: 12684. | C708: 苏联入盟与波兰 | D708: 时论 | E708: 转录《时事新报》 | F708: 第1版
A709: =COUNTA($B$2:B709) -> 575 | B709: 12685. | C709: 依赖外交之破产 | D709: 短评 | E709: 傲霜庵 | F709: 第1版
C710: 中国毒菌之与官吏 | D710: 短评 | E710: 傲霜庵 | F710: 第1版
C711: 邻邦之大风灾 | D711: 短评 | E711: 傲霜庵 | F711: 第1版
A712: =COUNTA($B$2:B712) -> 578 | B712: 12687. | C712: 川黔剿匪之关键 | D712: 时论 | E712: 转录天津《大公报》 | F712: 第1版
A713: =COUNTA($B$2:B713) -> 579 | B713: 12688. | C713: 维持粮价 | D713: 论说 | E713: 匿名 | F713: 第1版
A714: =COUNTA($B$2:B714) -> 580 | B714: 12689. | C714: 北铁问题解决在即 | D714: 论说 | E714: 傲霜庵 | F714: 第1版
A715: =COUNTA($B$2:B715) -> 581 | B715: 12690. | C715: 苏俄飞机又越境 | D715: 短评 | E715: 傲霜庵 | F715: 第1版
C716: 别有天地非人间 | D716: 短评 | E716: 傲霜庵 | F716: 第1版
C717: 很奇怪的印象 | D717: 短评 | E717: 傲霜庵 | F717: 第1版
C718: 单思病的外交 | D718: 短评 | E718: 傲霜庵 | F718: 第1版
A719: =COUNTA($B$2:B719) -> 585 | B719: 12691. | C719: 新疆军民分治之纠纷 | D719: 时论 | E719: 转录《新闻报》 | F719: 第1版
A720: =COUNTA($B$2:B720) -> 586 | B720: 12692. | C720: 大风灾后之日本 | D720: 短评 | E720: 傲霜庵 | F720: 第1版
C721: 极安全之输入品 | D721: 短评 | E721: 傲霜庵 | F721: 第1版
C722: 一个大百货店 | D722: 短评 | E722: 傲霜庵 | F722: 第1版
C723: 中国的唯一出路 | D723: 短评 | E723: 傲霜庵 | F723: 第1版
A724: =COUNTA($B$2:B724) -> 590 | B724: 12694. | C724: 积谷防饥 | D724: 时论 | E724: 敬---转录《申报》 | F724: 第1版
A725: =COUNTA($B$2:B725) -> 591 | B725: 12695. | C725: 今后外交新认识机器路线 | D725: 时论 | E725: 天放---转录《新闻报》 | F725: 第1版
A726: =COUNTA($B$2:B726) -> 592 | B726: 12696. | C726: 中国先做到教育统一 | D726: 时论 | E726: 杨振声 | F726: 第1版
A727: =COUNTA($B$2:B727) -> 593 | B727: 12697. | C727: 少数民族问题之考察 | D727: 时论 | E727: 转录《时事新报》 | F727: 第1版
A728: =COUNTA($B$2:B728) -> 594 | B728: 12699. | C728: 地方经济割据之动向 | D728: 时论 | E728: 转录《时事新报》 | F728: 第1版
A729: =COUNTA($B$2:B729) -> 595 | B729: 12701. | C729: 约翰逊去职与美国产业复兴计划 | D729: 时论 | E729: 转录天津《大公报》 | F729: 第1版
A730: =COUNTA($B$2:B730) -> 596 | B730: 12702. | C730: 救济*绸厥在统制 | D730: 时论 | E730: 转录《北平晨报》 | F730: 第1版
A731: =COUNTA($B$2:B731) -> 597 | B731: 12703. | C731: 悠国王被刺崩殂 | D731: 短评 | E731: 傲霜庵 | F731: 第1版
C732: 欢迎英美视察团 | D732: 短评 | E732: 傲霜庵 | F732: 第1版
A733: =COUNTA($B$2:B733) -> 599 | B733: 12704. | C733: 十省新制度感言 | D733: 短评 | E733: 傲霜庵 | F733: 第1版
C734: 不亲善中之亲善 | D734: 短评 | E734: 傲霜庵 | F734: 第1版
C735: 评中意互换大使 | D735: 短评 | E735: 傲霜庵 | F735: 第1版
A736: =COUNTA($B$2:B736) -> 602 | B736: 12705. | C736: 首都发现百斯笃 | D736: 短评 | E736: 傲霜庵 | F736: 第1版
C737: 特产之南美销路 | D737: 短评 | E737: 傲霜庵 | F737: 第1版
C738: 大连竟凌驾上海 | D738: 短评 | E738: 傲霜庵 | F738: 第1版
C739: 美国将军豪语 | D739: 短评 | E739: 傲霜庵 | F739: 第1版
A740: =COUNTA($B$2:B740) -> 606 | B740: 12706. | C740: 黄河问题将如之何？ | D740: 时论 | E740: 转录天津《大公报》 | F740: 第1版
A741: =COUNTA($B$2:B741) -> 607 | B741: 12708. | C741: 党国之一大危机 | D741: 短评 | E741: 傲霜庵 | F741: 第1版
C742: 南京之与西南派 | D742: 短评 | E742: 傲霜庵 | F742: 第1版
C743: 中日互换大使问题 | D743: 短评 | E743: 傲霜庵 | F743: 第1版
C744: 评新省名称 | D744: 短评 | E744: 傲霜庵 | F744: 第1版
A745: =COUNTA($B$2:B745) -> 611 | B745: 12709. | C745: 西班牙内乱平定 | D745: 时论 | E745: 恒 | F745: 第1版
A746: =COUNTA($B$2:B746) -> 612 | B746: 12710. | C746: 改良蚕丝之必要 | D746: 时论 | E746: 敬---转录《申报》 | F746: 第1版
A747: =COUNTA($B$2:B747) -> 613 | B747: 12712. | C747: 乡村运动之现阶段 | D747: 时论 | E747: 转录《北平晨报》 | F747: 第1版
A748: =COUNTA($B$2:B748) -> 614 | B748: 12715. | C748: 中国兴业银行停业感言 | E748: 经---转录《申报》 | F748: 第1版
A749: =COUNTA($B$2:B749) -> 615 | B749: 12716. | C749: 都市的畸形发展 | D749: 论说 | E749: 匿名 | F749: 第1版
A750: =COUNTA($B$2:B750) -> 616 | B750: 12717. | C750: 日本与伦敦预商 | D750: 短评 | E750: 傲霜庵 | F750: 第1版
C751: 英澳间飞行赛会 | D751: 短评 | E751: 傲霜庵 | F751: 第1版
C752: 还算王道乐土 | D752: 短评 | E752: 傲霜庵 | F752: 第1版
C753: 评黄河水私会 | D753: 短评 | E753: 傲霜庵 | F753: 第1版
A754: =COUNTA($B$2:B754) -> 620 | B754: 12718. | C754: 英澳七十一小时 | D754: 短评 | E754: 傲霜庵 | F754: 第1版
C755: 开銮大运河计划 | D755: 短评 | E755: 傲霜庵 | F755: 第1版
C756: 日德间秘密协定 | D756: 短评 | E756: 傲霜庵 | F756: 第1版
C757: 普恩夹赉（lai）溘（ke）逝 | D757: 短评 | E757: 傲霜庵 | F757: 第1版
A758: =COUNTA($B$2:B758) -> 624 | B758: 12719. | C758: 蒋代张来平 | D758: 短评 | E758: 傲霜庵 | F758: 第1版
C759: 天鹅与癞蛤蟆 | D759: 短评 | E759: 傲霜庵 | F759: 第1版
C760: 将来之奉天与上海 | D760: 短评 | E760: 傲霜庵 | F760: 第1版
C761: 一个小学校出售 | D761: 短评 | E761: 傲霜庵 | F761: 第1版
A762: =COUNTA($B$2:B762) -> 628 | B762: 12720. | C762: 银出口征税以后 | D762: 时论 | E762: 丁文江---转录天津《大公报》 | F762: 第1版
A763: =COUNTA($B$2:B763) -> 629 | B763: 12722. | C763: 满洲国得罪了么 | D763: 论说 | E763: 傲霜庵 | F763: 第1版
C764: 星罗国王退位 | D764: 论说 | E764: 傲霜庵 | F764: 第1版
A765: =COUNTA($B$2:B765) -> 631 | B765: 12723. | C765: 事业与人才 | D765: 论说 | E765: 匿名 | F765: 第1版
A766: =COUNTA($B$2:B766) -> 632 | B766: 12724. | C766: 人民不安于现状之因果 | D766: 时论 | E766: 步陶---转录《新闻报》 | F766: 第1版
A767: =COUNTA($B$2:B767) -> 633 | B767: 12725. | C767: 中国之艺术外交（上） | D767: 论说 | E767: 傲霜庵 | F767: 第1版
A768: =COUNTA($B$2:B768) -> 634 | B768: 12726. | C768: 中国之艺术外交（下） | D768: 论说 | E768: 傲霜庵 | F768: 第1版
A769: =COUNTA($B$2:B769) -> 635 | B769: 12727. | C769: 怪物“亚细亚”号 | D769: 短评 | E769: 傲霜庵 | F769: 第1版
C770: 五全大会又展期 | D770: 短评 | E770: 傲霜庵 | F770: 第1版
C771: 孔子纪念歌词 | D771: 短评 | E771: 傲霜庵 | F771: 第1版
C772: 农村破产的结果 | D772: 短评 | E772: 傲霜庵 | F772: 第1版
C773: 蒋介石完全无病 | D773: 短评 | E773: 傲霜庵 | F773: 第1版
A774: =COUNTA($B$2:B774) -> 640 | B774: 12729. | C774: 五全代会延期以后 | D774: 时评 | E774: 转录天津《大公报》 | F774: 第1版
A775: =COUNTA($B$2:B775) -> 641 | B775: 12730. | C775: 私的经济解决之曙光 | D775: 论说 | E775: 匿名 | F775: 第1版
A776: =COUNTA($B$2:B776) -> 642 | B776: 12731. | C776: 航空渡来之女珍客 | D776: 短评 | E776: 傲霜庵 | F776: 第1版
C777: 留日学生之遽增 | D777: 短评 | E777: 傲霜庵 | F777: 第1版
C778: 一言能息党争 | D778: 短评 | E778: 傲霜庵 | F778: 第1版
C779: 太阳黑点之刺激 | D779: 短评 | E779: 傲霜庵 | F779: 第1版
A780: =COUNTA($B$2:B780) -> 646 | B780: 12732. | C780: 蒋与华北问题 | D780: 短评 | E780: 傲霜庵 | F780: 第1版
C781: 满洲国闭锁门户？ | D781: 短评 | E781: 傲霜庵 | F781: 第1版
C782: 美国自认罪首 | D782: 短评 | E782: 傲霜庵 | F782: 第1版
C783: 哲学最难找饭吃 | D783: 短评 | E783: 傲霜庵 | F783: 第1版
A784: =COUNTA($B$2:B784) -> 650 | B784: 12733. | C784: 法国内阁之危机 | D784: 短评 | E784: 傲霜庵 | F784: 第1版
C785: 美仍信任罗斯福 | D785: 短评 | E785: 傲霜庵 | F785: 第1版
C786: 渠淮工程已开始 | D786: 短评 | E786: 傲霜庵 | F786: 第1版
C787: 连云港之出现 | D787: 短评 | E787: 傲霜庵 | F787: 第1版
A788: =COUNTA($B$2:B788) -> 654 | B788: 12734. | C788: 和诱有妇之夫！ | D788: 时论 | E788: 转录《北平晨报》 | F788: 第1版
A789: =COUNTA($B$2:B789) -> 655 | B789: 12736. | C789: 多福多寿多男子 | D789: 时论 | E789: 吴景超---转录天津《大公报》 | F789: 第1版
A790: =COUNTA($B$2:B790) -> 656 | B790: 12737. | C790: 农民之困苦 | D790: 论说 | E790: 匿名 | F790: 第1版
A791: =COUNTA($B$2:B791) -> 657 | B791: 12738. | C791: 关税将有大改正 | D791: 论说 | E791: 傲霜庵 | F791: 第1版
C792: 双十双一节感言 | D792: 论说 | E792: 傲霜庵 | F792: 第1版
A793: =COUNTA($B$2:B793) -> 659 | B793: 12739. | C793: 内阁更动后之法国 | D793: 短评 | E793: 傲霜庵 | F793: 第1版
C794: 河北省府之改租 | D794: 短评 | E794: 傲霜庵 | F794: 第1版
C795: 申报总经理遇刺 | D795: 短评 | E795: 傲霜庵 | F795: 第1版
A796: =COUNTA($B$2:B796) -> 662 | B796: 12740. | C796: 恶风化与经济背景 | D796: 时论 | E796: 转录《北平晨报》 | F796: 第1版
A797: =COUNTA($B$2:B797) -> 663 | B797: 12741. | C797: 私运华人入美与美国排华移民律 | D797: 时论 | E797: 转录《申报》 | F797: 第1版
A798: =COUNTA($B$2:B798) -> 664 | B798: 12743. | C798: 宁粤直接对峙 | D798: 短评 | E798: 傲霜庵 | F798: 第1版
C799: 中国之烹饪艺术 | D799: 短评 | E799: 傲霜庵 | F799: 第1版
C800: 承认论渐占势力 | D800: 短评 | E800: 傲霜庵 | F800: 第1版
A801: =COUNTA($B$2:B801) -> 667 | B801: 12744. | C801: 论树立国策 | D801: 论说 | E801: 匿名 | F801: 第1版
A802: =COUNTA($B$2:B802) -> 668 | B802: 12745. | C802: 满日间飞船联络 | D802: 短评 | E802: 傲霜庵 | F802: 第1版
C803: 是变化不是进步 | D803: 短评 | E803: 傲霜庵 | F803: 第1版
C804: 奉天发展无已时 | D804: 短评 | E804: 傲霜庵 | F804: 第1版
A805: =COUNTA($B$2:B805) -> 671 | B805: 12746. | C805: 国际检查军火贸易场 | D805: 时论 | E805: 转录《时事新报》 | F805: 第1版
A806: =COUNTA($B$2:B806) -> 672 | B806: 12747. | C806: 伦敦海会多悲观 | D806: 短评 | E806: 傲霜庵 | F806: 第1版
C807: 海源阁藏书无人购 | D807: 短评 | E807: 傲霜庵 | F807: 第1版
C808: 禁止“腐旧”称呼 | D808: 短评 | E808: 傲霜庵 | F808: 第1版
C809: 时代错误之阉人 | D809: 短评 | E809: 傲霜庵 | F809: 第1版
A810: =COUNTA($B$2:B810) -> 676 | B810: 12748. | C810: 太平洋航空路线 | D810: 论说 | E810: 傲霜庵 | F810: 第1版
A811: =COUNTA($B$2:B811) -> 677 | B811: 12750. | C811: 关于防止混迹与滥竽问题 | D811: 时论 | E811: 转录《北平晨报》 | F811: 第1版
A812: =COUNTA($B$2:B812) -> 678 | B812: 12751. | C812: 邻邦藏相易人 | D812: 短评 | E812: 傲霜庵 | F812: 第1版
C813: 责备人民之过甚 | D813: 短评 | E813: 傲霜庵 | F813: 第1版
C814: 南京放空演习 | D814: 短评 | E814: 傲霜庵 | F814: 第1版
A815: =COUNTA($B$2:B815) -> 681 | B815: 12752. | C815: 满洲国将有议会 | D815: 短评 | E815: 傲霜庵 | F815: 第1版
C816: 上海现银流出不已 | D816: 短评 | E816: 傲霜庵 | F816: 第1版
C817: 国防会议失败？ | D817: 短评 | E817: 傲霜庵 | F817: 第1版
C818: 评填墓所有权 | D818: 短评 | E818: 傲霜庵 | F818: 第1版
A819: =COUNTA($B$2:B819) -> 685 | B819: 12753. | C819: 印度自治之前途 | D819: 时论 | E819: 延---转录《申报》 | F819: 第1版
A820: =COUNTA($B$2:B820) -> 686 | B820: 12755. | C820: 攻势战舰之撤退 | D820: 短评 | E820: 傲霜庵 | F820: 第1版
C821: 满日间仅八小时 | D821: 短评 | E821: 傲霜庵 | F821: 第1版
C822: 美国禁外蛋进口 | D822: 短评 | E822: 傲霜庵 | F822: 第1版
C823: 中国创行“对表礼” | D823: 短评 | E823: 傲霜庵 | F823: 第1版
A824: =COUNTA($B$2:B824) -> 690 | B824: 12757. | C824: 四社果同盟不卖？ | D824: 短评 | E824: 傲霜庵 | F824: 第1版
C825: 世界人心不安 | D825: 短评 | E825: 傲霜庵 | F825: 第1版
C826: 尊孔乎抑尊乎 | D826: 短评 | E826: 傲霜庵 | F826: 第1版
C827: 军阀之幸与 | D827: 短评 | E827: 傲霜庵 | F827: 第1版
A828: =COUNTA($B$2:B828) -> 694 | B828: 12758. | C828: 到乡村去 | D828: 论说 | E828: 匿名 | F828: 第1版
A829: =COUNTA($B$2:B829) -> 695 | B829: 12759. | C829: 中国南北政局 | D829: 短评 | E829: 傲霜庵 | F829: 第1版
C830: 国联两度大失败 | D830: 短评 | E830: 傲霜庵 | F830: 第1版
C831: 汽车肇祸之比较 | D831: 短评 | E831: 傲霜庵 | F831: 第1版
C832: 墨索里尼焦虑 | D832: 短评 | E832: 傲霜庵 | F832: 第1版
C833: 火陲陲便之发明 | D833: 短评 | E833: 傲霜庵 | F833: 第1版
A834: =COUNTA($B$2:B834) -> 700 | B834: 12760. | C834: 日议会不免解散？ | D834: 短评 | E834: 傲霜庵 | F834: 第1版
C835: 英美与火油专卖 | D835: 短评 | E835: 傲霜庵 | F835: 第1版
C836: 苏俄暗杀大狱 | D836: 短评 | E836: 傲霜庵 | F836: 第1版
C837: 盗卖与保护难两立 | D837: 短评 | E837: 傲霜庵 | F837: 第1版
A838: =COUNTA($B$2:B838) -> 704 | B838: 12761. | C838: 速设捐睡监委会 | D838: 时论 | E838: 转录天津《大公报》 | F838: 第1版
A839: =COUNTA($B$2:B839) -> 705 | B839: 12762. | C839: 中国与白银流出 | D839: 短评 | E839: 傲霜庵 | F839: 第1版
C840: 复兴民族途径 | D840: 短评 | E840: 傲霜庵 | F840: 第1版
C841: 宣传“好汉要当兵” | D841: 短评 | E841: 傲霜庵 | F841: 第1版
C842: 破坏裁军会议 | D842: 短评 | E842: 傲霜庵 | F842: 第1版
A843: =COUNTA($B$2:B843) -> 709 | B843: 12764. | C843: 谁教青年学生造假文凭的？（上） | D843: 时论 | E843: 胡适 | F843: 第1版
A844: =COUNTA($B$2:B844) -> 710 | B844: 12765. | C844: 谁教青年学生造假文凭的？（下） | D844: 时论 | E844: 胡适 | F844: 第1版
A845: =COUNTA($B$2:B845) -> 711 | B845: 12766. | C845: 一月后之萨尔投票 | D845: 论说 | E845: 傲霜庵 | F845: 第1版
A846: =COUNTA($B$2:B846) -> 712 | B846: 12767. | C846: 所望于五中全会者 | D846: 时论 | E846: 转录天津《大公报》 | F846: 第1版
A847: =COUNTA($B$2:B847) -> 713 | B847: 12768. | C847: 伦敦豫商将休会 | D847: 短评 | E847: 傲霜庵 | F847: 第1版
C848: 华北之新局势 | D848: 短评 | E848: 傲霜庵 | F848: 第1版
C849: 旱灾奇重之中国 | D849: 短评 | E849: 傲霜庵 | F849: 第1版
C850: 提倡集团结婚 | D850: 短评 | E850: 傲霜庵 | F850: 第1版
A851: =COUNTA($B$2:B851) -> 717 | B851: 12769. | C851: 日政友会大动摇 | D851: 短评 | E851: 傲霜庵 | F851: 第1版
C852: 弩末之三国豫商 | D852: 短评 | E852: 傲霜庵 | F852: 第1版
C853: 老探险家赫定 | D853: 短评 | E853: 傲霜庵 | F853: 第1版
C854: 欧美之接近极东 | D854: 短评 | E854: 傲霜庵 | F854: 第1版
A855: =COUNTA($B$2:B855) -> 721 | B855: 12771. | C855: 农业生产与工业消费 | D855: 时论 | E855: 薪-转录天津《益世報》 | F855: 第1版
A856: =COUNTA($B$2:B856) -> 722 | B856: 12772. | C856: 美国将开筑大运河 | D856: 短评 | E856: 傲霜庵 | F856: 第1版
C857: 纵贯大铁卢完成 | D857: 短评 | E857: 傲霜庵 | F857: 第1版
C858: 甘地之今昔 | D858: 短评 | E858: 傲霜庵 | F858: 第1版
A859: =COUNTA($B$2:B859) -> 725 | B859: 12773. | C859: 消灭残匪还需努力 | D859: 时论 | E859: 转录天津《大公报》 | F859: 第1版
A860: =COUNTA($B$2:B860) -> 726 | B860: 12774. | C860: 论新疆之危机 | D860: 论说 | E860: 傲霜庵 | F860: 第1版
A861: =COUNTA($B$2:B861) -> 727 | B861: 12775. | C861: 伦敦豫商竟休会 | D861: 短评 | E861: 傲霜庵 | F861: 第1版
C862: 满华接近之可庆 | D862: 短评 | E862: 傲霜庵 | F862: 第1版
C863: 日星秘密协议？ | D863: 短评 | E863: 傲霜庵 | F863: 第1版
A864: =COUNTA($B$2:B864) -> 730 | B864: 12778. | C864: 欢迎南新大使 | D864: 短评 | E864: 傲霜庵 | F864: 第1版
A865: =COUNTA($B$2:B865) -> 731 | B865: 12779. | C865: 杜绝洋米与利用洋米 | D865: 时论 | E865: 季---转录《申报》 | F865: 第1版
A866: =COUNTA($B$2:B866) -> 732 | B866: 12780. | C866: 送菱刈将军返国 | D866: 短评 | E866: 傲霜庵 | F866: 第1版
C867: 巨匪张学良伏法 | D867: 短评 | E867: 傲霜庵 | F867: 第1版
C868: 最低限度之保障 | D868: 短评 | E868: 傲霜庵 | F868: 第1版
C869: 国会不轻于言战 | D869: 短评 | E869: 傲霜庵 | F869: 第1版
A870: =COUNTA($B$2:B870) -> 736 | B870: 12781. | C870: 民主政治与独裁政治（上） | D870: 时论 | E870: 丁文江---转录天津《大公报》 | F870: 第1版
A871: =COUNTA($B$2:B871) -> 737 | B871: 12782. | C871: 民主政治与独裁政治（下） | D871: 时论 | E871: 丁文江---转录天津《大公报》 | F871: 第1版
A872: =COUNTA($B$2:B872) -> 738 | B872: 12783. | C872: 送岁之辞 | D872: 论说 | E872: 傲霜庵 | F872: 第1版
C873: 深泽君译西厢记 | D873: 论说 | E873: 傲霜庵 | F873: 第1版
A874: =COUNTA($B$2:B874) -> 740 | B874: 12789. | C874: 今后之西北铁路问题 | D874: 时论 | E874: 转录天津《大公报》 | F874: 第1版
A875: =COUNTA($B$2:B875) -> 741 | B875: 12790. | C875: 人民服工役之实际问题 | D875: 时论 | E875: 薪-转录天津《益世報》 | F875: 第1版
A876: =COUNTA($B$2:B876) -> 742 | B876: 12792. | C876: 办公事与办教育（上） | D876: 时论 | E876: 转录天津《益世報》 | F876: 第1版
A877: =COUNTA($B$2:B877) -> 743 | B877: 12793. | C877: 办公事与办教育（下） | D877: 时论 | E877: 转录天津《益世報》 | F877: 第1版
A878: =COUNTA($B$2:B878) -> 744 | B878: 12794. | C878: 自今日起通邮 | D878: 论说 | E878: 傲霜庵 | F878: 第1版
A879: =COUNTA($B$2:B879) -> 745 | B879: 12795. | C879: 法外长访问罗马 | D879: 时论 | E879: 匿名 | F879: 第1版
A880: =COUNTA($B$2:B880) -> 746 | B880: 12796. | C880: 忠告邮政当局 | D880: 短评 | E880: 傲霜庵 | F880: 第1版
C881: 康平鼠疫猖獗 | D881: 短评 | E881: 傲霜庵 | F881: 第1版
C882: 共产军集中川省 | D882: 短评 | E882: 傲霜庵 | F882: 第1版
C883: 不景气之二现象 | D883: 短评 | E883: 傲霜庵 | F883: 第1版
A884: =COUNTA($B$2:B884) -> 750 | B884: 12797. | C884: 萨尔日本投票 | D884: 短评 | E884: 傲霜庵 | F884: 第1版
C885: 日英与最高限度 | D885: 短评 | E885: 傲霜庵 | F885: 第1版
C886: 不太平之太平洋 | D886: 短评 | E886: 傲霜庵 | F886: 第1版
A887: =COUNTA($B$2:B887) -> 753 | B887: 12799. | C887: 中国耕地减少之可虞 | D887: 时论 | E887: 恒---转录《申报》 | F887: 第1版
A888: =COUNTA($B$2:B888) -> 754 | B888: 12800. | C888: 中国公务员保障之必要 | D888: 时论 | E888: 梦仙---转录《新闻报》 | F888: 第1版
A889: =COUNTA($B$2:B889) -> 755 | B889: 12801. | C889: 萨尔投票以后 | D889: 短评 | E889: 傲霜庵 | F889: 第1版
C890: 老冯欢迎孙科 | D890: 短评 | E890: 傲霜庵 | F890: 第1版
C891: 意宰相兼任七职 | D891: 短评 | E891: 傲霜庵 | F891: 第1版
A892: =COUNTA($B$2:B892) -> 758 | B892: 12802. | C892: 法德民族之长短 | D892: 短评 | E892: 傲霜庵 | F892: 第1版
C893: 铁路网次第完成 | D893: 短评 | E893: 傲霜庵 | F893: 第1版
C894: 中国字之拉丁化 | D894: 短评 | E894: 傲霜庵 | F894: 第1版
C895: 东太平洋之横断 | D895: 短评 | E895: 傲霜庵 | F895: 第1版
A896: =COUNTA($B$2:B896) -> 762 | B896: 12803. | C896: 美国白银法案之将来与世界银币 | D896: 时论 | E896: 有---转录《申报》 | F896: 第1版
A897: =COUNTA($B$2:B897) -> 763 | B897: 12804. | C897: 胡适开罪广东 | D897: 短评 | E897: 傲霜庵 | F897: 第1版
C898: 两党之比较 | D898: 短评 | E898: 傲霜庵 | F898: 第1版
C899: 禁止洋布衣服 | D899: 短评 | E899: 傲霜庵 | F899: 第1版
A900: =COUNTA($B$2:B900) -> 766 | B900: 12807. | C900: 旧年开抢案之管见 | D900: 论说 | E900: 匿名 | F900: 第1版
A901: =COUNTA($B$2:B901) -> 767 | B901: 12808. | C901: 北铁交涉之成立 | D901: 短评 | E901: 傲霜庵 | F901: 第1版
C902: 世界和平之观测 | D902: 短评 | E902: 傲霜庵 | F902: 第1版
C903: 南京禁止烫发 | D903: 短评 | E903: 傲霜庵 | F903: 第1版
C904: 废年云乎哉 | D904: 短评 | E904: 傲霜庵 | F904: 第1版
A905: =COUNTA($B$2:B905) -> 771 | B905: 12809. | C905: 剿匪与满洲国 | D905: 论说 | E905: 傲霜庵 | F905: 第1版
A906: =COUNTA($B$2:B906) -> 772 | B906: 12810. | C906: 中国合作事业之检讨 | D906: 时论 | E906: 遂初---转录《新闻报》 | F906: 第1版
A907: =COUNTA($B$2:B907) -> 773 | B907: 12811. | C907: 热西侵境问题 | D907: 短评 | E907: 傲霜庵 | F907: 第1版
C908: 马博士之谬论 | D908: 短评 | E908: 傲霜庵 | F908: 第1版
C909: 苏俄粮食与工资 | D909: 短评 | E909: 傲霜庵 | F909: 第1版
A910: =COUNTA($B$2:B910) -> 776 | B910: 12813. | C910: 中国之洋米问题 | D910: 时论 | E910: 柳---转录《申报》 | F910: 第1版
A911: =COUNTA($B$2:B911) -> 777 | B911: 12814. | C911: 救济商业之不容缓 | D911: 时说 | E911: 匿名 | F911: 第1版
A912: =COUNTA($B$2:B912) -> 778 | B912: 12815. | C912: 中日外交之转机 | D912: 短评 | E912: 傲霜庵 | F912: 第1版
C913: 将勿骄 兵勿悍 | D913: 短评 | E913: 傲霜庵 | F913: 第1版
A914: =COUNTA($B$2:B914) -> 780 | B914: 12816. | C914: 古物运英之是非 | D914: 短评 | E914: 傲霜庵 | F914: 第1版
C915: 美发表秘密文件 | D915: 短评 | E915: 傲霜庵 | F915: 第1版
C916: 需费四元可结婚 | D916: 短评 | E916: 傲霜庵 | F916: 第1版
C917: 美国寒威肆虐 | D917: 短评 | E917: 傲霜庵 | F917: 第1版
A918: =COUNTA($B$2:B918) -> 784 | B918: 12817. | C918: 中国人之战争观 | D918: 论说 | E918: 傲霜庵 | F918: 第1版
C919: 吊不承认主义 | D919: 论说 | E919: 傲霜庵 | F919: 第1版
C920: 梅兰芳将赴俄 | D920: 论说 | E920: 傲霜庵 | F920: 第1版
A921: =COUNTA($B$2:B921) -> 787 | B921: 12818. | C921: 共匪图入川南 | D921: 时论 | E921: 步陶---转录《新闻报》 | F921: 第1版
A922: =COUNTA($B$2:B922) -> 788 | B922: 12822. | C922: 中国金融与银行业 | D922: 时论 | E922: 转录天津《益世報》 | F922: 第1版
A923: =COUNTA($B$2:B923) -> 789 | B923: 12823. | C923: 美参院否决加入世界法庭案 | D923: 时论 | E923: 恒 | F923: 第1版
A924: =COUNTA($B$2:B924) -> 790 | B924: 12824. | C924: 全欧与“孤德”政策 | D924: 短评 | E924: 傲霜庵 | F924: 第1版
C925: 美俄间之裂痕 | D925: 短评 | E925: 傲霜庵 | F925: 第1版
C926: 外蒙之与中俄 | D926: 短评 | E926: 傲霜庵 | F926: 第1版
A927: =COUNTA($B$2:B927) -> 793 | B927: 12825. | C927: “孤日”政策之荒谬 | D927: 短评 | E927: 傲霜庵 | F927: 第1版
C928: 中日接近之可喜 | D928: 短评 | E928: 傲霜庵 | F928: 第1版
C929: 炞炮代价十万元 | D929: 短评 | E929: 傲霜庵 | F929: 第1版
A930: =COUNTA($B$2:B930) -> 796 | B930: 12827. | C930: 中国团结运动一段落 | D930: 时论 | E930: 转录天津《大公报》 | F930: 第1版
A931: =COUNTA($B$2:B931) -> 797 | B931: 12828. | C931: 春节之社会观感 | D931: 论说 | E931: 匿名 | F931: 第1版
A932: =COUNTA($B$2:B932) -> 798 | B932: 12829. | C932: 苏俄怀疑英国 | D932: 短评 | E932: 傲霜庵 | F932: 第1版
C933: 危机临头之中国 | D933: 短评 | E933: 傲霜庵 | F933: 第1版
C934: 统共九十九岁 | D934: 短评 | E934: 傲霜庵 | F934: 第1版
C935: 意俄两军动突 | D935: 短评 | E935: 傲霜庵 | F935: 第1版
A936: =COUNTA($B$2:B936) -> 802 | B936: 12830. | C936: 美国大飞船坠落 | D936: 短评 | E936: 傲霜庵 | F936: 第1版
C937: 和平最佳之保障 | D937: 短评 | E937: 傲霜庵 | F937: 第1版
C938: 冻鸭野鸡之出口 | D938: 短评 | E938: 傲霜庵 | F938: 第1版
C939: 愿住满洲帝国 | D939: 短评 | E939: 傲霜庵 | F939: 第1版
A940: =COUNTA($B$2:B940) -> 806 | B940: 12834. | C940: 中国的耕地面积与人口 | D940: 时论 | E940: 转录天津《益世報》 | F940: 第1版
A941: =COUNTA($B$2:B941) -> 807 | B941: 12835. | C941: 整顿教育之私见 | D941: 论说 | E941: 匿名 | F941: 第1版
A942: =COUNTA($B$2:B942) -> 808 | B942: 12836. | C942: 道义之与满洲国 | D942: 短评 | E942: 傲霜庵 | F942: 第1版
C943: 意军二万出动 | D943: 短评 | E943: 傲霜庵 | F943: 第1版
C944: 中国祭丁汝昌 | D944: 短评 | E944: 傲霜庵 | F944: 第1版
A945: =COUNTA($B$2:B945) -> 811 | B945: 12837. | C945: “卑勿高”的行政改革论 | D945: 时论 | E945: 转录天津《大公报》 | F945: 第1版
A946: =COUNTA($B$2:B946) -> 812 | B946: 12838. | C946: 地方制度改革之感想 | D946: 时论 | E946: 傅孟真 | F946: 第1版
A947: =COUNTA($B$2:B947) -> 813 | B947: 12839. | C947: 两事开和平之门 | D947: 时论 | E947: 转录《时事新报》 | F947: 第1版
A948: =COUNTA($B$2:B948) -> 814 | B948: 12841. | C948: 聊村建设为今日救国之一方案 | D948: 时论 | E948: 步陶---转录《申报》 | F948: 第1版
A949: =COUNTA($B$2:B949) -> 815 | B949: 12842. | C949: 论春令卫生 | D949: 论说 | E949: 匿名 | F949: 第1版
A950: =COUNTA($B$2:B950) -> 816 | B950: 12843. | C950: 末路穷途之国联 | D950: 短评 | E950: 傲霜庵 | F950: 第1版
C951: 民国要人与山林 | D951: 短评 | E951: 傲霜庵 | F951: 第1版
C952: 评民族扫墓节 | D952: 短评 | E952: 傲霜庵 | F952: 第1版
C953: 欧洲定局不安定 | D953: 短评 | E953: 傲霜庵 | F953: 第1版
A954: =COUNTA($B$2:B954) -> 820 | B954: 12845. | C954: 中国统一币制之前 | D954: 时论 | E954: 贞 | F954: 第1版
A955: =COUNTA($B$2:B955) -> 821 | B955: 12847. | C955: 最后之营造皇宫 | D955: 短评 | E955: 傲霜庵 | F955: 第1版
C956: 英美对中日猜疑 | D956: 短评 | E956: 傲霜庵 | F956: 第1版
C957: 哀悼逍遥博士 | D957: 短评 | E957: 傲霜庵 | F957: 第1版
A958: =COUNTA($B$2:B958) -> 824 | B958: 12848. | C958: 汇水腾踊与商民关系 | D958: 论说 | E958: 匿名 | F958: 第1版
A959: =COUNTA($B$2:B959) -> 825 | B959: 12849. | C959: 申新第七纱厂拍卖感言 | D959: 时论 | E959: 转录天津《大公报》 | F959: 第1版
A960: =COUNTA($B$2:B960) -> 826 | B960: 12850. | C960: 奥大利当局返国以后 | D960: 时论 | E960: 转录《时事新报》 | F960: 第1版
A961: =COUNTA($B$2:B961) -> 827 | B961: 12852. | C961: 日英美与中国 | D961: 短评 | E961: 傲霜庵 | F961: 第1版
C962: 希腊叛乱前途 | D962: 短评 | E962: 傲霜庵 | F962: 第1版
C963: 申七厂拍卖我观 | D963: 短评 | E963: 傲霜庵 | F963: 第1版
A964: =COUNTA($B$2:B964) -> 830 | B964: 12853. | C964: 敬祝大战纪念日 | D964: 短评 | E964: 傲霜庵 | F964: 第1版
C965: 巴尔干又危矣 | D965: 短评 | E965: 傲霜庵 | F965: 第1版
C966: 英国扩军的口实 | D966: 短评 | E966: 傲霜庵 | F966: 第1版
A967: =COUNTA($B$2:B967) -> 833 | B967: 12855. | C967: 法奥谈话 | D967: 时论 | E967: 匿名 | F967: 第1版
A968: =COUNTA($B$2:B968) -> 834 | B968: 12857. | C968: 中国经济之矛盾与出路（上） | D968: 时论 | E968: 何廉 | F968: 第1版
A969: =COUNTA($B$2:B969) -> 835 | B969: 12858. | C969: 中国经济之矛盾与出路（下） | D969: 时论 | E969: 何廉 | F969: 第1版
A970: =COUNTA($B$2:B970) -> 836 | B970: 12859. | C970: 北铁接受在即 | D970: 短评 | E970: 傲霜庵 | F970: 第1版
C971: 中国与白银政策 | D971: 短评 | E971: 傲霜庵 | F971: 第1版
C972: 人间何其多事 | D972: 短评 | E972: 傲霜庵 | F972: 第1版
A973: =COUNTA($B$2:B973) -> 839 | B973: 12860. | C973: 德国空军之复兴 | D973: 短评 | E973: 傲霜庵 | F973: 第1版
C974: 华俄态度转佳 | D974: 短评 | E974: 傲霜庵 | F974: 第1版
C975: 黄河情势危急 | D975: 短评 | E975: 傲霜庵 | F975: 第1版
A976: =COUNTA($B$2:B976) -> 842 | B976: 12862. | C976: 德国外交之检讨 | D976: 时论 | E976: 匿名 | F976: 第1版
A977: =COUNTA($B$2:B977) -> 843 | B977: 12863. | C977: 勗中学教员 | D977: 论说 | E977: 匿名 | F977: 第1版
A978: =COUNTA($B$2:B978) -> 844 | B978: 12864. | C978: 论黄灾 | D978: 时论 | E978: 匿名 | F978: 第1版
A979: =COUNTA($B$2:B979) -> 845 | B979: 12865. | C979: 春日旅行之意义 | D979: 时论 | E979: 匿名 | F979: 第1版
A980: =COUNTA($B$2:B980) -> 846 | B980: 12866. | C980: 中国岂容偷安？ | D980: 时论 | E980: 转录《庸报》 | F980: 第1版
A981: =COUNTA($B$2:B981) -> 847 | B981: 12869. | C981: 希特勒巨弹之影响 | D981: 时论 | E981: 匿名 | F981: 第1版
A982: =COUNTA($B$2:B982) -> 848 | B982: 12870. | C982: 军界宜整顿纪律 | D982: 论说 | E982: 匿名 | F982: 第1版
A983: =COUNTA($B$2:B983) -> 849 | B983: 12871. | C983: 论上海市面救济问题 | D983: 时论 | E983: 匿名 | F983: 第1版
A984: =COUNTA($B$2:B984) -> 850 | B984: 12872. | C984: 现在中国的中年与青年（上） | D984: 时论 | E984: 丁文江---转录天津《大公报》 | F984: 第1版
A985: =COUNTA($B$2:B985) -> 851 | B985: 12873. | C985: 现在中国的中年与青年（下） | D985: 时论 | E985: 丁文江---转录天津《大公报》 | F985: 第1版
A986: =COUNTA($B$2:B986) -> 852 | B986: 12874. | C986: 自杀应速纠正 | D986: 时论 | E986: 匿名 | F986: 第1版
A987: =COUNTA($B$2:B987) -> 853 | B987: 12878. | C987: 乞丐为市容障碍 | D987: 论说 | E987: 匿名 | F987: 第1版
A988: =COUNTA($B$2:B988) -> 854 | B988: 12879. | C988: 英德谈判与和平 | D988: 论说 | E988: 转录天津《大公报》 | F988: 第1版
A989: =COUNTA($B$2:B989) -> 855 | B989: 12880. | C989: 优生问题与子女教育 | D989: 时论 | E989: 转录《晨报》 | F989: 第1版
A990: =COUNTA($B$2:B990) -> 856 | B990: 12883. | C990: 中国经济之解剖 | D990: 时论 | E990: 匿名 | F990: 第2版
A991: =COUNTA($B$2:B991) -> 857 | B991: 12884. | C991: 厉行清洁 | D991: 论说 | E991: 匿名 | F991: 第2版
A992: =COUNTA($B$2:B992) -> 858 | B992: 12885. | C992: 国际会议谈无裨和平 | D992: 时论 | E992: 匿名 | F992: 第2版
A993: =COUNTA($B$2:B993) -> 859 | B993: 12886. | C993: 沙逊建议的检讨 | D993: 时论 | E993: 转录《时事新报》 | F993: 第2版
A994: =COUNTA($B$2:B994) -> 860 | B994: 12887. | C994: 中国推行春耕运动（上） | D994: 时论 | E994: 转录天津《益世報》 | F994: 第2版
A995: =COUNTA($B$2:B995) -> 861 | B995: 12888. | C995: 中国推行春耕运动（下） | D995: 时论 | E995: 转录天津《益世報》 | F995: 第2版
A996: =COUNTA($B$2:B996) -> 862 | B996: 12890. | C996: 读书运动与对象 | D996: 时论 | E996: 匿名 | F996: 第2版
A997: =COUNTA($B$2:B997) -> 863 | B997: 12891. | C997: 粮价昂贵与春耕关系 | D997: 论说 | E997: 匿名 | F997: 第2版
A998: =COUNTA($B$2:B998) -> 864 | B998: 12892. | C998: 波兰--往那里去？ | D998: 时论 | E998: 匿名 | F998: 第2版
A999: =COUNTA($B$2:B999) -> 865 | B999: 12893. | C999: 如何应付白银风潮？ | D999: 时论 | E999: 匿名 | F999: 第2版
A1000: =COUNTA($B$2:B1000) -> 866 | B1000: 12894. | C1000: 哀川黔民众 | D1000: 时论 | E1000: 转录天津《大公报》 | F1000: 第2版
A1001: =COUNTA($B$2:B1001) -> 867 | B1001: 12895. | C1001: 国际漩涡中的奥大利 | D1001: 时论 | E1001: 转录天津《益世報》 | F1001: 第2版
A1002: =COUNTA($B$2:B1002) -> 868 | B1002: 12897. | C1002: 国际经济门争之新阶级 | D1002: 时论 | E1002: 转录天津《大公报》 | F1002: 第2版
A1003: =COUNTA($B$2:B1003) -> 869 | B1003: 12898. | C1003: 滇缅划界问题 | D1003: 时论 | E1003: 转录天津《大公报》 | F1003: 第2版
A1004: =COUNTA($B$2:B1004) -> 870 | B1004: 12899. | C1004: 读书风气之养成 | D1004: 时论 | E1004: 转录《晨报》 | F1004: 第2版
A1005: =COUNTA($B$2:B1005) -> 871 | B1005: 12900. | C1005: 法俄商定互助条约 | D1005: 时论 | E1005: 匿名 | F1005: 第1版
A1006: =COUNTA($B$2:B1006) -> 872 | B1006: 12905. | C1006: 如何改进中国大学教育 | D1006: 时论 | E1006: 转录天津《大公报》 | F1006: 第1版
A1007: =COUNTA($B$2:B1007) -> 873 | B1007: 12906. | C1007: 法国际遇之困难 | D1007: 时论 | E1007: 转录天津《益世報》 | F1007: 第1版
A1008: =COUNTA($B$2:B1008) -> 874 | B1008: 12907. | C1008: 救济中国工商业之道 | D1008: 时论 | E1008: 转录天津《大公报》 | F1008: 第1版
A1009: =COUNTA($B$2:B1009) -> 875 | B1009: 12908. | C1009: 论中国青年训练问题（上） | D1009: 时论 | E1009: 转录天津《大公报》 | F1009: 第1版
A1010: =COUNTA($B$2:B1010) -> 876 | B1010: 12909. | C1010: 论中国青年训练问题（下） | D1010: 时论 | E1010: 转录天津《大公报》 | F1010: 第1版
A1011: =COUNTA($B$2:B1011) -> 877 | B1011: 12911. | C1011: 中国对于滇缅勘界之希望 | D1011: 时论 | E1011: 石龙---转录《新闻报》 | F1011: 第1版
A1012: =COUNTA($B$2:B1012) -> 878 | B1012: 12912. | C1012: 匪患又形猖獗 | D1012: 论说 | E1012: 匿名 | F1012: 第1版
A1013: =COUNTA($B$2:B1013) -> 879 | B1013: 12913. | C1013: 中国金融病态应求根本治疗 | D1013: 时论 | E1013: 转录《北平晨报》 | F1013: 第1版
A1014: =COUNTA($B$2:B1014) -> 880 | B1014: 12914. | C1014: 这不是观樱会 | D1014: 短评 | E1014: 傲霜庵 | F1014: 第1版
C1015: 魔术家希特勒 | D1015: 短评 | E1015: 傲霜庵 | F1015: 第1版
C1016: 强权乎？外交乎？ | D1016: 短评 | E1016: 傲霜庵 | F1016: 第1版
C1017: 匪贼蠢动时期 | D1017: 短评 | E1017: 傲霜庵 | F1017: 第1版
A1018: =COUNTA($B$2:B1018) -> 884 | B1018: 12915. | C1018: 英皇御极二五年 | D1018: 短评 | E1018: 傲霜庵 | F1018: 第1版
C1019: 官僚之危险性 | D1019: 短评 | E1019: 傲霜庵 | F1019: 第1版
C1020: 南非风云又急 | D1020: 短评 | E1020: 傲霜庵 | F1020: 第1版
A1021: =COUNTA($B$2:B1021) -> 887 | B1021: 12916. | C1021: 中国教育家着眼实际 | D1021: 时论 | E1021: 转录《庸报》 | F1021: 第1版
A1022: =COUNTA($B$2:B1022) -> 888 | B1022: 12918. | C1022: 互换大使感言 | D1022: 短评 | E1022: 傲霜庵 | F1022: 第1版
C1023: 英国之与帝制 | D1023: 短评 | E1023: 傲霜庵 | F1023: 第1版
C1024: 蒋介石入云南 | D1024: 短评 | E1024: 傲霜庵 | F1024: 第1版
C1025: 美机哪儿去？ | D1025: 短评 | E1025: 傲霜庵 | F1025: 第1版
A1026: =COUNTA($B$2:B1026) -> 892 | B1026: 12919. | C1026: 国民极应矫正之弱点 | D1026: 论说 | E1026: 匿名 | F1026: 第1版
A1027: =COUNTA($B$2:B1027) -> 893 | B1027: 12920. | C1027: 国民庆祝大会 | D1027: 短评 | E1027: 傲霜庵 | F1027: 第1版
C1028: 很聪明的财政家 | D1028: 短评 | E1028: 傲霜庵 | F1028: 第1版
C1029: 拍卖北华太岛？ | D1029: 短评 | E1029: 傲霜庵 | F1029: 第1版
A1030: =COUNTA($B$2:B1030) -> 896 | B1030: 12921. | C1030: 不容外国置喙 | D1030: 短评 | E1030: 傲霜庵 | F1030: 第1版
C1031: 二十余村祈雨 | D1031: 短评 | E1031: 傲霜庵 | F1031: 第1版
C1032: 吴清源归化日本 | D1032: 短评 | E1032: 傲霜庵 | F1032: 第1版
C1033: 贾波林竟屈？ | D1033: 短评 | E1033: 傲霜庵 | F1033: 第1版
A1034: =COUNTA($B$2:B1034) -> 900 | B1034: 12922. | C1034: 麦唐纳宣言之剖视 | D1034: 时论 | E1034: 天放 | F1034: 第1版
A1035: =COUNTA($B$2:B1035) -> 901 | B1035: 12923. | C1035: 本日马拉松比赛 | D1035: 短评 | E1035: 傲霜庵 | F1035: 第1版
C1036: 五十年后中国 | D1036: 短评 | E1036: 傲霜庵 | F1036: 第1版
C1037: 两年财政报告 | D1037: 短评 | E1037: 傲霜庵 | F1037: 第1版
A1038: =COUNTA($B$2:B1038) -> 904 | B1038: 12925. | C1038: 英美油商撤退？ | D1038: 短评 | E1038: 傲霜庵 | F1038: 第1版
C1039: 蒙古人口问题 | D1039: 短评 | E1039: 傲霜庵 | F1039: 第1版
C1040: 马拉松大会告竣 | D1040: 短评 | E1040: 傲霜庵 | F1040: 第1版
A1041: =COUNTA($B$2:B1041) -> 907 | B1041: 12926. | C1041: 华北防旱运动 | D1041: 时论 | E1041: 转录《庸报》 | F1041: 第1版
A1042: =COUNTA($B$2:B1042) -> 908 | B1042: 12927. | C1042: 官场之大更动 | D1042: 论说 | E1042: 傲霜庵 | F1042: 第1版
C1043: 美国吃银已饱 | D1043: 论说 | E1043: 傲霜庵 | F1043: 第1版
C1044: 北满英伦大雪 | D1044: 论说 | E1044: 傲霜庵 | F1044: 第1版
C1045: 美国巨机肇祸 | D1045: 论说 | E1045: 傲霜庵 | F1045: 第1版
A1046: =COUNTA($B$2:B1046) -> 912 | B1046: 12928. | C1046: 升格后经费与入选 | D1046: 时论 | E1046: 转录《北平晨报》 | F1046: 第1版
A1047: =COUNTA($B$2:B1047) -> 913 | B1047: 12929. | C1047: 英国国民内阁之前途 | D1047: 时论 | E1047: 绛 | F1047: 第1版
A1048: =COUNTA($B$2:B1048) -> 914 | B1048: 12930. | C1048: 意大利食指欲动 | D1048: 时论 | E1048: 匿名 | F1048: 第1版
A1049: =COUNTA($B$2:B1049) -> 915 | B1049: 12932. | C1049: 别开生面的遗嘱 | D1049: 时论 | E1049: 呔 | F1049: 第1版
A1050: =COUNTA($B$2:B1050) -> 916 | B1050: 12933. | C1050: 中国纱厂的前途 | D1050: 时论 | E1050: 转录天津《大公报》 | F1050: 第1版
A1051: =COUNTA($B$2:B1051) -> 917 | B1051: 12934. | C1051: 希特勒演说与今后欧洲局势 | D1051: 时论 | E1051: 匿名 | F1051: 第1版
A1052: =COUNTA($B$2:B1052) -> 918 | B1052: 12935. | C1052: 由减缩政费到行政改造 | D1052: 时论 | E1052: 转录天津《大公报》 | F1052: 第1版
A1053: =COUNTA($B$2:B1053) -> 919 | B1053: 12936. | C1053: 华北空气恶化 | D1053: 短评 | E1053: 傲霜庵 | F1053: 第1版
C1054: 新邦文化事业 | D1054: 短评 | E1054: 傲霜庵 | F1054: 第1版
C1055: 极救饿鬼地狱 | D1055: 短评 | E1055: 傲霜庵 | F1055: 第1版
A1056: =COUNTA($B$2:B1056) -> 922 | B1056: 12937. | C1056: 法内阁更动 | D1056: 短评 | E1056: 傲霜庵 | F1056: 第1版
C1057: 复兴运动失败 | D1057: 短评 | E1057: 傲霜庵 | F1057: 第1版
C1058: 欧美草木皆兵 | D1058: 短评 | E1058: 傲霜庵 | F1058: 第1版
C1059: 满洲里会议 | D1059: 短评 | E1059: 傲霜庵 | F1059: 第1版
A1060: =COUNTA($B$2:B1060) -> 926 | B1060: 12939. | C1060: 考察团做何感想？ | D1060: 时论 | E1060: 转录天津《益世報》 | F1060: 第1版
A1061: =COUNTA($B$2:B1061) -> 927 | B1061: 12940. | C1061: 为今之办理自治者进一言 | D1061: 时论 | E1061: 步陶---转录《新闻报》 | F1061: 第1版
A1062: =COUNTA($B$2:B1062) -> 928 | B1062: 12942. | C1062: 中国迅速开发西北 | D1062: 时论 | E1062: 转录《庸报》 | F1062: 第1版
A1063: =COUNTA($B$2:B1063) -> 929 | B1063: 12943. | C1063: 希望和平解决 | D1063: 短评 | E1063: 傲霜庵 | F1063: 第1版
C1064: 法内阁生存四日 | D1064: 短评 | E1064: 傲霜庵 | F1064: 第1版
C1065: 劝告美国开查团 | D1065: 短评 | E1065: 傲霜庵 | F1065: 第1版
A1066: =COUNTA($B$2:B1066) -> 932 | B1066: 12944. | C1066: 生活压迫下的牺牲 | D1066: 时论 | E1066: 梦若 | F1066: 第1版
A1067: =COUNTA($B$2:B1067) -> 933 | B1067: 12946. | C1067: 青年不屑做小事之心理探索 | D1067: 时论 | E1067: 梦燕---转录《新闻报》 | F1067: 第1版
A1068: =COUNTA($B$2:B1068) -> 934 | B1068: 12947. | C1068: 东边饥民自杀之可惨 | D1068: 论说 | E1068: 匿名 | F1068: 第1版
A1069: =COUNTA($B$2:B1069) -> 935 | B1069: 12948. | C1069: 东隅之与桑榆 | D1069: 短评 | E1069: 傲霜庵 | F1069: 第1版
C1070: 英国内阁更动 | D1070: 短评 | E1070: 傲霜庵 | F1070: 第1版
C1071: 古物元老出洋 | D1071: 短评 | E1071: 傲霜庵 | F1071: 第1版
C1072: 地狱之与天堂 | D1072: 短评 | E1072: 傲霜庵 | F1072: 第1版
A1073: =COUNTA($B$2:B1073) -> 939 | B1073: 12949. | C1073: 俄蒙果协定 | D1073: 短评 | E1073: 傲霜庵 | F1073: 第1版
C1074: 中国禁烟过酷 | D1074: 短评 | E1074: 傲霜庵 | F1074: 第1版
C1075: 简体字之推行 | D1075: 短评 | E1075: 傲霜庵 | F1075: 第1版
A1076: =COUNTA($B$2:B1076) -> 942 | B1076: 12950. | C1076: 对华经济援助 | D1076: 短评 | E1076: 傲霜庵 | F1076: 第1版
C1077: 今后华北政权 | D1077: 短评 | E1077: 傲霜庵 | F1077: 第1版
C1078: 墨索里尼阅军 | D1078: 短评 | E1078: 傲霜庵 | F1078: 第1版
A1079: =COUNTA($B$2:B1079) -> 945 | B1079: 12951. | C1079: 金融潮中之善后方案 | D1079: 时论 | E1079: 匿名 | F1079: 第1版
A1080: =COUNTA($B$2:B1080) -> 946 | B1080: 12953. | C1080: 国际安定货币的呼声 | D1080: 时论 | E1080: 转录《时事新报》 | F1080: 第1版
A1081: =COUNTA($B$2:B1081) -> 947 | B1081: 12954. | C1081: 防止传染病之必要 | D1081: 论说 | E1081: 匿名 | F1081: 第1版
A1082: =COUNTA($B$2:B1082) -> 948 | B1082: 12955. | C1082: 阿比西尼亚问题的国际性 | D1082: 时论 | E1082: 匿名 | F1082: 第1版
A1083: =COUNTA($B$2:B1083) -> 949 | B1083: 12956. | C1083: 华北代理时代 | D1083: 短评 | E1083: 傲霜庵 | F1083: 第1版
C1084: 大宗赈粮将到 | D1084: 短评 | E1084: 傲霜庵 | F1084: 第1版
C1085: 欧洲情势混沌 | D1085: 短评 | E1085: 傲霜庵 | F1085: 第1版
A1086: =COUNTA($B$2:B1086) -> 952 | B1086: 12957. | C1086: 外交人才很多 | D1086: 短评 | E1086: 傲霜庵 | F1086: 第1版
C1087: 平津五光十色 | D1087: 短评 | E1087: 傲霜庵 | F1087: 第1版
C1088: 共匪入蜀会师 | D1088: 短评 | E1088: 傲霜庵 | F1088: 第1版
C1089: 轮船乎都市乎 | D1089: 短评 | E1089: 傲霜庵 | F1089: 第1版
A1090: =COUNTA($B$2:B1090) -> 956 | B1090: 12958. | C1090: 日本国力的根本 | D1090: 时论 | E1090: 转录天津《大公报》 | F1090: 第1版
A1091: =COUNTA($B$2:B1091) -> 957 | B1091: 12960. | C1091: 法国议会制度 | D1091: 短评 | E1091: 傲霜庵 | F1091: 第1版
C1092: 两舰叛变离粤 | D1092: 短评 | E1092: 傲霜庵 | F1092: 第1版
C1093: 萧伯纳之怪论 | D1093: 短评 | E1093: 傲霜庵 | F1093: 第1版
A1094: =COUNTA($B$2:B1094) -> 960 | B1094: 12961. | C1094: 情感与理智 | D1094: 论说 | E1094: 匿名 | F1094: 第1版
A1095: =COUNTA($B$2:B1095) -> 961 | B1095: 12962. | C1095: 很老？的外交 | D1095: 短评 | E1095: 傲霜庵 | F1095: 第1版
C1096: 党国与未亡人 | D1096: 短评 | E1096: 傲霜庵 | F1096: 第1版
C1097: 欧美航空捷路 | D1097: 短评 | E1097: 傲霜庵 | F1097: 第1版
A1098: =COUNTA($B$2:B1098) -> 964 | B1098: 12963. | C1098: 二年度总预算 | D1098: 短评 | E1098: 傲霜庵 | F1098: 第1版
C1099: 国境上之问题 | D1099: 短评 | E1099: 傲霜庵 | F1099: 第1版
C1100: 仅三小时改轨 | D1100: 短评 | E1100: 傲霜庵 | F1100: 第1版
C1101: 骇人听闻的军费 | D1101: 短评 | E1101: 傲霜庵 | F1101: 第1版
A1102: =COUNTA($B$2:B1102) -> 968 | B1102: 12964. | C1102: 华北近闻种种 | D1102: 短评 | E1102: 傲霜庵 | F1102: 第1版
C1103: 英国与满洲国 | D1103: 短评 | E1103: 傲霜庵 | F1103: 第1版
C1104: 黑人选手出现 | D1104: 短评 | E1104: 傲霜庵 | F1104: 第1版
A1105: =COUNTA($B$2:B1105) -> 971 | B1105: 12965. | C1105: 识宇运动与中文拉丁化 | D1105: 时论 | E1105: 佑辅 | F1105: 第1版
A1106: =COUNTA($B$2:B1106) -> 972 | B1106: 12967. | C1106: 英国双关政策 | D1106: 时论 | E1106: 匿名 | F1106: 第1版
A1107: =COUNTA($B$2:B1107) -> 973 | B1107: 12968. | C1107: 赈济灾民务须彻底 | D1107: 论说 | E1107: 匿名 | F1107: 第1版
A1108: =COUNTA($B$2:B1108) -> 974 | B1108: 12969. | C1108: 客气之与国际 | D1108: 短评 | E1108: 傲霜庵 | F1108: 第1版
C1109: 藏金的大殿堂 | D1109: 短评 | E1109: 傲霜庵 | F1109: 第1版
C1110: 邻邦两灾奇重 | D1110: 短评 | E1110: 傲霜庵 | F1110: 第1版
A1111: =COUNTA($B$2:B1111) -> 977 | B1111: 12970. | C1111: 国境上小纠葛 | D1111: 短评 | E1111: 傲霜庵 | F1111: 第1版
C1112: 英国之与国联 | D1112: 短评 | E1112: 傲霜庵 | F1112: 第1版
C1113: 滞空惊人纪录 | D1113: 短评 | E1113: 傲霜庵 | F1113: 第1版
C1114: 空前之大雨量 | D1114: 短评 | E1114: 傲霜庵 | F1114: 第1版
A1115: =COUNTA($B$2:B1115) -> 981 | B1115: 12971. | C1115: 意阿竟开战 | D1115: 论说 | E1115: 傲霜庵 | F1115: 第1版
A1116: =COUNTA($B$2:B1116) -> 982 | B1116: 12972. | C1116: 汪竟取消辞意 | D1116: 短评 | E1116: 傲霜庵 | F1116: 第1版
C1117: 铁路日夜延长 | D1117: 短评 | E1117: 傲霜庵 | F1117: 第1版
C1118: 四圣裔入南京 | D1118: 短评 | E1118: 傲霜庵 | F1118: 第1版
A1119: =COUNTA($B$2:B1119) -> 985 | B1119: 12974. | C1119: 福开森博士古物在平展览 | D1119: 时论 | E1119: 转录天津《大公报》 | F1119: 第1版
A1120: =COUNTA($B$2:B1120) -> 986 | B1120: 12975. | C1120: 暑期中人力车夫之可怜 | D1120: 论说 | E1120: 匿名 | F1120: 第1版
A1121: =COUNTA($B$2:B1121) -> 987 | B1121: 12976. | C1121: 新法律施行后之研讨 | D1121: 时论 | E1121: 转录《申报》 | F1121: 第1版
A1122: =COUNTA($B$2:B1122) -> 988 | B1122: 12977. | C1122: 社会紧缩与社会事业 | D1122: 时论 | E1122: 转录《新闻报》 | F1122: 第1版
A1123: =COUNTA($B$2:B1123) -> 989 | B1123: 12978. | C1123: 英法运用国联之今昔 | D1123: 时论 | E1123: 天放 | F1123: 第1版
A1124: =COUNTA($B$2:B1124) -> 990 | B1124: 12979. | C1124: 国境息事机关 | D1124: 短评 | E1124: 傲霜庵 | F1124: 第1版
C1125: 长江猛涨不已 | D1125: 短评 | E1125: 傲霜庵 | F1125: 第1版
C1126: 所谓非战条约 | D1126: 短评 | E1126: 傲霜庵 | F1126: 第1版
C1127: 最值得庆幸？ | D1127: 短评 | E1127: 傲霜庵 | F1127: 第1版
C1128: 特派二儿从军 | D1128: 短评 | E1128: 傲霜庵 | F1128: 第1版
C1129: ？深两舰北返 | D1129: 短评 | E1129: 傲霜庵 | F1129: 第1版
A1130: =COUNTA($B$2:B1130) -> 996 | B1130: 12981. | C1130: 肃清靡靡之音具体建议 | D1130: 时论 | E1130: 转录《时事新报》 | F1130: 第1版
A1131: =COUNTA($B$2:B1131) -> 997 | B1131: 12982. | C1131: 勗官吏当具责任心 | D1131: 论说 | E1131: 匿名 | F1131: 第1版
A1132: =COUNTA($B$2:B1132) -> 998 | B1132: 12983. | C1132: 万斛之清凉剂 | D1132: 短评 | E1132: 傲霜庵 | F1132: 第1版
C1133: 经济协定成立 | D1133: 短评 | E1133: 傲霜庵 | F1133: 第1版
C1134: 天热地热人热 | D1134: 短评 | E1134: 傲霜庵 | F1134: 第1版
A1135: =COUNTA($B$2:B1135) -> 1001 | B1135: 12984. | C1135: 老绅士与穷汉 | D1135: 短评 | E1135: 傲霜庵 | F1135: 第1版
C1136: 今年邻邦多灾 | D1136: 短评 | E1136: 傲霜庵 | F1136: 第1版
C1137: 最凉快的飞行 | D1137: 短评 | E1137: 傲霜庵 | F1137: 第1版
A1138: =COUNTA($B$2:B1138) -> 1004 | B1138: 12985. | C1138: 人定胜天 | D1138: 时论 | E1138: 转录天津《大公报》 | F1138: 第1版
A1139: =COUNTA($B$2:B1139) -> 1005 | B1139: 12986. | C1139: 德国大调查团 | D1139: 短评 | E1139: 傲霜庵 | F1139: 第1版
C1140: 福伯斯谈中国 | D1140: 短评 | E1140: 傲霜庵 | F1140: 第1版
C1141: 何就职宣誓乎 | D1141: 短评 | E1141: 傲霜庵 | F1141: 第1版
C1142: 英外交之太迟 | D1142: 短评 | E1142: 傲霜庵 | F1142: 第1版
A1143: =COUNTA($B$2:B1143) -> 1009 | B1143: 12988. | C1143: 义阿战机迫切 | D1143: 短评 | E1143: 傲霜庵 | F1143: 第1版
C1144: 去势之与杀戮 | D1144: 短评 | E1144: 傲霜庵 | F1144: 第1版
C1145: 当人热昏呓语 | D1145: 短评 | E1145: 傲霜庵 | F1145: 第1版
C1146: 太好的四川兵 | D1146: 短评 | E1146: 傲霜庵 | F1146: 第1版
A1147: =COUNTA($B$2:B1147) -> 1013 | B1147: 12989. | C1147: 实施官吏规约储金 | D1147: 论说 | E1147: 匿名 | F1147: 第1版
A1148: =COUNTA($B$2:B1148) -> 1014 | B1148: 12990. | C1148: 英美海军竞争？ | D1148: 短评 | E1148: 傲霜庵 | F1148: 第1版
C1149: 夏令营夏令钟 | D1149: 短评 | E1149: 傲霜庵 | F1149: 第1版
C1150: 欧洲险象环生 | D1150: 短评 | E1150: 傲霜庵 | F1150: 第1版
A1151: =COUNTA($B$2:B1151) -> 1017 | B1151: 12991. | C1151: 评中法越约 | D1151: 时论 | E1151: 转录天津《益世報》 | F1151: 第1版
A1152: =COUNTA($B$2:B1152) -> 1018 | B1152: 12992. | C1152: 冀省首府应努力之工作 | D1152: 时论 | E1152: 转录天津《大公报》 | F1152: 第1版
A1153: =COUNTA($B$2:B1153) -> 1019 | B1153: 12993. | C1153: 郑老慨捐垂范 | D1153: 短评 | E1153: 傲霜庵 | F1153: 第1版
C1154: 奈曼匪害骇闻 | D1154: 短评 | E1154: 傲霜庵 | F1154: 第1版
C1155: 意大利软化？ | D1155: 短评 | E1155: 傲霜庵 | F1155: 第1版
A1156: =COUNTA($B$2:B1156) -> 1022 | B1156: 12995. | C1156: 复兴民族与民族改造 | D1156: 时论 | E1156: 行安 | F1156: 第1版
A1157: =COUNTA($B$2:B1157) -> 1023 | B1157: 12996. | C1157: 论纸上政治 | D1157: 时论 | E1157: 转录天津《大公报》 | F1157: 第1版
A1158: =COUNTA($B$2:B1158) -> 1024 | B1158: 12997. | C1158: 论救济水灾 | D1158: 时论 | E1158: 转录《庸报》 | F1158: 第1版
A1159: =COUNTA($B$2:B1159) -> 1025 | B1159: 12998. | C1159: 陕北匪情不容忽视 | D1159: 时论 | E1159: 转录《晨报》 | F1159: 第1版
A1160: =COUNTA($B$2:B1160) -> 1026 | B1160: 12999. | C1160: 全满水灾浩劫 | D1160: 短评 | E1160: 傲霜庵 | F1160: 第1版
C1161: 满铁总裁易人 | D1161: 短评 | E1161: 傲霜庵 | F1161: 第1版
C1162: 矿业法公布 | D1162: 短评 | E1162: 傲霜庵 | F1162: 第1版
A1163: =COUNTA($B$2:B1163) -> 1029 | B1163: 13000. | C1163: 治黄何不实施巴尔格计划 | D1163: 时论 | E1163: 转录天津《益世報》 | F1163: 第1版
A1164: =COUNTA($B$2:B1164) -> 1030 | B1164: 13002. | C1164: 读“识字运动”与“中文拉丁化”后 | D1164: 来稿 | E1164: 续 | F1164: 第1版
A1165: =COUNTA($B$2:B1165) -> 1031 | B1165: 13003. | C1165: 读“识字运动”与“中文拉丁化”后 | D1165: 来稿 | E1165: 续 | F1165: 第1版
A1166: =COUNTA($B$2:B1166) -> 1032 | B1166: 13004. | C1166: 水灾将如何善后 | D1166: 短评 | E1166: 傲霜庵 | F1166: 第1版
C1167: 交通事故与警察 | D1167: 短评 | E1167: 傲霜庵 | F1167: 第1版
C1168: 战友丸与亲善关系 | D1168: 短评 | E1168: 傲霜庵 | F1168: 第1版
A1169: =COUNTA($B$2:B1169) -> 1035 | B1169: 13005. | C1169: 撤废之太早计 | D1169: 短评 | E1169: 傲霜庵 | F1169: 第1版
C1170: ？州事件重大 | D1170: 短评 | E1170: 傲霜庵 | F1170: 第1版
C1171: 人种问题化？ | D1171: 短评 | E1171: 傲霜庵 | F1171: 第1版
A1172: =COUNTA($B$2:B1172) -> 1038 | B1172: 13006. | C1172: 怪论咄咄逼人 | D1172: 短评 | E1172: 傲霜庵 | F1172: 第1版
C1173: 评中国儿童年 | D1173: 短评 | E1173: 傲霜庵 | F1173: 第1版
C1174: 国际的重婚案 | D1174: 短评 | E1174: 傲霜庵 | F1174: 第1版
C1175: 墨-蒋-日本 | D1175: 短评 | E1175: 傲霜庵 | F1175: 第1版
A1176: =COUNTA($B$2:B1176) -> 1042 | B1176: 13007. | C1176: 科学与自然战 | D1176: 短评 | E1176: 傲霜庵 | F1176: 第1版
C1177: 常用防疫机关 | D1177: 短评 | E1177: 傲霜庵 | F1177: 第1版
C1178: 横断北太平洋 | D1178: 短评 | E1178: 傲霜庵 | F1178: 第1版
A1179: =COUNTA($B$2:B1179) -> 1045 | B1179: 13009. | C1179: 希望中国教育部注意日本留学问题 | D1179: 时论 | E1179: 匿名 | F1179: 第1版
A1180: =COUNTA($B$2:B1180) -> 1046 | B1180: 13010. | C1180: 匪患又形猖獗 | D1180: 短评 | E1180: 傲霜庵 | F1180: 第1版
C1181: 实施保甲利益 | D1181: 短评 | E1181: 傲霜庵 | F1181: 第1版
C1182: 防水委会消解 | D1182: 短评 | E1182: 傲霜庵 | F1182: 第1版
A1183: =COUNTA($B$2:B1183) -> 1049 | B1183: 13011. | C1183: 论德国反犹运动 | D1183: 时论 | E1183: 转录《申报》 | F1183: 第1版
A1184: =COUNTA($B$2:B1184) -> 1050 | B1184: 13012. | C1184: 汪病之与政局 | D1184: 短评 | E1184: 傲霜庵 | F1184: 第1版
C1185: 日陆军暗刺案 | D1185: 短评 | E1185: 傲霜庵 | F1185: 第1版
C1186: 评国货卷烟节 | D1186: 短评 | E1186: 傲霜庵 | F1186: 第1版
A1187: =COUNTA($B$2:B1187) -> 1053 | B1187: 13013. | C1187: 收回牯岭租界 | D1187: 短评 | E1187: 傲霜庵 | F1187: 第1版
C1188: 阴险的黄祸论 | D1188: 短评 | E1188: 傲霜庵 | F1188: 第1版
C1189: 美华将有航邮 | D1189: 短评 | E1189: 傲霜庵 | F1189: 第1版
A1190: =COUNTA($B$2:B1190) -> 1056 | B1190: 13014. | C1190: 长江水患与废田还湖 | D1190: 时论 | E1190: 梦蕉---转录《新闻报》 | F1190: 第1版
A1191: =COUNTA($B$2:B1191) -> 1057 | B1191: 13016. | C1191: 安定中国货币的症结 | D1191: 时论 | E1191: 转录《时事新报》 | F1191: 第1版
A1192: =COUNTA($B$2:B1192) -> 1058 | B1192: 13017. | C1192: 国人极宜研究日文 | D1192: 论说 | E1192: 匿名 | F1192: 第1版
A1193: =COUNTA($B$2:B1193) -> 1059 | B1193: 13018. | C1193: 满洲国与中国大水灾 | D1193: 论说 | E1193: 傲霜庵 | F1193: 第1版
A1194: =COUNTA($B$2:B1194) -> 1060 | B1194: 13019. | C1194: 汪果复职乎 | D1194: 短评 | E1194: 傲霜庵 | F1194: 第1版
C1195: 美国之大损失 | D1195: 短评 | E1195: 傲霜庵 | F1195: 第1版
A1196: =COUNTA($B$2:B1196) -> 1062 | B1196: 13020. | C1196: 京滨一夜改轨 | D1196: 短评 | E1196: 傲霜庵 | F1196: 第1版
C1197: 大观舰式在即 | D1197: 短评 | E1197: 傲霜庵 | F1197: 第1版
C1198: 蒋汪仍旧合作 | D1198: 短评 | E1198: 傲霜庵 | F1198: 第1版
A1199: =COUNTA($B$2:B1199) -> 1065 | B1199: 13021. | C1199: 英国果崛起？ | D1199: 短评 | E1199: 傲霜庵 | F1199: 第1版
C1200: 航空交涉停顿 | D1200: 短评 | E1200: 傲霜庵 | F1200: 第1版
C1201: 新文字之实验 | D1201: 短评 | E1201: 傲霜庵 | F1201: 第1版
C1202: 天降之冰淇淋 | D1202: 短评 | E1202: 傲霜庵 | F1202: 第1版
A1203: =COUNTA($B$2:B1203) -> 1069 | B1203: 13023. | C1203: 广人民服工役 | D1203: 时论 | E1203: 转录《时事新报》 | F1203: 第1版
A1204: =COUNTA($B$2:B1204) -> 1070 | B1204: 13024. | C1204: 迭次发生越狱案 | D1204: 短评 | E1204: 傲霜庵 | F1204: 第1版
C1205: 空防意义之重大 | D1205: 短评 | E1205: 傲霜庵 | F1205: 第1版
C1206: 岂真习非成是乎 | D1206: 短评 | E1206: 傲霜庵 | F1206: 第1版
A1207: =COUNTA($B$2:B1207) -> 1073 | B1207: 13025. | C1207: 对俄严厉抗议 | D1207: 短评 | E1207: 傲霜庵 | F1207: 第1版
C1208: 意图之战争热 | D1208: 短评 | E1208: 傲霜庵 | F1208: 第1版
A1209: =COUNTA($B$2:B1209) -> 1075 | B1209: 13027. | C1209: 松罔新满铁总裁 | D1209: 论说 | E1209: 傲霜庵 | F1209: 第1版
A1210: =COUNTA($B$2:B1210) -> 1076 | B1210: 13028. | C1210: 英国下届总选举之前瞻 | D1210: 时论 | E1210: 绛 | F1210: 第1版
A1211: =COUNTA($B$2:B1211) -> 1077 | B1211: 13030. | C1211: 地中海风云 | D1211: 时论 | E1211: 匿名 | F1211: 第1版
A1212: =COUNTA($B$2:B1212) -> 1078 | B1212: 13031. | C1212: 世界殆无真是非 | D1212: 短评 | E1212: 傲霜庵 | F1212: 第1版
C1213: 求学当知其选择 | D1213: 短评 | E1213: 傲霜庵 | F1213: 第1版
C1214: 医学进步与奇病 | D1214: 短评 | E1214: 傲霜庵 | F1214: 第1版
A1215: =COUNTA($B$2:B1215) -> 1081 | B1215: 13032. | C1215: 世界棉战 | D1215: 时论 | E1215: 匿名 | F1215: 第1版
A1216: =COUNTA($B$2:B1216) -> 1082 | B1216: 13033. | C1216: 阿国之大胆让予 | D1216: 短评 | E1216: 傲霜庵 | F1216: 第1版
C1217: 不能不亲善 | D1217: 短评 | E1217: 傲霜庵 | F1217: 第1版
A1218: =COUNTA($B$2:B1218) -> 1084 | B1218: 13034. | C1218: 全欧练兵耀武 | D1218: 短评 | E1218: 傲霜庵 | F1218: 第1版
C1219: 不要大好利权 | D1219: 短评 | E1219: 傲霜庵 | F1219: 第1版
C1220: 宜写“满洲国” | D1220: 短评 | E1220: 傲霜庵 | F1220: 第1版
A1221: =COUNTA($B$2:B1221) -> 1087 | B1221: 13035. | C1221: 政整会裁撤以后 | D1221: 短评 | E1221: 傲霜庵 | F1221: 第1版
C1222: 党国步步追随 | D1222: 短评 | E1222: 傲霜庵 | F1222: 第1版
C1223: 痴汉之与悍妇 | D1223: 短评 | E1223: 傲霜庵 | F1223: 第1版
C1224: 机长的头衔 | D1224: 短评 | E1224: 傲霜庵 | F1224: 第1版
A1225: =COUNTA($B$2:B1225) -> 1091 | B1225: 13038. | C1225: 中秋节商业之不振 | D1225: 论说 | E1225: 匿名 | F1225: 第1版
A1226: =COUNTA($B$2:B1226) -> 1092 | B1226: 13039. | C1226: 今日之金融问题 | D1226: 时论 | E1226: 端---转录《申报》 | F1226: 第1版
A1227: =COUNTA($B$2:B1227) -> 1093 | B1227: 13041. | C1227: 贫穷的征服 | D1227: 时论 | E1227: 吴景超 | F1227: 第1版
A1228: =COUNTA($B$2:B1228) -> 1094 | B1228: 13044. | C1228: 平均土地言易行难 | D1228: 时论 | E1228: 转录《北平晨报》 | F1228: 第1版
A1229: =COUNTA($B$2:B1229) -> 1095 | B1229: 13045. | C1229: 河北省的新保甲制度 | D1229: 时论 | E1229: 转录天津《大公报》 | F1229: 第1版
A1230: =COUNTA($B$2:B1230) -> 1096 | B1230: 13046. | C1230: 德国的经济危机 | D1230: 时论 | E1230: 匿名 | F1230: 第1版
A1231: =COUNTA($B$2:B1231) -> 1097 | B1231: 13047. | C1231: 义国执意不让 | D1231: 短评 | E1231: 傲霜庵 | F1231: 第1版
C1232: 希特勒投一弹 | D1232: 短评 | E1232: 傲霜庵 | F1232: 第1版
C1233: 中国对义矛盾 | D1233: 短评 | E1233: 傲霜庵 | F1233: 第1版
A1234: =COUNTA($B$2:B1234) -> 1100 | B1234: 13048. | C1234: 中国再度落选 | D1234: 论说 | E1234: 傲霜庵 | F1234: 第1版
C1235: 呼呜圆桌会议 | D1235: 论说 | E1235: 傲霜庵 | F1235: 第1版
A1236: =COUNTA($B$2:B1236) -> 1102 | B1236: 13049. | C1236: 沈阳上空秋兴 | D1236: 短评 | E1236: 傲霜庵 | F1236: 第1版
C1237: 还是家常便饭 | D1237: 短评 | E1237: 傲霜庵 | F1237: 第1版
C1238: 中国入超大减 | D1238: 短评 | E1238: 傲霜庵 | F1238: 第1版
A1239: =COUNTA($B$2:B1239) -> 1105 | B1239: 13051. | C1239: 研究日本之必要 | D1239: 时论 | E1239: 转录《北平晨报》 | F1239: 第1版
A1240: =COUNTA($B$2:B1240) -> 1106 | B1240: 13052. | C1240: 意大利屈矣 | D1240: 论说 | E1240: 傲霜庵 | F1240: 第1版
A1241: =COUNTA($B$2:B1241) -> 1107 | B1241: 13053. | C1241: 统一币制与川省 | D1241: 时论 | E1241: 转录《时事新报》 | F1241: 第1版
A1242: =COUNTA($B$2:B1242) -> 1108 | B1242: 13054. | C1242: 中国何以穷？ | D1242: 时论 | E1242: 转录《北平晨报》 | F1242: 第1版
A1243: =COUNTA($B$2:B1243) -> 1109 | B1243: 13055. | C1243: 防空如是我观 | D1243: 论说 | E1243: 傲霜庵 | F1243: 第1版
C1244: 李滋罗斯来华 | D1244: 论说 | E1244: 傲霜庵 | F1244: 第1版
A1245: =COUNTA($B$2:B1245) -> 1111 | B1245: 13058. | C1245: 举世罹战争热 | D1245: 短评 | E1245: 傲霜庵 | F1245: 第1版
C1246: 不媚彼而媚此 | D1246: 短评 | E1246: 傲霜庵 | F1246: 第1版
C1247: 华向满铁购车 | D1247: 短评 | E1247: 傲霜庵 | F1247: 第1版
C1248: 脱盟之与经费 | D1248: 短评 | E1248: 傲霜庵 | F1248: 第1版
C1249: 活佛初看电影 | D1249: 短评 | E1249: 傲霜庵 | F1249: 第1版
A1250: =COUNTA($B$2:B1250) -> 1116 | B1250: 13059. | C1250: 政府注意国民经济 | D1250: 论说 | E1250: 匿名 | F1250: 第1版
A1251: =COUNTA($B$2:B1251) -> 1117 | B1251: 13060. | C1251: 美对华贸易衰落 | D1251: 时论 | E1251: 转录天津《益世報》 | F1251: 第1版
A1252: =COUNTA($B$2:B1252) -> 1118 | B1252: 13061. | C1252: 两仑战机渐动 | D1252: 短评 | E1252: 傲霜庵 | F1252: 第1版
C1253: 德国之与英法 | D1253: 短评 | E1253: 傲霜庵 | F1253: 第1版
C1254: 满铁大减预算 | D1254: 短评 | E1254: 傲霜庵 | F1254: 第1版
A1255: =COUNTA($B$2:B1255) -> 1121 | B1255: 13062. | C1255: 义军越境进击 | D1255: 短评 | E1255: 傲霜庵 | F1255: 第1版
C1256: 中国亦渐缩小 | D1256: 短评 | E1256: 傲霜庵 | F1256: 第1版
C1257: 极美丽的党旗 | D1257: 短评 | E1257: 傲霜庵 | F1257: 第1版
A1258: =COUNTA($B$2:B1258) -> 1124 | B1258: 13063. | C1258: 足食问题与农村复兴 | D1258: 时论 | E1258: 转录天津《益世報》 | F1258: 第1版
A1259: =COUNTA($B$2:B1259) -> 1125 | B1259: 13065. | C1259: 中国要人的兼差 | D1259: 时论 | E1259: 转录天津《益世報》 | F1259: 第1版
A1260: =COUNTA($B$2:B1260) -> 1126 | B1260: 13066. | C1260: 东边疲弊之推想 | D1260: 短评 | E1260: 傲霜庵 | F1260: 第1版
C1261: 日商公会对营业税 | D1261: 短评 | E1261: 傲霜庵 | F1261: 第1版
C1262: 省会无日无？盗 | D1262: 短评 | E1262: 傲霜庵 | F1262: 第1版
A1263: =COUNTA($B$2:B1263) -> 1129 | B1263: 13067. | C1263: 美术教育不容忽视 | D1263: 时论 | E1263: 转录天津《益世報》 | F1263: 第1版
A1264: =COUNTA($B$2:B1264) -> 1130 | B1264: 13068. | C1264: 开战后之意图 | D1264: 论说 | E1264: 傲霜庵 | F1264: 第1版
A1265: =COUNTA($B$2:B1265) -> 1131 | B1265: 13069. | C1265: 欧洲风云与米美尔问题 | D1265: 时论 | E1265: 绛 | F1265: 第1版
A1266: =COUNTA($B$2:B1266) -> 1132 | B1266: 13070. | C1266: 剿匪外之剿匪 | D1266: 论说 | E1266: 傲霜庵 | F1266: 第1版
C1267: 文庙礼拜问题 | D1267: 论说 | E1267: 傲霜庵 | F1267: 第1版
A1268: =COUNTA($B$2:B1268) -> 1134 | B1268: 13072. | C1268: 拒毒运动之新阶段 | D1268: 时论 | E1268: 转录《时事新报》 | F1268: 第1版
A1269: =COUNTA($B$2:B1269) -> 1135 | B1269: 13073. | C1269: 近顷天时之变卷 | D1269: 短评 | E1269: 匿名 | F1269: 第1版
C1270: 文明与生命危险 | D1270: 短评 | E1270: 匿名 | F1270: 第1版
C1271: 房户房主之心理 | D1271: 短评 | E1271: 匿名 | F1271: 第1版
A1272: =COUNTA($B$2:B1272) -> 1138 | B1272: 13074. | C1272: 陕甘军事 | D1272: 时论 | E1272: 转录天津《大公报》 | F1272: 第1版
A1273: =COUNTA($B$2:B1273) -> 1139 | B1273: 13075. | C1273: 中国今后的合作事业 | D1273: 时论 | E1273: 转录天津《益世報》 | F1273: 第1版
A1274: =COUNTA($B$2:B1274) -> 1140 | B1274: 13076. | C1274: 上海不景气的深刻化 | D1274: 时论 | E1274: 梦若 | F1274: 第1版
A1275: =COUNTA($B$2:B1275) -> 1141 | B1275: 13077. | C1275: 西方果无精神文明耶？ | D1275: 时论 | E1275: 匿名 | F1275: 第1版
A1276: =COUNTA($B$2:B1276) -> 1142 | B1276: 13079. | C1276: 如何调节民食 | D1276: 时论 | E1276: 转录天津《益世報》 | F1276: 第1版
A1277: =COUNTA($B$2:B1277) -> 1143 | B1277: 13080. | C1277: 安定社会当自下层始 | D1277: 论说 | E1277: 匿名 | F1277: 第1版
A1278: =COUNTA($B$2:B1278) -> 1144 | B1278: 13081. | C1278: 论调查冤狱 | D1278: 时论 | E1278: 转录《北平晨报》 | F1278: 第1版
A1279: =COUNTA($B$2:B1279) -> 1145 | B1279: 13082. | C1279: 中国名誉博士学位之授予问题 | D1279: 时论 | E1279: 道 | F1279: 第1版
A1280: =COUNTA($B$2:B1280) -> 1146 | B1280: 13083. | C1280: 战争危机中之中国经济 | D1280: 时论 | E1280: 庭 | F1280: 第1版
A1281: =COUNTA($B$2:B1281) -> 1147 | B1281: 13084. | C1281: 欧局之暂时缓和 | D1281: 时论 | E1281: 匿名 | F1281: 第1版
A1282: =COUNTA($B$2:B1282) -> 1148 | B1282: 13086. | C1282: 中国大学教育方针 | D1282: 时论 | E1282: 转录天津《大公报》 | F1282: 第1版
A1283: =COUNTA($B$2:B1283) -> 1149 | B1283: 13087. | C1283: 剿匪报捷与匪众投诚 | D1283: 论说 | E1283: 匿名 | F1283: 第1版
A1284: =COUNTA($B$2:B1284) -> 1150 | B1284: 13088. | C1284: 美国之白银政策与中国 | D1284: 时论 | E1284: 转录《时事新报》 | F1284: 第1版
A1285: =COUNTA($B$2:B1285) -> 1151 | B1285: 13089. | C1285: 中国今后的农村运动 | D1285: 时论 | E1285: 转录天津《大公报》 | F1285: 第1版
A1286: =COUNTA($B$2:B1286) -> 1152 | B1286: 13090. | C1286: 河北动摇感言 | D1286: 论说 | E1286: 傲霜庵 | F1286: 第1版
A1287: =COUNTA($B$2:B1287) -> 1153 | B1287: 13091. | C1287: 汪精卫被暗刺 | D1287: 短评 | E1287: 傲霜庵 | F1287: 第1版
C1288: 英义之外交战 | D1288: 短评 | E1288: 傲霜庵 | F1288: 第1版
A1289: =COUNTA($B$2:B1289) -> 1155 | B1289: 13093. | C1289: 太平洋与蜀道 | D1289: 短评 | E1289: 傲霜庵 | F1289: 第1版
C1290: 老实未必老实 | D1290: 短评 | E1290: 傲霜庵 | F1290: 第1版
C1291: 冯玉祥亦抵宁 | D1291: 短评 | E1291: 傲霜庵 | F1291: 第1版
A1292: =COUNTA($B$2:B1292) -> 1158 | B1292: 13094. | C1292: 施粥以救济贫民私议 | D1292: 论说 | E1292: 匿名 | F1292: 第1版
A1293: =COUNTA($B$2:B1293) -> 1159 | B1293: 13095. | C1293: 中国训政宜结束 | D1293: 时论 | E1293: 转录《庸报》 | F1293: 第1版
A1294: =COUNTA($B$2:B1294) -> 1160 | B1294: 13096. | C1294: 英国总选举之展望 | D1294: 时论 | E1294: 匿名 | F1294: 第1版
A1295: =COUNTA($B$2:B1295) -> 1161 | B1295: 13097. | C1295: 很奇怪的提现兑票（上） | D1295: 论说 | E1295: 傲霜庵 | F1295: 第1版
A1296: =COUNTA($B$2:B1296) -> 1162 | B1296: 13098. | C1296: 很奇怪的提现兑票（中） | D1296: 论说 | E1296: 傲霜庵 | F1296: 第1版
A1297: =COUNTA($B$2:B1297) -> 1163 | B1297: 13100. | C1297: 很奇怪的提现兑票（下） | D1297: 论说 | E1297: 傲霜庵 | F1297: 第1版
A1298: =COUNTA($B$2:B1298) -> 1164 | B1298: 13101. | C1298: 失学与失业 | D1298: 论说 | E1298: 匿名 | F1298: 第1版
A1299: =COUNTA($B$2:B1299) -> 1165 | B1299: 13102. | C1299: 希腊复辟运动之成熟 | D1299: 时论 | E1299: 昂 | F1299: 第1版
A1300: =COUNTA($B$2:B1300) -> 1166 | B1300: 13103. | C1300: 国民党之算旧帐与开新帐（上） | D1300: 时论 | E1300: 梁实秋 | F1300: 第1版
A1301: =COUNTA($B$2:B1301) -> 1167 | B1301: 13104. | C1301: 国民党之算旧帐与开新帐（下） | D1301: 时论 | E1301: 梁实秋 | F1301: 第1版
A1302: =COUNTA($B$2:B1302) -> 1168 | B1302: 13105. | C1302: 义阿战争之新阶段 | E1302: 转录《时事新报》 | F1302: 第1版
A1303: =COUNTA($B$2:B1303) -> 1169 | B1303: 13107. | C1303: 英国本届总选感言 | D1303: 时论 | E1303: 转录《晨报》 | F1303: 第1版
A1304: =COUNTA($B$2:B1304) -> 1170 | B1304: 13108. | C1304: 中国实施宪政之要点 | D1304: 时论 | E1304: 道 | F1304: 第1版
A1305: =COUNTA($B$2:B1305) -> 1171 | B1305: 13109. | C1305: 贺非列宾独立政府成立 | D1305: 时论 | E1305: 转录天津《大公报》 | F1305: 第1版
A1306: =COUNTA($B$2:B1306) -> 1172 | B1306: 13110. | C1306: 英法德军备协定 | D1306: 时论 | E1306: 转录天津《益世報》 | F1306: 第1版
A1307: =COUNTA($B$2:B1307) -> 1173 | B1307: 13111. | C1307: 河北省的财政 | D1307: 时论 | E1307: 转录天津《大公报》 | F1307: 第1版
A1308: =COUNTA($B$2:B1308) -> 1174 | B1308: 13112. | C1308: 施剑翘案与社会观点 | D1308: 时论 | E1308: 转录天津《大公报》 | F1308: 第1版
A1309: =COUNTA($B$2:B1309) -> 1175 | B1309: 13114. | C1309: 对义经济制裁实施及其效果 | D1309: 时论 | E1309: 转录天津《大公报》 | F1309: 第1版
A1310: =COUNTA($B$2:B1310) -> 1176 | B1310: 13115. | C1310: 儿童行窃感言 | D1310: 论说 | E1310: 匿名 | F1310: 第1版
A1311: =COUNTA($B$2:B1311) -> 1177 | B1311: 13116. | C1311: 法国处境之苦闷烦忧 | D1311: 时论 | E1311: 转录《晨报》 | F1311: 第1版
A1312: =COUNTA($B$2:B1312) -> 1178 | B1312: 13117. | C1312: 希腊复辟之展望 | D1312: 时论 | E1312: 匿名 | F1312: 第1版
A1313: =COUNTA($B$2:B1313) -> 1179 | B1313: 13118. | C1313: 中国工业生产之动态 | D1313: 时论 | E1313: 转录《时事新报》 | F1313: 第1版
A1314: =COUNTA($B$2:B1314) -> 1180 | B1314: 13119. | C1314: 中国新监法要从速施行 | D1314: 时论 | E1314: 立 | F1314: 第1版
A1315: =COUNTA($B$2:B1315) -> 1181 | B1315: 13121. | C1315: 民族运动之高潮与列强 | D1315: 时论 | E1315: 转录天津《大公报》 | F1315: 第1版
A1316: =COUNTA($B$2:B1316) -> 1182 | B1316: 13122. | C1316: 保甲与冬防 | D1316: 论说 | E1316: 匿名 | F1316: 第1版
A1317: =COUNTA($B$2:B1317) -> 1183 | B1317: 13123. | C1317: 埃及要求完全独立 | D1317: 时论 | E1317: 梦蕉 | F1317: 第1版
A1318: =COUNTA($B$2:B1318) -> 1184 | B1318: 13124. | C1318: 中国对外贸易未见好转 | D1318: 时论 | E1318: 转录天津《益世報》 | F1318: 第1版
A1319: =COUNTA($B$2:B1319) -> 1185 | B1319: 13125. | C1319: 华北自治无问题 | D1319: 论说 | E1319: 傲霜庵 | F1319: 第1版
C1320: 太平洋邮航成功 | D1320: 论说 | E1320: 傲霜庵 | F1320: 第1版
A1321: =COUNTA($B$2:B1321) -> 1187 | B1321: 13126. | C1321: 德货与满洲国 | D1321: 短评 | E1321: 傲霜庵 | F1321: 第1版
C1322: 新路线陆续完成 | D1322: 短评 | E1322: 傲霜庵 | F1322: 第1版
C1323: 四亿五千八百万 | D1323: 短评 | E1323: 傲霜庵 | F1323: 第1版
C1324: 继续称霸三年 | D1324: 短评 | E1324: 傲霜庵 | F1324: 第1版
A1325: =COUNTA($B$2:B1325) -> 1191 | B1325: 13128. | C1325: 中国行政效率先决条件 | D1325: 时论 | E1325: 匿名 | F1325: 第1版
A1326: =COUNTA($B$2:B1326) -> 1192 | B1326: 13135. | C1326: 为政者的风度 | D1326: 时论 | E1326: 转录天津《益世報》 | F1326: 第1版
A1327: =COUNTA($B$2:B1327) -> 1193 | B1327: 13136. | C1327: 读崇俭尚廉令 | D1327: 论说 | E1327: 匿名 | F1327: 第1版
A1328: =COUNTA($B$2:B1328) -> 1194 | B1328: 13137. | C1328: 秘密国外蒙 | D1328: 论说 | E1328: 傲霜庵 | F1328: 第1版
A1329: =COUNTA($B$2:B1329) -> 1195 | B1329: 13138. | C1329: 全欧群起反对 | D1329: 短评 | E1329: 傲霜庵 | F1329: 第1版
C1330: 老冯与衣服革命 | D1330: 短评 | E1330: 傲霜庵 | F1330: 第1版
C1331: 飞腾七万二千尺 | D1331: 短评 | E1331: 傲霜庵 | F1331: 第1版
A1332: =COUNTA($B$2:B1332) -> 1198 | B1332: 13139. | C1332: 缩军之异床异梦 | D1332: 短评 | E1332: 傲霜庵 | F1332: 第1版
C1333: 对蒙需平等待遇 | D1333: 短评 | E1333: 傲霜庵 | F1333: 第1版
C1334: 售义棉花遽增 | D1334: 短评 | E1334: 傲霜庵 | F1334: 第1版
A1335: =COUNTA($B$2:B1335) -> 1201 | B1335: 13140. | C1335: 伦敦银价暴跌至索解 | D1335: 时论 | E1335: 天放---转录《申报》 | F1335: 第1版
A1336: =COUNTA($B$2:B1336) -> 1202 | B1336: 13143. | C1336: 年末商况之不振 | D1336: 论说 | E1336: 匿名 | F1336: 第1版
A1337: =COUNTA($B$2:B1337) -> 1203 | B1337: 13144. | C1337: 英国对义又硬化 | D1337: 论说 | E1337: 傲霜庵 | F1337: 第1版
A1338: =COUNTA($B$2:B1338) -> 1204 | B1338: 13145. | C1338: 学生运动无进步 | D1338: 短评 | E1338: 傲霜庵 | F1338: 第1版
C1339: 唐有壬被暗杀 | D1339: 短评 | E1339: 傲霜庵 | F1339: 第1版
C1340: 教员之与学生 | D1340: 短评 | E1340: 傲霜庵 | F1340: 第1版
A1341: =COUNTA($B$2:B1341) -> 1207 | B1341: 13146. | C1341: 领事馆陆续复活 | D1341: 短评 | E1341: 傲霜庵 | F1341: 第1版
C1342: 添筑七条铁路 | D1342: 短评 | E1342: 傲霜庵 | F1342: 第1版
C1343: 世界第一匪团 | D1343: 短评 | E1343: 傲霜庵 | F1343: 第1版
A1344: =COUNTA($B$2:B1344) -> 1210 | B1344: 13147. | C1344: 满日邮便联络 | D1344: 短评 | E1344: 傲霜庵 | F1344: 第1版
C1345: 呜呼此血泪语 | D1345: 短评 | E1345: 傲霜庵 | F1345: 第1版
C1346: 鼠群渡江入境 | D1346: 短评 | E1346: 傲霜庵 | F1346: 第1版
A1347: =COUNTA($B$2:B1347) -> 1213 | B1347: 13148. | C1347: 送岁之辞 | D1347: 论说 | E1347: 匿名 | F1347: 第1版
A1348: =COUNTA($B$2:B1348) -> 1214 | B1348: 13154. | C1348: 中国公路建设的检讨 | D1348: 时论 | E1348: 转录天津《益世報》 | F1348: 第1版
A1349: =COUNTA($B$2:B1349) -> 1215 | B1349: 13156. | C1349: 中国棉业的隐忧 | D1349: 时论 | E1349: 匿名 | F1349: 第1版
A1350: =COUNTA($B$2:B1350) -> 1216 | B1350: 13157. | C1350: 如何提高行政效率 | D1350: 时论 | E1350: 匿名 | F1350: 第1版
A1351: =COUNTA($B$2:B1351) -> 1217 | B1351: 13158. | C1351: 缩军会议再开 | D1351: 短评 | E1351: 傲霜庵 | F1351: 第1版
C1352: 罗斯福教书已颁 | D1352: 短评 | E1352: 傲霜庵 | F1352: 第1版
C1353: 学生运动尾声 | D1353: 短评 | E1353: 傲霜庵 | F1353: 第1版
A1354: =COUNTA($B$2:B1354) -> 1220 | B1354: 13159. | C1354: 弹雨乎抑淫雨乎 | D1354: 短评 | E1354: 傲霜庵 | F1354: 第1版
C1355: 党国之与鸡肋 | D1355: 短评 | E1355: 傲霜庵 | F1355: 第1版
C1356: 到处勋章雨 | D1356: 短评 | E1356: 傲霜庵 | F1356: 第1版
A1357: =COUNTA($B$2:B1357) -> 1223 | B1357: 13160. | C1357: 学生运动的代价 | D1357: 短评 | E1357: 傲霜庵 | F1357: 第1版
C1358: 人口增加惊人 | D1358: 短评 | E1358: 傲霜庵 | F1358: 第1版
C1359: 英国不战屈敌？ | D1359: 短评 | E1359: 傲霜庵 | F1359: 第1版
A1360: =COUNTA($B$2:B1360) -> 1226 | B1360: 13161. | C1360: 荒谬绝伦之教书 | D1360: 短评 | E1360: 傲霜庵 | F1360: 第1版
C1361: 今后之胡汉民 | D1361: 短评 | E1361: 傲霜庵 | F1361: 第1版
A1362: =COUNTA($B$2:B1362) -> 1228 | B1362: 13163. | C1362: 与特勒新年演词 | D1362: 时论 | E1362: 转录《庸报》 | F1362: 第1版
A1363: =COUNTA($B$2:B1363) -> 1229 | B1363: 13164. | C1363: 旧年关之社会 | D1363: 论说 | E1363: 匿名 | F1363: 第1版
A1364: =COUNTA($B$2:B1364) -> 1230 | B1364: 13165. | C1364: 中国今年经济之展望 | D1364: 时论 | E1364: 端---转录《申报》 | F1364: 第1版
A1365: =COUNTA($B$2:B1365) -> 1231 | B1365: 13166. | C1365: 日本与极东霸权 | D1365: 论说 | E1365: 傲霜庵 | F1365: 第1版
C1366: 老冯面缚乞降 | D1366: 论说 | E1366: 傲霜庵 | F1366: 第1版
A1367: =COUNTA($B$2:B1367) -> 1233 | B1367: 13167. | C1367: 统一治黄之急务 | D1367: 短评 | E1367: 傲霜庵 | F1367: 第1版
C1368: 黄金三十万万元 | D1368: 短评 | E1368: 傲霜庵 | F1368: 第1版
C1369: 咄咄逼人之凶案 | D1369: 短评 | E1369: 傲霜庵 | F1369: 第1版
C1370: 奉天都市之发达 | D1370: 短评 | E1370: 傲霜庵 | F1370: 第1版
A1371: =COUNTA($B$2:B1371) -> 1237 | B1371: 13168. | C1371: 废历废币都复活 | D1371: 短评 | E1371: 傲霜庵 | F1371: 第1版
C1372: 党国弄法太滥 | D1372: 短评 | E1372: 傲霜庵 | F1372: 第1版
C1373: 同温层之与航空 | D1373: 短评 | E1373: 傲霜庵 | F1373: 第1版
A1374: =COUNTA($B$2:B1374) -> 1240 | B1374: 13170. | C1374: 美国农业政策之趋向 | D1374: 时论 | E1374: 转录天津《大公报》 | F1374: 第1版
A1375: =COUNTA($B$2:B1375) -> 1241 | B1375: 13171. | C1375: 敬悼英皇陛下 | D1375: 论说 | E1375: 傲霜庵 | F1375: 第1版
C1376: 日议会竟尔解散 | D1376: 论说 | E1376: 傲霜庵 | F1376: 第1版
A1377: =COUNTA($B$2:B1377) -> 1243 | B1377: 13172. | C1377: 中国复兴农村与县乡银行 | D1377: 时论 | E1377: 转录天津《益世報》 | F1377: 第1版
A1378: =COUNTA($B$2:B1378) -> 1244 | B1378: 13177. | C1378: 冀察政委会减轻附加税的新令 | D1378: 时论 | E1378: 转录天津《益世報》 | F1378: 第1版
A1379: =COUNTA($B$2:B1379) -> 1245 | B1379: 13178. | C1379: 阴阳历新年之观感 | D1379: 论说 | E1379: 匿名 | F1379: 第1版
A1380: =COUNTA($B$2:B1380) -> 1246 | B1380: 13179. | C1380: 新年漫谈 | D1380: 短评 | E1380: 傲霜庵 | F1380: 第1版
C1381: 木匠之与穷汉 | D1381: 短评 | E1381: 傲霜庵 | F1381: 第1版
C1382: 悼森川千丈医士 | D1382: 短评 | E1382: 傲霜庵 | F1382: 第1版
A1383: =COUNTA($B$2:B1383) -> 1249 | B1383: 13180. | C1383: 中国地方官吏施政条件 | D1383: 时论 | E1383: 转录《庸报》 | F1383: 第1版
A1384: =COUNTA($B$2:B1384) -> 1250 | B1384: 13181. | C1384: 胡与蒋果合作？ | D1384: 短评 | E1384: 傲霜庵 | F1384: 第1版
C1385: 冀察政权渐稳固 | D1385: 短评 | E1385: 傲霜庵 | F1385: 第1版
C1386: 白种心理皆如此 | D1386: 短评 | E1386: 傲霜庵 | F1386: 第1版
A1387: =COUNTA($B$2:B1387) -> 1253 | B1387: 13182. | C1387: 须彻底肃清日匪 | D1387: 短评 | E1387: 傲霜庵 | F1387: 第1版
C1388: 英美之轻率发言 | D1388: 短评 | E1388: 傲霜庵 | F1388: 第1版
C1389: 中国之特殊经济 | D1389: 短评 | E1389: 傲霜庵 | F1389: 第1版
A1390: =COUNTA($B$2:B1390) -> 1256 | B1390: 13184. | C1390: 南洋华茶市场之衰落 | D1390: 时论 | E1390: 转录天津《益世報》 | F1390: 第1版
A1391: =COUNTA($B$2:B1391) -> 1257 | B1391: 13187. | C1391: 气候奇寒之危害 | D1391: 短评 | E1391: 傲霜庵 | F1391: 第1版
C1392: 联合募集慰问袋 | D1392: 短评 | E1392: 傲霜庵 | F1392: 第1版
C1393: 自来水开通与人民 | D1393: 短评 | E1393: 傲霜庵 | F1393: 第1版
A1394: =COUNTA($B$2:B1394) -> 1260 | B1394: 13188. | C1394: 没收公债之变相 | D1394: 论说 | E1394: 傲霜庵 | F1394: 第1版
C1395: 法国苏俄中国 | D1395: 论说 | E1395: 傲霜庵 | F1395: 第1版
A1396: =COUNTA($B$2:B1396) -> 1262 | B1396: 13189. | C1396: 中国公务人员财产登记 | D1396: 时论 | E1396: 转录天津《益世報》 | F1396: 第1版
A1397: =COUNTA($B$2:B1397) -> 1263 | B1397: 13191. | C1397: 满意与不满意-如何改变现状？ | D1397: 时论 | E1397: 匿名 | F1397: 第1版
A1398: =COUNTA($B$2:B1398) -> 1264 | B1398: 13192. | C1398: 如何救济失学儿童 | D1398: 论说 | E1398: 匿名 | F1398: 第1版
A1399: =COUNTA($B$2:B1399) -> 1265 | B1399: 13193. | C1399: 国境纷争之症结 | D1399: 论说 | E1399: 傲霜庵 | F1399: 第1版
C1400: 勿拒逆耳言 | D1400: 论说 | E1400: 傲霜庵 | F1400: 第1版
A1401: =COUNTA($B$2:B1401) -> 1267 | B1401: 13194. | C1401: 美要人之恐日病 | D1401: 短评 | E1401: 傲霜庵 | F1401: 第1版
C1402: 对义油禁果断行？ | D1402: 短评 | E1402: 傲霜庵 | F1402: 第1版
C1403: 华北之新口号 | D1403: 短评 | E1403: 傲霜庵 | F1403: 第1版
A1404: =COUNTA($B$2:B1404) -> 1270 | B1404: 13195. | C1404: 评殖民地分割论 | D1404: 论说 | E1404: 傲霜庵 | F1404: 第1版
C1405: 俄飞机参加战斗 | D1405: 论说 | E1405: 傲霜庵 | F1405: 第1版
A1406: =COUNTA($B$2:B1406) -> 1272 | B1406: 13196. | C1406: 日本以樱树相赠 | D1406: 短评 | E1406: 傲霜庵 | F1406: 第1版
C1407: 美国犹有明眼人 | D1407: 短评 | E1407: 傲霜庵 | F1407: 第1版
C1408: 闭锁俄总领事馆 | D1408: 短评 | E1408: 傲霜庵 | F1408: 第1版
A1409: =COUNTA($B$2:B1409) -> 1275 | B1409: 13198. | C1409: 中国公债投机风潮 | D1409: 时论 | E1409: 转录天津《益世報》 | F1409: 第1版
A1410: =COUNTA($B$2:B1410) -> 1276 | B1410: 13199. | C1410: 论暗杀 | D1410: 论述 | E1410: 匿名 | F1410: 第1版
A1411: =COUNTA($B$2:B1411) -> 1277 | B1411: 13200. | C1411: 中国大赦政治犯问题 | D1411: 时论 | E1411: 转录天津《益世報》 | F1411: 第1版
A1412: =COUNTA($B$2:B1412) -> 1278 | B1412: 13201. | C1412: 须严阵保境到底 | D1412: 论说 | E1412: 傲霜庵 | F1412: 第1版
C1413: 掌柜面上有喜色 | D1413: 论说 | E1413: 傲霜庵 | F1413: 第1版
A1414: =COUNTA($B$2:B1414) -> 1280 | B1414: 13202. | C1414: 南京与共党煽惑 | D1414: 短评 | E1414: 傲霜庵 | F1414: 第1版
C1415: 空前之大惨剧 | D1415: 短评 | E1415: 傲霜庵 | F1415: 第1版
A1416: =COUNTA($B$2:B1416) -> 1282 | B1416: 13203. | C1416: 邻邦总选举结束 | D1416: 短评 | E1416: 傲霜庵 | F1416: 第1版
C1417: 意大利愚弄英国 | D1417: 短评 | E1417: 傲霜庵 | F1417: 第1版
C1418: 春寒仍然酷烈 | D1418: 短评 | E1418: 傲霜庵 | F1418: 第1版
A1419: =COUNTA($B$2:B1419) -> 1285 | B1419: 13205. | C1419: 英美与远东问题 | D1419: 时论 | E1419: 转录《庸报》 | F1419: 第1版
A1420: =COUNTA($B$2:B1420) -> 1286 | B1420: 13207. | C1420: 论三国调查委员会 | D1420: 论说 | E1420: 傲霜庵 | F1420: 第1版
C1421: 日本再度奇寒 | D1421: 论说 | E1421: 傲霜庵 | F1421: 第1版
A1422: =COUNTA($B$2:B1422) -> 1288 | B1422: 13208. | C1422: 日本重臣被刺惨剧 | D1422: 论说 | E1422: 傲霜庵 | F1422: 第1版
C1423: 伟人的一言一行 | D1423: 论说 | E1423: 傲霜庵 | F1423: 第1版
A1424: =COUNTA($B$2:B1424) -> 1290 | B1424: 13209. | C1424: 田赋增收与地方财政 | D1424: 时论 | E1424: 转录《时事新报》 | F1424: 第1版
A1425: =COUNTA($B$2:B1425) -> 1291 | B1425: 13212. | C1425: 铁路建设公债中之川黔干线 | D1425: 时论 | E1425: 梦蕉---转录《新闻报》 | F1425: 第1版
A1426: =COUNTA($B$2:B1426) -> 1292 | B1426: 13213. | C1426: 矫正风俗之不可缓 | D1426: 论说 | E1426: 匿名 | F1426: 第1版
A1427: =COUNTA($B$2:B1427) -> 1293 | B1427: 13214. | C1427: 中国之民食问题 | D1427: 时论 | E1427: 柳---转录《申报》 | F1427: 第1版
A1428: =COUNTA($B$2:B1428) -> 1294 | B1428: 13215. | C1428: 共匪威胁太原 | D1428: 短评 | E1428: 傲霜庵 | F1428: 第1版
C1429: 日内阁首揆未定 | D1429: 短评 | E1429: 傲霜庵 | F1429: 第1版
C1430: 粤禁止中法航空 | D1430: 短评 | E1430: 傲霜庵 | F1430: 第1版
A1431: =COUNTA($B$2:B1431) -> 1297 | B1431: 13216. | C1431: 广田奉命组阁 | D1431: 论说 | E1431: 傲霜庵 | F1431: 第1版
A1432: =COUNTA($B$2:B1432) -> 1298 | B1432: 13217. | C1432: 最近欧洲外交之检讨 | D1432: 时论 | E1432: 石龙---转录《新闻报》 | F1432: 第1版
A1433: =COUNTA($B$2:B1433) -> 1299 | B1433: 13219. | C1433: 酝酿中之五强集团 | D1433: 时论 | E1433: 星---转录《申报》 | F1433: 第1版
A1434: =COUNTA($B$2:B1434) -> 1300 | B1434: 13220. | C1434: 欧洲时局之危险 | D1434: 短评 | E1434: 匿名 | F1434: 第1版
C1435: 春暖与清洁关系 | D1435: 短评 | E1435: 匿名 | F1435: 第1版
C1436: 慎言为处事要道 | D1436: 短评 | E1436: 匿名 | F1436: 第1版
A1437: =COUNTA($B$2:B1437) -> 1303 | B1437: 13221. | C1437: 中法越南身税问题 | D1437: 时论 | E1437: 梦蕉---转录《新闻报》 | F1437: 第1版
A1438: =COUNTA($B$2:B1438) -> 1304 | B1438: 13222. | C1438: 德国渡莱茵河 | D1438: 论说 | E1438: 傲霜庵 | F1438: 第1版
A1439: =COUNTA($B$2:B1439) -> 1305 | B1439: 13223. | C1439: 广田内阁产出来 | D1439: 短评 | E1439: 傲霜庵 | F1439: 第1版
C1440: 英法不免动突 | D1440: 短评 | E1440: 傲霜庵 | F1440: 第1版
C1441: 共匪一败涂地 | D1441: 短评 | E1441: 傲霜庵 | F1441: 第1版
A1442: =COUNTA($B$2:B1442) -> 1308 | B1442: 13224. | C1442: 莱茵河畔风云急 | D1442: 短评 | E1442: 傲霜庵 | F1442: 第1版
C1443: 天空自此多事 | D1443: 短评 | E1443: 傲霜庵 | F1443: 第1版
C1444: 军民合作之善举 | D1444: 短评 | E1444: 傲霜庵 | F1444: 第1版
C1445: 奇寒仍然继续 | D1445: 短评 | E1445: 傲霜庵 | F1445: 第1版
A1446: =COUNTA($B$2:B1446) -> 1312 | B1446: 13226. | C1446: 要钱不要命 | D1446: 时论 | E1446: 梦若---转录《申报》 | F1446: 第1版
A1447: =COUNTA($B$2:B1447) -> 1313 | B1447: 13227. | C1447: 可畏之猩红热 | D1447: 论说 | E1447: 匿名 | F1447: 第1版
A1448: =COUNTA($B$2:B1448) -> 1314 | B1448: 13228. | C1448: 蒋介石通令铲除贪污 | D1448: 时论 | E1448: 转录天津《大公报》 | F1448: 第1版
A1449: =COUNTA($B$2:B1449) -> 1315 | B1449: 13229. | C1449: 论国内移民 | D1449: 论说 | E1449: 傲霜庵 | F1449: 第1版
A1450: =COUNTA($B$2:B1450) -> 1316 | B1450: 13230. | C1450: 北平之盛大寿筵 | D1450: 短评 | E1450: 傲霜庵 | F1450: 第1版
C1451: 美国订购人骨 | D1451: 短评 | E1451: 傲霜庵 | F1451: 第1版
C1452: 苏俄态度软化 | D1452: 短评 | E1452: 傲霜庵 | F1452: 第1版
A1453: =COUNTA($B$2:B1453) -> 1319 | B1453: 13231. | C1453: 侈谈问罪不兴师 | D1453: 短评 | E1453: 傲霜庵 | F1453: 第1版
C1454: 节育主义之是非 | D1454: 短评 | E1454: 傲霜庵 | F1454: 第1版
C1455: 由个人祝寿说起 | D1455: 短评 | E1455: 傲霜庵 | F1455: 第1版
A1456: =COUNTA($B$2:B1456) -> 1322 | B1456: 13233. | C1456: 鲁西灾民归耕问题 | D1456: 时论 | E1456: 梦蕉---转录《新闻报》 | F1456: 第1版
A1457: =COUNTA($B$2:B1457) -> 1323 | B1457: 13234. | C1457: 今之小学教育 | D1457: 短评 | E1457: 傲霜庵 | F1457: 第1版
C1458: 清洁务湏彻底 | D1458: 短评 | E1458: 傲霜庵 | F1458: 第1版
C1459: 人心日趋险恶 | D1459: 短评 | E1459: 傲霜庵 | F1459: 第1版
A1460: =COUNTA($B$2:B1460) -> 1326 | B1460: 13235. | C1460: 侵晋共匪逼太原 | D1460: 短评 | E1460: 傲霜庵 | F1460: 第1版
C1461: 治丝益紊之欧局 | D1461: 短评 | E1461: 傲霜庵 | F1461: 第1版
C1462: 顾维钧命驾回任 | D1462: 短评 | E1462: 傲霜庵 | F1462: 第1版
A1463: =COUNTA($B$2:B1463) -> 1329 | B1463: 13236. | C1463: 欢迎植田大使 | D1463: 论说 | E1463: 傲霜庵 | F1463: 第1版
A1464: =COUNTA($B$2:B1464) -> 1330 | B1464: 13238. | C1464: 送南大将离任回国 | D1464: 论说 | E1464: 傲霜庵 | F1464: 第1版
A1465: =COUNTA($B$2:B1465) -> 1331 | B1465: 13240. | C1465: 中国桐油之输出 | D1465: 时论 | E1465: 天放---转录《新闻报》 | F1465: 第1版
A1466: =COUNTA($B$2:B1466) -> 1332 | B1466: 13241. | C1466: 上海投机市场之新转变 | D1466: 时论 | E1466: 扑---转录《申报》 | F1466: 第1版
A1467: =COUNTA($B$2:B1467) -> 1333 | B1467: 13242. | C1467: 评俄蒙互助协约 | D1467: 短评 | E1467: 傲霜庵 | F1467: 第1版
C1468: 德侨之海上投票 | D1468: 短评 | E1468: 傲霜庵 | F1468: 第1版
C1469: 世界歌王吊战迹 | D1469: 短评 | E1469: 傲霜庵 | F1469: 第1版
A1470: =COUNTA($B$2:B1470) -> 1336 | B1470: 13243. | C1470: 南京对俄抗议？ | D1470: 短评 | E1470: 傲霜庵 | F1470: 第1版
C1471: 绝无大国风度 | D1471: 短评 | E1471: 傲霜庵 | F1471: 第1版
C1472: 国铁成绩卓越 | D1472: 短评 | E1472: 傲霜庵 | F1472: 第1版
A1473: =COUNTA($B$2:B1473) -> 1339 | B1473: 13244. | C1473: 战前之奇怪休战 | D1473: 短评 | E1473: 傲霜庵 | F1473: 第1版
C1474: 条约破弃时代 | D1474: 短评 | E1474: 傲霜庵 | F1474: 第1版
C1475: 宫地博士等殉学 | D1475: 短评 | E1475: 傲霜庵 | F1475: 第1版
A1476: =COUNTA($B$2:B1476) -> 1342 | B1476: 13245. | C1476: 日英美争霸之缩图 | D1476: 论说 | E1476: 傲霜庵 | F1476: 第1版
C1477: 植树节的意义 | D1477: 论说 | E1477: 傲霜庵 | F1477: 第1版
A1478: =COUNTA($B$2:B1478) -> 1344 | B1478: 13247. | C1478: 粤汉铁路行将通车 | D1478: 时论 | E1478: 转录天津《大公报》 | F1478: 第1版
A1479: =COUNTA($B$2:B1479) -> 1345 | B1479: 13248. | C1479: 毋自欺也 | D1479: 论说 | E1479: 匿名 | F1479: 第1版
A1480: =COUNTA($B$2:B1480) -> 1346 | B1480: 13249. | C1480: 阿国极大危机 | D1480: 短评 | E1480: 傲霜庵 | F1480: 第1版
C1481: 北平学生之狂态 | D1481: 短评 | E1481: 傲霜庵 | F1481: 第1版
C1482: 古物首途凯旋 | D1482: 短评 | E1482: 傲霜庵 | F1482: 第1版
A1483: =COUNTA($B$2:B1483) -> 1349 | B1483: 13250. | C1483: 极须救济内蒙 | D1483: 短评 | E1483: 傲霜庵 | F1483: 第1版
C1484: 迎头一击之大功 | D1484: 短评 | E1484: 傲霜庵 | F1484: 第1版
C1485: 国联需速解散 | D1485: 短评 | E1485: 傲霜庵 | F1485: 第1版
A1486: =COUNTA($B$2:B1486) -> 1352 | B1486: 13251. | C1486: 南京抗议以后 | D1486: 论说 | E1486: 傲霜庵 | F1486: 第1版
C1487: 评国际和平军 | D1487: 论说 | E1487: 傲霜庵 | F1487: 第1版
A1488: =COUNTA($B$2:B1488) -> 1354 | B1488: 13252. | C1488: 节育与生众 | D1488: 时论 | E1488: 梦蕉---转录《新闻报》 | F1488: 第1版
A1489: =COUNTA($B$2:B1489) -> 1355 | B1489: 13254. | C1489: 土耳其要求恢复海峡军备 | D1489: 时论 | E1489: 立---转录《申报》 | F1489: 第1版
A1490: =COUNTA($B$2:B1490) -> 1356 | B1490: 13255. | C1490: 犯罪与经济问题 | D1490: 时论 | E1490: 行安---转录《申报》 | F1490: 第1版
A1491: =COUNTA($B$2:B1491) -> 1357 | B1491: 13256. | C1491: 慎微 | D1491: 时论 | E1491: 浩然 | F1491: 第1版
A1492: =COUNTA($B$2:B1492) -> 1358 | B1492: 13257. | C1492: 义军使用毒瓦斯 | D1492: 短评 | E1492: 傲霜庵 | F1492: 第1版
C1493: 中国之与满洲国 | D1493: 短评 | E1493: 傲霜庵 | F1493: 第1版
C1494: 回教徒捣毁报馆 | D1494: 短评 | E1494: 傲霜庵 | F1494: 第1版
A1495: =COUNTA($B$2:B1495) -> 1361 | B1495: 13258. | C1495: 中国古物遇险 | D1495: 短评 | E1495: 傲霜庵 | F1495: 第1版
C1496: 法人眼中莱茵观 | D1496: 短评 | E1496: 傲霜庵 | F1496: 第1版
C1497: 国联须速解散 | D1497: 短评 | E1497: 傲霜庵 | F1497: 第1版
A1498: =COUNTA($B$2:B1498) -> 1364 | B1498: 13259. | C1498: 中国须提诉国联 | D1498: 短评 | E1498: 傲霜庵 | F1498: 第1版
C1499: 高粱与保护铁路 | D1499: 短评 | E1499: 傲霜庵 | F1499: 第1版
C1500: 耶稣复活祭感言 | D1500: 短评 | E1500: 傲霜庵 | F1500: 第1版
A1501: =COUNTA($B$2:B1501) -> 1367 | B1501: 13261. | C1501: 外蒙问题之回顾 | D1501: 时论 | E1501: 转录天津《大公报》 | F1501: 第1版
A1502: =COUNTA($B$2:B1502) -> 1368 | B1502: 13262. | C1502: 中国地方财政之整理 | D1502: 时论 | E1502: 藕顿---转录《时事新报》 | F1502: 第1版
A1503: =COUNTA($B$2:B1503) -> 1369 | B1503: 13263. | C1503: 论凌？等死刑 | D1503: 论说 | E1503: 傲霜庵 | F1503: 第1版
C1504: 亦是江南春信 | D1504: 论说 | E1504: 傲霜庵 | F1504: 第1版
A1505: =COUNTA($B$2:B1505) -> 1371 | B1505: 13264. | C1505: 奉天郊外住宅区 | D1505: 论说 | E1505: 傲霜庵 | F1505: 第1版
C1506: 茶叶与飞行家 | D1506: 论说 | E1506: 傲霜庵 | F1506: 第1版
A1507: =COUNTA($B$2:B1507) -> 1373 | B1507: 13265. | C1507: 中国国民大会之组织与选举 | D1507: 时论 | E1507: 转录《北平晨报》 | F1507: 第1版
A1508: =COUNTA($B$2:B1508) -> 1374 | B1508: 13266. | C1508: 英国往何处去 | D1508: 时论 | E1508: 远村---转录《时事新报》 | F1508: 第1版
A1509: =COUNTA($B$2:B1509) -> 1375 | B1509: 13268. | C1509: 谈中国国民工役法 | D1509: 时论 | E1509: 转录天津《益世報》 | F1509: 第1版
A1510: =COUNTA($B$2:B1510) -> 1376 | B1510: 13269. | C1510: 对于市医院之希望 | D1510: 论说 | E1510: 匿名 | F1510: 第1版
A1511: =COUNTA($B$2:B1511) -> 1377 | B1511: 13270. | C1511: 西班牙政潮 | D1511: 时论 | E1511: 石龍 | F1511: 第1版
A1512: =COUNTA($B$2:B1512) -> 1378 | B1512: 13272. | C1512: 中国存银兑换期满之举措 | D1512: 时论 | E1512: 梦蕉---转录《新闻报》 | F1512: 第1版
A1513: =COUNTA($B$2:B1513) -> 1379 | B1513: 13275. | C1513: 巴勒斯坦的回犹民族动突 | D1513: 时论 | E1513: 朗---转录《申报》 | F1513: 第1版
A1514: =COUNTA($B$2:B1514) -> 1380 | B1514: 13276. | C1514: 阿皇蒙lu感言 | D1514: 短评 | E1514: 傲霜庵 | F1514: 第1版
C1515: 清洁入检查时期 | D1515: 短评 | E1515: 傲霜庵 | F1515: 第1版
C1516: 设所收容贫民乞丐 | D1516: 短评 | E1516: 傲霜庵 | F1516: 第1版
A1517: =COUNTA($B$2:B1517) -> 1383 | B1517: 13277. | C1517: 满德协定成立 | D1517: 论说 | E1517: 傲霜庵 | F1517: 第1版
C1518: 阿京失守以后 | D1518: 论说 | E1518: 傲霜庵 | F1518: 第1版
A1519: =COUNTA($B$2:B1519) -> 1385 | B1519: 13278. | C1519: 满日经济普罗克 | D1519: 短评 | E1519: 傲霜庵 | F1519: 第1版
C1520: 华侨与日视察团 | D1520: 短评 | E1520: 傲霜庵 | F1520: 第1版
C1521: 党国与相见礼节 | D1521: 短评 | E1521: 傲霜庵 | F1521: 第1版
A1522: =COUNTA($B$2:B1522) -> 1388 | B1522: 13279. | C1522: 法国左派大捷 | D1522: 短评 | E1522: 傲霜庵 | F1522: 第1版
C1523: 地中海制海权 | D1523: 短评 | E1523: 傲霜庵 | F1523: 第1版
C1524: 瑞西愿意通汇 | D1524: 短评 | E1524: 傲霜庵 | F1524: 第1版
A1525: =COUNTA($B$2:B1525) -> 1391 | B1525: 13280. | C1525: 吿冀察平津赴日教育考察团 | D1525: 时论 | E1525: 转录《晨报》 | F1525: 第1版
A1526: =COUNTA($B$2:B1526) -> 1392 | B1526: 13282. | C1526: 典型人物与时代性 | D1526: 时论 | E1526: 梦蕉---转录《新闻报》 | F1526: 第1版
A1527: =COUNTA($B$2:B1527) -> 1393 | B1527: 13283. | C1527: 日本议会之生气 | D1527: 短评 | E1527: 傲霜庵 | F1527: 第1版
C1528: 防止传染病与卫生 | D1528: 短评 | E1528: 傲霜庵 | F1528: 第1版
C1529: 国民极宜戒除鸦片 | D1529: 短评 | E1529: 傲霜庵 | F1529: 第1版
A1530: =COUNTA($B$2:B1530) -> 1396 | B1530: 13284. | C1530: 满铁与行乐时期 | D1530: 短评 | E1530: 傲霜庵 | F1530: 第1版
C1531: 老阎自请处分 | D1531: 短评 | E1531: 傲霜庵 | F1531: 第1版
C1532: 假大夫误阿国 | D1532: 短评 | E1532: 傲霜庵 | F1532: 第1版
A1533: =COUNTA($B$2:B1533) -> 1399 | B1533: 13285. | C1533: 合作能救济农村经济耶？ | D1533: 时论 | E1533: 转录《北平晨报》 | F1533: 第1版
A1534: =COUNTA($B$2:B1534) -> 1400 | B1534: 13286. | C1534: 敬祝中岛真雄先生喜寿 | D1534: 论说 | E1534: 傲霜庵 | F1534: 第1版
A1535: =COUNTA($B$2:B1535) -> 1401 | B1535: 13287. | C1535: 中国地方高级行政人员会议 | D1535: 时论 | E1535: 都---转录《申报》 | F1535: 第1版
A1536: =COUNTA($B$2:B1536) -> 1402 | B1536: 13289. | C1536: 皖赣红茶之运销问题 | D1536: 时论 | E1536: 柳---转录《申报》 | F1536: 第1版
A1537: =COUNTA($B$2:B1537) -> 1403 | B1537: 13290. | C1537: 预防疾病智识进展 | D1537: 短评 | E1537: 傲霜庵 | F1537: 第1版
C1538: 唯健康可祛烦恼 | D1538: 短评 | E1538: 傲霜庵 | F1538: 第1版
C1539: 扑蝇不容或缓 | D1539: 短评 | E1539: 傲霜庵 | F1539: 第1版
A1540: =COUNTA($B$2:B1540) -> 1406 | B1540: 13291. | C1540: 广州的服装问题 | D1540: 时论 | E1540: 转录《申报》 | F1540: 第1版
A1541: =COUNTA($B$2:B1541) -> 1407 | B1541: 13292. | C1541: 胡汉民逝世后 | D1541: 时论 | E1541: 转录《庸报》 | F1541: 第1版
A1542: =COUNTA($B$2:B1542) -> 1408 | B1542: 13293. | C1542: 太阳闭目二分钟 | D1542: 短评 | E1542: 傲霜庵 | F1542: 第1版
C1543: 捐助内蒙灾黎 | D1543: 短评 | E1543: 傲霜庵 | F1543: 第1版
C1544: 国民大会与妇女 | D1544: 短评 | E1544: 傲霜庵 | F1544: 第1版
A1545: =COUNTA($B$2:B1545) -> 1411 | B1545: 13294. | C1545: 半岁间两度改革 | D1545: 短评 | E1545: 傲霜庵 | F1545: 第1版
C1546: 防空以上之急务 | D1546: 短评 | E1546: 傲霜庵 | F1546: 第1版
C1547: 我的将来希望 | D1547: 短评 | E1547: 傲霜庵 | F1547: 第1版
A1548: =COUNTA($B$2:B1548) -> 1414 | B1548: 13296. | C1548: 中国限制姓名权 | D1548: 时论 | E1548: 转录天津《益世報》 | F1548: 第1版
A1549: =COUNTA($B$2:B1549) -> 1415 | B1549: 13297. | C1549: 拆除沈阳城私议 | D1549: 短评 | E1549: 傲霜庵 | F1549: 第1版
C1550: 俊辽之关系奉天 | D1550: 短评 | E1550: 傲霜庵 | F1550: 第1版
C1551: 白来水与旧井水 | D1551: 短评 | E1551: 傲霜庵 | F1551: 第1版
A1552: =COUNTA($B$2:B1552) -> 1418 | B1552: 13298. | C1552: 论沈阳城须保存 | D1552: 论说 | E1552: 傲霜庵 | F1552: 第1版
A1553: =COUNTA($B$2:B1553) -> 1419 | B1553: 13299. | C1553: 杀机充塞天地 | D1553: 短评 | E1553: 傲霜庵 | F1553: 第1版
C1554: 共产献媚意大利 | D1554: 短评 | E1554: 傲霜庵 | F1554: 第1版
C1555: 党国一致祭展堂 | D1555: 短评 | E1555: 傲霜庵 | F1555: 第1版
A1556: =COUNTA($B$2:B1556) -> 1422 | B1556: 13300. | C1556: 从四川想到全国（上） | D1556: 时论 | E1556: 黄炎培---转录天津《大公报》 | F1556: 第1版
A1557: =COUNTA($B$2:B1557) -> 1423 | B1557: 13301. | C1557: 从四川想到全国（下） | D1557: 时论 | E1557: 黄炎培---转录天津《大公报》 | F1557: 第1版
A1558: =COUNTA($B$2:B1558) -> 1424 | B1558: 13303. | C1558: 阿刺伯的反英运动 | D1558: 时论 | E1558: 宝 | F1558: 第1版
A1559: =COUNTA($B$2:B1559) -> 1425 | B1559: 13304. | C1559: 论自杀 | D1559: 论说 | E1559: 匿名 | F1559: 第1版
A1560: =COUNTA($B$2:B1560) -> 1426 | B1560: 13305. | C1560: 洋米输入中国 | D1560: 时论 | E1560: 敬---转录《申报》 | F1560: 第1版
A1561: =COUNTA($B$2:B1561) -> 1427 | B1561: 13306. | C1561: 西南风云渐急 | D1561: 论说 | E1561: 傲霜庵 | F1561: 第1版
C1562: 渖默的中国古物 | D1562: 论说 | E1562: 傲霜庵 | F1562: 第1版
A1563: =COUNTA($B$2:B1563) -> 1429 | B1563: 13307. | C1563: 美国与加拿大的合并问题 | D1563: 时论 | E1563: 朗 | F1563: 第1版
A1564: =COUNTA($B$2:B1564) -> 1430 | B1564: 13308. | C1564: 法罢工风潮恶化 | D1564: 论说 | E1564: 傲霜庵 | F1564: 第1版
C1565: 阿皇末路凄惨 | D1565: 论说 | E1565: 傲霜庵 | F1565: 第1版
A1566: =COUNTA($B$2:B1566) -> 1432 | B1566: 13310. | C1566: 推行识字教育 | D1566: 时论 | E1566: 转录《庸报》 | F1566: 第1版
A1567: =COUNTA($B$2:B1567) -> 1433 | B1567: 13311. | C1567: 庆贺收回法权 | D1567: 短评 | E1567: 傲霜庵 | F1567: 第1版
C1568: 乞丐收容以后 | D1568: 短评 | E1568: 傲霜庵 | F1568: 第1版
C1569: 如何救济社会 | D1569: 短评 | E1569: 傲霜庵 | F1569: 第1版
A1570: =COUNTA($B$2:B1570) -> 1436 | B1570: 13312. | C1570: 中欧之火药库果将爆发乎？ | D1570: 时论 | E1570: ** | F1570: 第1版
A1571: =COUNTA($B$2:B1571) -> 1437 | B1571: 13313. | C1571: 南京与西南变动 | D1571: 论说 | E1571: 傲霜庵 | F1571: 第1版
A1572: =COUNTA($B$2:B1572) -> 1438 | B1572: 13314. | C1572: 蒋介石狡猾异常 | D1572: 短评 | E1572: 傲霜庵 | F1572: 第1版
C1573: 义国与制裁案 | D1573: 短评 | E1573: 傲霜庵 | F1573: 第1版
C1574: 鲁省早婚陋习 | D1574: 短评 | E1574: 傲霜庵 | F1574: 第1版
C1575: 向日本订购棺材 | D1575: 短评 | E1575: 傲霜庵 | F1575: 第1版
A1576: =COUNTA($B$2:B1576) -> 1442 | B1576: 13315. | C1576: 法新阁路线之前瞻 | D1576: 时论 | E1576: 天放 | F1576: 第1版
A1577: =COUNTA($B$2:B1577) -> 1443 | B1577: 13317. | C1577: 中国冤狱赔偿运动感言 | D1577: 时论 | E1577: 俞永修 | F1577: 第1版
A1578: =COUNTA($B$2:B1578) -> 1444 | B1578: 13318. | C1578: 缔结法约后对邮政之展望 | D1578: 时论 | E1578: 匿名 | F1578: 第1版
A1579: =COUNTA($B$2:B1579) -> 1445 | B1579: 13319. | C1579: 法国新外交政策 | D1579: 时论 | E1579: 转录《庸报》 | F1579: 第1版
A1580: =COUNTA($B$2:B1580) -> 1446 | B1580: 13320. | C1580: 中国政治之独裁与独夫 | D1580: 时论 | E1580: 转录《庸报》 | F1580: 第1版
A1581: =COUNTA($B$2:B1581) -> 1447 | B1581: 13321. | C1581: 宁派次第成功 | D1581: 短评 | E1581: 傲霜庵 | F1581: 第1版
C1582: 一刻万金的日食 | D1582: 短评 | E1582: 傲霜庵 | F1582: 第1版
C1583: 吊章炳麟 | D1583: 短评 | E1583: 傲霜庵 | F1583: 第1版
A1584: =COUNTA($B$2:B1584) -> 1450 | B1584: 13322. | C1584: 汉民族之与森林 | D1584: 论说 | E1584: 傲霜庵 | F1584: 第1版
C1585: 麻辣孙二次大会 | D1585: 论说 | E1585: 傲霜庵 | F1585: 第1版
A1586: =COUNTA($B$2:B1586) -> 1452 | B1586: 13324. | C1586: 英国之近东及远东政策之动摇 | D1586: 时论 | E1586: 转录天津《大公报》 | F1586: 第1版
A1587: =COUNTA($B$2:B1587) -> 1453 | B1587: 13326. | C1587: 变通无碍的英美 | D1587: 短评 | E1587: 傲霜庵 | F1587: 第1版
C1588: 返欧战前的外交 | D1588: 短评 | E1588: 傲霜庵 | F1588: 第1版
C1589: 日澳经济战开幕 | D1589: 短评 | E1589: 傲霜庵 | F1589: 第1版
A1590: =COUNTA($B$2:B1590) -> 1456 | B1590: 13327. | C1590: 勉励中国青年 | D1590: 时评 | E1590: 转录天津《大公报》 | F1590: 第1版
A1591: =COUNTA($B$2:B1591) -> 1457 | B1591: 13328. | C1591: 哈布斯堡皇朝复辟问题 | D1591: 时评 | E1591: 石龍 | F1591: 第1版
A1592: =COUNTA($B$2:B1592) -> 1458 | B1592: 13329. | C1592: 仓储制度与备荒 | D1592: 时论 | E1592: 转录《北平晨报》 | F1592: 第1版
A1593: =COUNTA($B$2:B1593) -> 1459 | B1593: 13331. | C1593: 英国人将怎么办？（上） | D1593: 时论 | E1593: 胡道维 | F1593: 第1版
A1594: =COUNTA($B$2:B1594) -> 1460 | B1594: 13333. | C1594: 人事调动 | D1594: 论说 | E1594: 匿名 | F1594: 第1版
A1595: =COUNTA($B$2:B1595) -> 1461 | B1595: 13334. | C1595: 西南局势又变 | D1595: 论说 | E1595: 傲霜庵 | F1595: 第1版
C1596: 阿王亲莅国联 | D1596: 论说 | E1596: 傲霜庵 | F1596: 第1版
A1597: =COUNTA($B$2:B1597) -> 1463 | B1597: 13335. | C1597: 日本与治外法权 | D1597: 短评 | E1597: 傲霜庵 | F1597: 第1版
C1598: 国联减价出售 | D1598: 短评 | E1598: 傲霜庵 | F1598: 第1版
C1599: 牛乳变羊毛 | D1599: 短评 | E1599: 傲霜庵 | F1599: 第1版
A1600: =COUNTA($B$2:B1600) -> 1466 | B1600: 13336. | C1600: 有害无益的国联 | D1600: 短评 | E1600: 傲霜庵 | F1600: 第1版
C1601: 犹太建国之失败 | D1601: 短评 | E1601: 傲霜庵 | F1601: 第1版
C1602: 彼此相持不下 | D1602: 短评 | E1602: 傲霜庵 | F1602: 第1版
C1603: 短波无线电案 | D1603: 短评 | E1603: 傲霜庵 | F1603: 第1版
A1604: =COUNTA($B$2:B1604) -> 1470 | B1604: 13338. | C1604: 中国经济界之两项问题 | D1604: 时论 | E1604: 柳 | F1604: 第1版
A1605: =COUNTA($B$2:B1605) -> 1471 | B1605: 13339. | C1605: 化除优越感私见 | D1605: 短评 | E1605: 匿名 | F1605: 第1版
C1606: 暑期当如何消遣 | D1606: 短评 | E1606: 匿名 | F1606: 第1版
A1607: =COUNTA($B$2:B1607) -> 1473 | B1607: 13340. | C1607: 论中国二五年度总预算 | D1607: 时论 | E1607: 晨山 | F1607: 第1版
A1608: =COUNTA($B$2:B1608) -> 1474 | B1608: 13341. | C1608: 老冯仍是怪物 | D1608: 论说 | E1608: 傲霜庵 | F1608: 第1版
C1609: 现在欧洲真多事 | D1609: 论说 | E1609: 傲霜庵 | F1609: 第1版
C1610: 国葬之分裂竞争 | D1610: 论说 | E1610: 傲霜庵 | F1610: 第1版
A1611: =COUNTA($B$2:B1611) -> 1477 | B1611: 13342. | C1611: 二中全会开幕 | D1611: 论说 | E1611: 傲霜庵 | F1611: 第1版
C1612: 西南倒戈相继 | D1612: 论说 | E1612: 傲霜庵 | F1612: 第1版
A1613: =COUNTA($B$2:B1613) -> 1479 | B1613: 13343. | C1613: 德意关系 | D1613: 时论 | E1613: 藕顿 | F1613: 第1版
A1614: =COUNTA($B$2:B1614) -> 1480 | B1614: 13345. | C1614: 国联前途没落的推测 | D1614: 时论 | E1614: 转录《晨报》 | F1614: 第1版
A1615: =COUNTA($B$2:B1615) -> 1481 | B1615: 13346. | C1615: 理财？议 | D1615: 论说 | E1615: 匿名 | F1615: 第1版
A1616: =COUNTA($B$2:B1616) -> 1482 | B1616: 13348. | C1616: 叙利亚的民族怒潮（下） | D1616: 时论 | E1616: 陶菊隐 | F1616: 第1版
A1617: =COUNTA($B$2:B1617) -> 1483 | B1617: 13349. | C1617: 哭田罔淮海先生 | D1617: 论说 | E1617: 傲霜庵 | F1617: 第1版
A1618: =COUNTA($B$2:B1618) -> 1484 | B1618: 13350. | C1618: 德奥协定 | D1618: 时论 | E1618: 真 | F1618: 第1版
A1619: =COUNTA($B$2:B1619) -> 1485 | B1619: 13352. | C1619: 中国如何完成户口清查 | D1619: 时论 | E1619: 转录《晨报》 | F1619: 第1版
A1620: =COUNTA($B$2:B1620) -> 1486 | B1620: 13353. | C1620: 传染病与苍蝇 | D1620: 论说 | E1620: 匿名 | F1620: 第1版
A1621: =COUNTA($B$2:B1621) -> 1487 | B1621: 13354. | C1621: 陈济棠下野出走 | D1621: 短评 | E1621: 傲霜庵 | F1621: 第1版
C1622: 中国撤废制裁 | D1622: 短评 | E1622: 傲霜庵 | F1622: 第1版
C1623: 满洲农作现况 | D1623: 短评 | E1623: 傲霜庵 | F1623: 第1版
A1624: =COUNTA($B$2:B1624) -> 1490 | B1624: 13355. | C1624: 英国与欧洲 | D1624: 时论 | E1624: 真 | F1624: 第1版
A1625: =COUNTA($B$2:B1625) -> 1491 | B1625: 13356. | C1625: 西班牙大叛乱 | D1625: 论说 | E1625: 傲霜庵 | F1625: 第1版
C1626: 水灾与飞机活跃 | D1626: 论说 | E1626: 傲霜庵 | F1626: 第1版
A1627: =COUNTA($B$2:B1627) -> 1493 | B1627: 13357. | C1627: 圣火日日逼柏林 | D1627: 短评 | E1627: 傲霜庵 | F1627: 第1版
C1628: 仿佛是凯旋将军 | D1628: 短评 | E1628: 傲霜庵 | F1628: 第1版
C1629: 苏俄航空之成功 | D1629: 短评 | E1629: 傲霜庵 | F1629: 第1版
C1630: 法商希望提携 | D1630: 短评 | E1630: 傲霜庵 | F1630: 第1版
A1631: =COUNTA($B$2:B1631) -> 1497 | B1631: 13359. | C1631: 中国银行业的新趋向 | D1631: 时论 | E1631: 彥 | F1631: 第1版
A1632: =COUNTA($B$2:B1632) -> 1498 | B1632: 13360. | C1632: 禁烟感言 | D1632: 论说 | E1632: 匿名 | F1632: 第1版
A1633: =COUNTA($B$2:B1633) -> 1499 | B1633: 13361. | C1633: 西乱将危及全欧？ | D1633: 论说 | E1633: 傲霜庵 | F1633: 第1版
C1634: 德国之承认合并 | D1634: 论说 | E1634: 傲霜庵 | F1634: 第1版
A1635: =COUNTA($B$2:B1635) -> 1501 | B1635: 13362. | C1635: 李白果抗命出战？ | D1635: 短评 | E1635: 傲霜庵 | F1635: 第1版
C1636: 陈私财三万万元 | D1636: 短评 | E1636: 傲霜庵 | F1636: 第1版
C1637: 饭桶与酒囊将军 | D1637: 短评 | E1637: 傲霜庵 | F1637: 第1版
A1638: =COUNTA($B$2:B1638) -> 1504 | B1638: 13363. | C1638: 中国教育与汉字的存废（上） | D1638: 时论 | E1638: 吴俊升 | F1638: 第1版
A1639: =COUNTA($B$2:B1639) -> 1505 | B1639: 13364. | C1639: 中国教育与汉字的存废（下） | D1639: 时论 | E1639: 吴俊升 | F1639: 第1版
A1640: =COUNTA($B$2:B1640) -> 1506 | B1640: 13366. | C1640: 老？不老？ | D1640: 时论 | E1640: 梅君 | F1640: 第1版
A1641: =COUNTA($B$2:B1641) -> 1507 | B1641: 13367. | C1641: 半年来之中国经济检讨 | D1641: 时论 | E1641: 天放---转录《新闻报》 | F1641: 第1版
A1642: =COUNTA($B$2:B1642) -> 1508 | B1642: 13368. | C1642: 欧林匹克感言 | D1642: 论说 | E1642: 傲霜庵 | F1642: 第1版
A1643: =COUNTA($B$2:B1643) -> 1509 | B1643: 13369. | C1643: 劝导自来水须谨慎 | D1643: 论说 | E1643: 傲霜庵 | F1643: 第1版
A1644: =COUNTA($B$2:B1644) -> 1510 | B1644: 13370. | C1644: 开发北满之雄图 | D1644: 论说 | E1644: 傲霜庵 | F1644: 第1版
C1645: 希腊亦惹起政变 | D1645: 论说 | E1645: 傲霜庵 | F1645: 第1版
A1646: =COUNTA($B$2:B1646) -> 1512 | B1646: 13371. | C1646: 英国远东政策之将来 | D1646: 论说 | E1646: 匿名 | F1646: 第1版
A1647: =COUNTA($B$2:B1647) -> 1513 | B1647: 13373. | C1647: 中国应倡导归农运动 | D1647: 时论 | E1647: 匿名 | F1647: 第1版
A1648: =COUNTA($B$2:B1648) -> 1514 | B1648: 13374. | C1648: 推广协和工作 | D1648: 短评 | E1648: 傲霜庵 | F1648: 第1版
C1649: 秋雨为害之可罹 | D1649: 短评 | E1649: 傲霜庵 | F1649: 第1版
C1650: 市面乞丐又充斥 | D1650: 短评 | E1650: 傲霜庵 | F1650: 第1版
A1651: =COUNTA($B$2:B1651) -> 1517 | B1651: 13375. | C1651: 中国与欧林匹克 | D1651: 论说 | E1651: 傲霜庵 | F1651: 第1版
A1652: =COUNTA($B$2:B1652) -> 1518 | B1652: 13376. | C1652: 广西日内当解决 | D1652: 短评 | E1652: 傲霜庵 | F1652: 第1版
C1653: 日本着手准备 | D1653: 短评 | E1653: 傲霜庵 | F1653: 第1版
C1654: 痛革建国后陋习 | D1654: 短评 | E1654: 傲霜庵 | F1654: 第1版
A1655: =COUNTA($B$2:B1655) -> 1521 | B1655: 13377. | C1655: 论对西不干涉案 | D1655: 论说 | E1655: 傲霜庵 | F1655: 第1版
C1656: 澳洲竟作悲鸣 | D1656: 论说 | E1656: 傲霜庵 | F1656: 第1版
A1657: =COUNTA($B$2:B1657) -> 1523 | B1657: 13378. | C1657: 欧会书感（上） | D1657: 论说 | E1657: 丐 | F1657: 第1版
A1658: =COUNTA($B$2:B1658) -> 1524 | B1658: 13380. | C1658: 欧会书感（下） | D1658: 论说 | E1658: 丐 | F1658: 第1版
A1659: =COUNTA($B$2:B1659) -> 1525 | B1659: 13382. | C1659: 欧会闭幕书后 | D1659: 论说 | E1659: 傲霜庵 | F1659: 第1版
A1660: =COUNTA($B$2:B1660) -> 1526 | B1660: 13383. | C1660: 学术与行政应切求联系 | D1660: 时论 | E1660: 转录《北平晨报》 | F1660: 第1版
A1661: =COUNTA($B$2:B1661) -> 1527 | B1661: 13384. | C1661: 体魄蛮化说 | D1661: 短评 | E1661: 丐 | F1661: 第1版
C1662: 畸形国家之婚姻 | D1662: 短评 | E1662: 丐 | F1662: 第1版
A1663: =COUNTA($B$2:B1663) -> 1529 | B1663: 13385. | C1663: 马德里将失守？ | D1663: 短评 | E1663: 傲霜庵 | F1663: 第1版
C1664: 花样翻新之战局 | D1664: 短评 | E1664: 傲霜庵 | F1664: 第1版
C1665: 中国巨人病故 | D1665: 短评 | E1665: 傲霜庵 | F1665: 第1版
A1666: =COUNTA($B$2:B1666) -> 1532 | B1666: 13387. | C1666: 一个日本人的中国观序 | D1666: 时论 | E1666: 鲁迅 | F1666: 第1版
A1667: =COUNTA($B$2:B1667) -> 1533 | B1667: 13388. | C1667: 唯节约可保廉洁 | D1667: 论说 | E1667: 匿名 | F1667: 第1版
A1668: =COUNTA($B$2:B1668) -> 1534 | B1668: 13390. | C1668: 成都日人被伐案 | D1668: 论说 | E1668: 傲霜庵 | F1668: 第1版
A1669: =COUNTA($B$2:B1669) -> 1535 | B1669: 13391. | C1669: 致胡适先生 | D1669: 论说 | E1669: 傲霜庵 | F1669: 第1版
C1670: 征兵年龄之低下 | D1670: 论说 | E1670: 傲霜庵 | F1670: 第1版
A1671: =COUNTA($B$2:B1671) -> 1537 | B1671: 13392. | C1671: 斯大林与战争 | D1671: 论说 | E1671: 傲霜庵 | F1671: 第1版
C1672: 二次满洲里会议 | D1672: 论说 | E1672: 傲霜庵 | F1672: 第1版
C1673: 最近之广西问题 | D1673: 论说 | E1673: 傲霜庵 | F1673: 第1版
A1674: =COUNTA($B$2:B1674) -> 1540 | B1674: 13394. | C1674: 看不到，转《申报》 | F1674: 第1版
A1675: =COUNTA($B$2:B1675) -> 1541 | B1675: 13395. | C1675: 治道在知缓急标本 | D1675: 论说 | E1675: 匿名 | F1675: 第1版
A1676: =COUNTA($B$2:B1676) -> 1542 | B1676: 13396. | C1676: 陵树被抢 | D1676: 短评 | E1676: 丐 | F1676: 第1版
C1677: 西班牙之表 | D1677: 短评 | E1677: 丐 | F1677: 第1版
C1678: 东西婚姻之不同 | D1678: 短评 | E1678: 丐 | F1678: 第1版
A1679: =COUNTA($B$2:B1679) -> 1545 | B1679: 13397. | C1679: 苏联反革命案之复勘 | D1679: 时论 | E1679: 天放 | F1679: 第1版
A1680: =COUNTA($B$2:B1680) -> 1546 | B1680: 13398. | C1680: 现代青年之烦闷 | D1680: 短评 | E1680: 丐 | F1680: 第1版
C1681: 医士公会勿自杀 | D1681: 短评 | E1681: 丐 | F1681: 第1版
C1682: 满外 | D1682: 短评 | E1682: 丐 | F1682: 第1版
A1683: =COUNTA($B$2:B1683) -> 1549 | B1683: 13399. | C1683: 英埃两国与意国 | D1683: 论说 | E1683: 傲霜庵 | F1683: 第1版
C1684: 苏俄丑态华露 | D1684: 论说 | E1684: 傲霜庵 | F1684: 第1版
A1685: =COUNTA($B$2:B1685) -> 1551 | B1685: 13401. | C1685: 西班牙杀人如麻 | D1685: 短评 | E1685: 傲霜庵 | F1685: 第1版
C1686: 植树之与种棉 | D1686: 短评 | E1686: 傲霜庵 | F1686: 第1版
C1687: 华北与国代选举 | D1687: 短评 | E1687: 傲霜庵 | F1687: 第1版
A1688: =COUNTA($B$2:B1688) -> 1554 | B1688: 13402. | C1688: 国道后五年计划 | D1688: 短评 | E1688: 匿名 | F1688: 第1版
C1689: 人须知静心养性 | D1689: 短评 | E1689: 匿名 | F1689: 第1版
C1690: 函谢盗绑其子 | D1690: 短评 | E1690: 匿名 | F1690: 第1版
A1691: =COUNTA($B$2:B1691) -> 1557 | B1691: 13403. | C1691: 取缔饲野犬会议 | D1691: 论说 | E1691: 丐 | F1691: 第1版
A1692: =COUNTA($B$2:B1692) -> 1558 | B1692: 13404. | C1692: 美国之恐日病 | D1692: 论说 | E1692: 傲霜庵 | F1692: 第1版
A1693: =COUNTA($B$2:B1693) -> 1559 | B1693: 13405. | C1693: 中国最大之国耻 | D1693: 论说 | E1693: 傲霜庵 | F1693: 第1版
C1694: 斯达林病重说 | D1694: 论说 | E1694: 傲霜庵 | F1694: 第1版
C1695: 西班牙新内阁 | D1695: 论说 | E1695: 傲霜庵 | F1695: 第1版
A1696: =COUNTA($B$2:B1696) -> 1562 | B1696: 13406. | C1696: 德苏邦交恶化及其前途 | D1696: 时论 | E1696: 匿名 | F1696: 第1版
A1697: =COUNTA($B$2:B1697) -> 1563 | B1697: 13408. | C1697: 没有评论，但是有日本承认满洲国四周年纪念 | F1697: 第1版
A1698: =COUNTA($B$2:B1698) -> 1564 | B1698: 13409. | C1698: 尊孔之我见 在身体力行 | D1698: 时论 | E1698: 匿名 | F1698: 第1版
A1699: =COUNTA($B$2:B1699) -> 1565 | B1699: 13410. | C1699: 英国对巴勒斯坦的宣言 | D1699: 时论 | E1699: 立 | F1699: 第1版
A1700: =COUNTA($B$2:B1700) -> 1566 | B1700: 13412. | C1700: 中国之合作事业 | D1700: 时论 | E1700: 匿名 | F1700: 第1版
A1701: =COUNTA($B$2:B1701) -> 1567 | B1701: 13415. | C1701: 兵役法推行后应注重之两点 | D1701: 时论 | E1701: 梦若---转录《新闻报》 | F1701: 第1版
A1702: =COUNTA($B$2:B1702) -> 1568 | B1702: 13417. | C1702: 中国如何彻底废除苛杂？ | D1702: 时论 | E1702: 转录《北平晨报》 | F1702: 第1版
A1703: =COUNTA($B$2:B1703) -> 1569 | B1703: 13418. | C1703: 欧局动态鸟瞰 | D1703: 时论 | E1703: 远村 | F1703: 第1版
A1704: =COUNTA($B$2:B1704) -> 1570 | B1704: 13419. | C1704: 中日须正式开展 | D1704: 论说 | E1704: 傲霜庵 | F1704: 第1版
A1705: =COUNTA($B$2:B1705) -> 1571 | B1705: 13420. | C1705: 奉天中心时代 | D1705: 论说 | E1705: 傲霜庵 | F1705: 第1版
C1706: 阿国代表仍出席 | D1706: 论说 | E1706: 傲霜庵 | F1706: 第1版
A1707: =COUNTA($B$2:B1707) -> 1573 | B1707: 13422. | C1707: 上海人力车问题 | D1707: 时论 | E1707: 纪---转录《申报》 | F1707: 第1版
A1708: =COUNTA($B$2:B1708) -> 1574 | B1708: 13423. | C1708: 中秋节之今昔 | D1708: 论说 | E1708: 匿名 | F1708: 第1版
A1709: =COUNTA($B$2:B1709) -> 1575 | B1709: 13424. | C1709: 德意接近与欧洲局势（上） | D1709: 时论 | E1709: 胡道维 | F1709: 第1版
A1710: =COUNTA($B$2:B1710) -> 1576 | B1710: 13425. | C1710: 德意接近与欧洲局势（下） | D1710: 时论 | E1710: 胡道维 | F1710: 第1版
A1711: =COUNTA($B$2:B1711) -> 1577 | B1711: 13426. | C1711: 大西门之拆除 | D1711: 短评 | E1711: 丐 | F1711: 第1版
C1712: 奇怪之马背 | D1712: 短评 | E1712: 丐 | F1712: 第1版
A1713: =COUNTA($B$2:B1713) -> 1579 | B1713: 13429. | C1713: 英国外交与区域安全 | D1713: 时论 | E1713: 隅 | F1713: 第1版
A1714: =COUNTA($B$2:B1714) -> 1580 | B1714: 13431. | C1714: 英美法货币协定成立 | D1714: 时论 | E1714: 宜 | F1714: 第1版
A1715: =COUNTA($B$2:B1715) -> 1581 | B1715: 13432. | C1715: 日俄关系转佳 | D1715: 论说 | E1715: 傲霜庵 | F1715: 第1版
C1716: 革命代价之太贵 | D1716: 论说 | E1716: 傲霜庵 | F1716: 第1版
C1717: 机摩登的埋尸案 | D1717: 论说 | E1717: 傲霜庵 | F1717: 第1版
A1718: =COUNTA($B$2:B1718) -> 1584 | B1718: 13433. | C1718: 华北经济提携 | D1718: 短评 | E1718: 傲霜庵 | F1718: 第1版
C1719: 英非五十三小时 | D1719: 短评 | E1719: 傲霜庵 | F1719: 第1版
C1720: 中国与国联理事 | D1720: 短评 | E1720: 傲霜庵 | F1720: 第1版
A1721: =COUNTA($B$2:B1721) -> 1587 | B1721: 13434. | C1721: 电影之宣传价值 | D1721: 论说 | E1721: 傲霜庵 | F1721: 第1版
C1722: 英国占领八岛屿 | D1722: 论说 | E1722: 傲霜庵 | F1722: 第1版
A1723: =COUNTA($B$2:B1723) -> 1589 | B1723: 13437. | C1723: 天气骤寒与贫民 | D1723: 论说 | E1723: 匿名 | F1723: 第1版
A1724: =COUNTA($B$2:B1724) -> 1590 | B1724: 13438. | C1724: 内乱与外国军火 | D1724: 论说 | E1724: 傲霜庵 | F1724: 第1版
C1725: 华北之日英合作 | D1725: 论说 | E1725: 傲霜庵 | F1725: 第1版
A1726: =COUNTA($B$2:B1726) -> 1592 | B1726: 13439. | C1726: 贡波斯逝世后匈牙利政局的动向 | D1726: 时论 | E1726: 朗---转录《申报》 | F1726: 第1版
A1727: =COUNTA($B$2:B1727) -> 1593 | B1727: 13440. | C1727: 对于新北平计划之建议 | D1727: 时论 | E1727: 转录《北平晨报》 | F1727: 第1版
A1728: =COUNTA($B$2:B1728) -> 1594 | B1728: 13443. | C1728: 本报三十周年之回顾 | D1728: 论说 | E1728: 匿名 | F1728: 第1版
A1729: =COUNTA($B$2:B1729) -> 1595 | B1729: 13444. | C1729: 满日结婚 | D1729: 短评 | E1729: 匿名 | F1729: 第1版
C1730: 早雪与植物 | D1730: 短评 | E1730: 匿名 | F1730: 第1版
A1731: =COUNTA($B$2:B1731) -> 1597 | B1731: 13445. | C1731: 逐渐展开之苏联政争 | D1731: 时论 | E1731: 匿名 | F1731: 第1版
A1732: =COUNTA($B$2:B1732) -> 1598 | B1732: 13446. | C1732: 伦敦人的新玩意 | D1732: 时论 | E1732: 梦若 | F1732: 第1版
A1733: =COUNTA($B$2:B1733) -> 1599 | B1733: 13447. | C1733: 为民请命 | D1733: 时论 | E1733: 小民 | F1733: 第1版
A1734: =COUNTA($B$2:B1734) -> 1600 | B1734: 13448. | C1734: 比国的恢复中立问题 | D1734: 时论 | E1734: 匿名 | F1734: 第1版
A1735: =COUNTA($B$2:B1735) -> 1601 | B1735: 13450. | C1735: 中国工商业与实施所得税 | D1735: 时论 | E1735: 匿名 | F1735: 第1版
A1736: =COUNTA($B$2:B1736) -> 1602 | B1736: 13451. | C1736: 奥国复辟吗？ | D1736: 时论 | E1736: 逸真 | F1736: 第1版
A1737: =COUNTA($B$2:B1737) -> 1603 | B1737: 13452. | C1737: 草裙绝舞 | D1737: 时论 | E1737: 无次---转录《申报》 | F1737: 第1版
A1738: =COUNTA($B$2:B1738) -> 1604 | B1738: 13453. | C1738: 对中国请修正破产法者补充意见 | D1738: 时论 | E1738: 梦蕉 | F1738: 第1版
A1739: =COUNTA($B$2:B1739) -> 1605 | B1739: 13454. | C1739: 欧局动荡中之意德谈话 | D1739: 时论 | E1739: 石龙 | F1739: 第1版
A1740: =COUNTA($B$2:B1740) -> 1606 | B1740: 13457. | C1740: 罗斯福乎？蓝敦乎？ | D1740: 时论 | E1740: 王赣愚 | F1740: 第1版
A1741: =COUNTA($B$2:B1741) -> 1607 | B1741: 13458. | C1741: 论自杀 | D1741: 论说 | E1741: 匿名 | F1741: 第1版
A1742: =COUNTA($B$2:B1742) -> 1608 | B1742: 13459. | C1742: 中国粮食产销调节问题 | D1742: 时论 | E1742: 丹威 | F1742: 第1版
A1743: =COUNTA($B$2:B1743) -> 1609 | B1743: 13460. | C1743: 中国政治的特征（上） | D1743: 时论 | E1743: 胡道维 | F1743: 第1版
A1744: =COUNTA($B$2:B1744) -> 1610 | B1744: 13461. | C1744: 中国政治的特征（下） | D1744: 时论 | E1744: 胡道维 | F1744: 第1版
A1745: =COUNTA($B$2:B1745) -> 1611 | B1745: 13462. | C1745: 漫无计划的中国大学教育（上） | D1745: 时论 | E1745: 匿名 | F1745: 第1版
A1746: =COUNTA($B$2:B1746) -> 1612 | B1746: 13464. | C1746: 漫无计划的中国大学教育（上） | D1746: 时论 | E1746: 匿名 | F1746: 第1版
A1747: =COUNTA($B$2:B1747) -> 1613 | B1747: 13465. | C1747: 防火宣传 | D1747: 短评 | E1747: 匿名 | F1747: 第1版
C1748: 白书行抢 | D1748: 短评 | E1748: 匿名 | F1748: 第1版
C1749: 中街夜市 | D1749: 短评 | E1749: 匿名 | F1749: 第1版
A1750: =COUNTA($B$2:B1750) -> 1616 | B1750: 13466. | C1750: 欧局动荡中法国政局（上） | D1750: 时论 | E1750: 远村 | F1750: 第1版
A1751: =COUNTA($B$2:B1751) -> 1617 | B1751: 13467. | C1751: 欧局动荡中法国政局（下） | D1751: 时论 | E1751: 远村 | F1751: 第1版
A1752: =COUNTA($B$2:B1752) -> 1618 | B1752: 13468. | C1752: 美国总统选举以后 | D1752: 时论 | E1752: 星 | F1752: 第1版
A1753: =COUNTA($B$2:B1753) -> 1619 | B1753: 13469. | C1753: 中国财政之分歧点 | D1753: 时论 | E1753: 转录《晨报》 | F1753: 第1版
A1754: =COUNTA($B$2:B1754) -> 1620 | B1754: 13471. | C1754: 欧洲将往何处去乎？ | D1754: 时论 | E1754: *蓀 | F1754: 第1版
A1755: =COUNTA($B$2:B1755) -> 1621 | B1755: 13472. | C1755: 所望于县长会议 | D1755: 论说 | E1755: 匿名 | F1755: 第1版
A1756: =COUNTA($B$2:B1756) -> 1622 | B1756: 13473. | C1756: 中国行政效率之实际问题 | D1756: 时论 | E1756: 转录《北平晨报》 | F1756: 第1版
A1757: =COUNTA($B$2:B1757) -> 1623 | B1757: 13474. | C1757: 西班牙内战与欧局 | D1757: 时论 | E1757: 匿名 | F1757: 第1版
A1758: =COUNTA($B$2:B1758) -> 1624 | B1758: 13475. | C1758: 中国如何安定物价 | D1758: 时论 | E1758: 柳 | F1758: 第1版
A1759: =COUNTA($B$2:B1759) -> 1625 | B1759: 13476. | C1759: 银潮续发之警讯 | D1759: 时论 | E1759: 天放 | F1759: 第1版
A1760: =COUNTA($B$2:B1760) -> 1626 | B1760: 13478. | C1760: 西班牙国民运动的意向 | D1760: 时论 | E1760: 邵德基 | F1760: 第1版
A1761: =COUNTA($B$2:B1761) -> 1627 | B1761: 13479. | C1761: 唤起人民健康思想 | D1761: 论说 | E1761: 匿名 | F1761: 第1版
A1762: =COUNTA($B$2:B1762) -> 1628 | B1762: 13480. | C1762: 德国废止自由通航条款的意义 | D1762: 时论 | E1762: 隅 | F1762: 第1版
A1763: =COUNTA($B$2:B1763) -> 1629 | B1763: 13481. | C1763: 论日德防共协定 | D1763: 论说 | E1763: 傲霜庵 | F1763: 第1版
A1764: =COUNTA($B$2:B1764) -> 1630 | B1764: 13482. | C1764: 日德意共同阵线 | D1764: 论说 | E1764: 傲霜庵 | F1764: 第1版
C1765: 满洲国尊重汉医 | D1765: 论说 | E1765: 傲霜庵 | F1765: 第1版
C1766: 南满罕见之大雪 | D1766: 论说 | E1766: 傲霜庵 | F1766: 第1版
A1767: =COUNTA($B$2:B1767) -> 1633 | B1767: 13483. | C1767: 欧洲局势与思想背景（上） | D1767: 时论 | E1767: 潘光旦 | F1767: 第1版
A1768: =COUNTA($B$2:B1768) -> 1634 | B1768: 13485. | C1768: 欧洲局势与思想背景（下） | D1768: 时论 | E1768: 潘光旦 | F1768: 第1版
A1769: =COUNTA($B$2:B1769) -> 1635 | B1769: 13486. | C1769: 防共之私见 | D1769: 论说 | E1769: 匿名 | F1769: 第1版
A1770: =COUNTA($B$2:B1770) -> 1636 | B1770: 13487. | C1770: 世界银价的前途（幸） | D1770: 时论 | E1770: 幸---转录《申报》 | F1770: 第1版
A1771: =COUNTA($B$2:B1771) -> 1637 | B1771: 13488. | C1771: 中英续勘滇缅界务 | D1771: 时论 | E1771: 立---转录《申报》 | F1771: 第1版
A1772: =COUNTA($B$2:B1772) -> 1638 | B1772: 13489. | C1772: 承认交战团体与英国之外交 | D1772: 时论 | E1772: *蓀 | F1772: 第1版
A1773: =COUNTA($B$2:B1773) -> 1639 | B1773: 13490. | C1773: 美国节制外资之移动 | D1773: 时论 | E1773: ** | F1773: 第1版
A1774: =COUNTA($B$2:B1774) -> 1640 | B1774: 13492. | C1774: 苏联新宪法后效将何如 | D1774: 时论 | E1774: 匿名 | F1774: 第1版
A1775: =COUNTA($B$2:B1775) -> 1641 | B1775: 13493. | C1775: 生活革新运动 | D1775: 论说 | E1775: 匿名 | F1775: 第1版
A1776: =COUNTA($B$2:B1776) -> 1642 | B1776: 13494. | C1776: 绥远与远心作用 | D1776: 论说 | E1776: 傲霜庵 | F1776: 第1版
C1777: 帝王、美人、宰相 | D1777: 论说 | E1777: 傲霜庵 | F1777: 第1版
A1778: =COUNTA($B$2:B1778) -> 1644 | B1778: 13495. | C1778: 中国修正出版法 | D1778: 时论 | E1778: 星---转录《申报》 | F1778: 第1版
A1779: =COUNTA($B$2:B1779) -> 1645 | B1779: 13496. | C1779: 英皇爱德华逊位 | D1779: 论说 | E1779: 傲霜庵 | F1779: 第1版
C1780: 胡适回国第一问 | D1780: 论说 | E1780: 傲霜庵 | F1780: 第1版
A1781: =COUNTA($B$2:B1781) -> 1647 | B1781: 13497. | C1781: 公路之生产效能 | D1781: 时论 | E1781: 转录《北平晨报》 | F1781: 第1版
A1782: =COUNTA($B$2:B1782) -> 1648 | B1782: 13499. | C1782: 蒋介石作阶下囚 | D1782: 论说 | E1782: 傲霜庵 | F1782: 第1版
A1783: =COUNTA($B$2:B1783) -> 1649 | B1783: 13500. | C1783: 蒋介石仍在人间？ | D1783: 论说 | E1783: 傲霜庵 | F1783: 第1版
C1784: 满洲国新标准时 | D1784: 论说 | E1784: 傲霜庵 | F1784: 第1版
A1785: =COUNTA($B$2:B1785) -> 1651 | B1785: 13501. | C1785: 中国新所得税制之缺点 | D1785: 时论 | E1785: 转录《北平晨报》 | F1785: 第1版
A1786: =COUNTA($B$2:B1786) -> 1652 | B1786: 13502. | C1786: 此时不宜趁火打劫 | D1786: 论说 | E1786: 傲霜庵 | F1786: 第1版
C1787: 锦热蒙旗问题 | D1787: 论说 | E1787: 傲霜庵 | F1787: 第1版
A1788: =COUNTA($B$2:B1788) -> 1654 | B1788: 13503. | C1788: 须调停绥远战争 | D1788: 论说 | E1788: 傲霜庵 | F1788: 第1版
A1789: =COUNTA($B$2:B1789) -> 1655 | B1789: 13504. | C1789: 中国遗产税原则 | D1789: 时论 | E1789: 匿名 | F1789: 第1版
A1790: =COUNTA($B$2:B1790) -> 1656 | B1790: 13506. | C1790: 中国非常时期的金融 | D1790: 时论 | E1790: 柳---转录《申报》 | F1790: 第1版
A1791: =COUNTA($B$2:B1791) -> 1657 | B1791: 13508. | C1791: 如何解决中国失业问题 | D1791: 时论 | E1791: 转录《北平晨报》 | F1791: 第1版
A1792: =COUNTA($B$2:B1792) -> 1658 | B1792: 13509. | C1792: 学良操纵之巧妙 | D1792: 论说 | E1792: 傲霜庵 | F1792: 第1版
C1793: 国土益形缩小 | D1793: 论说 | E1793: 傲霜庵 | F1793: 第1版
A1794: =COUNTA($B$2:B1794) -> 1660 | B1794: 13510. | C1794: 讨逆与非讨逆 | D1794: 论说 | E1794: 傲霜庵 | F1794: 第1版
C1795: 飞行船卓著成绩 | D1795: 论说 | E1795: 傲霜庵 | F1795: 第1版
A1796: =COUNTA($B$2:B1796) -> 1662 | B1796: 13511. | C1796: 蒋介石抵洛阳 | D1796: 论说 | E1796: 傲霜庵 | F1796: 第1版
A1797: =COUNTA($B$2:B1797) -> 1663 | B1797: 13513. | C1797: 英义地中海协定 | D1797: 时论 | E1797: 华 | F1797: 第1版
A1798: =COUNTA($B$2:B1798) -> 1664 | B1798: 13514. | C1798: 送岁之辞 | D1798: 论说 | E1798: 匿名 | F1798: 第1版
A1799: =COUNTA($B$2:B1799) -> 1665 | B1799: 13520. | C1799: 法国政治门争之趋势 | D1799: 时论 | E1799: 匿名 | F1799: 第1版
A1800: =COUNTA($B$2:B1800) -> 1666 | B1800: 13521. | C1800: 天气温暖与人生关系 | D1800: 论说 | E1800: 匿名 | F1800: 第1版
A1801: =COUNTA($B$2:B1801) -> 1667 | B1801: 13522. | C1801: 西班牙战事 | D1801: 时论 | E1801: 玄圃 | F1801: 第1版
A1802: =COUNTA($B$2:B1802) -> 1668 | B1802: 13523. | C1802: 印度民族解放运动 | D1802: 时论 | E1802: 朗 | F1802: 第1版
A1803: =COUNTA($B$2:B1803) -> 1669 | B1803: 13524. | C1803: 评中国工业同业公会法草案 | D1803: 时论 | E1803: 转录天津《大公报》 | F1803: 第1版
A1804: =COUNTA($B$2:B1804) -> 1670 | B1804: 13525. | C1804: 一九三六年世界经济之回顾 | D1804: 时论 | E1804: 转录天津《大公报》 | F1804: 第1版
A1805: =COUNTA($B$2:B1805) -> 1671 | B1805: 13527. | C1805: 上海调查学龄儿童感言 | D1805: 时论 | E1805: 叔共 | F1805: 第1版
A1806: =COUNTA($B$2:B1806) -> 1672 | B1806: 13528. | C1806: 贫民众多与粮价昂贵 | D1806: 论说 | E1806: 匿名 | F1806: 第1版
A1807: =COUNTA($B$2:B1807) -> 1673 | B1807: 13529. | C1807: 统计竟成宣传工具 | D1807: 时论 | E1807: 转录《北平晨报》 | F1807: 第1版
A1808: =COUNTA($B$2:B1808) -> 1674 | B1808: 13530. | C1808: 英意关系与君子协定 | D1808: 时论 | E1808: 匿名 | F1808: 第1版
A1809: =COUNTA($B$2:B1809) -> 1675 | B1809: 13531. | C1809: 法国与多瑙河关系人新阶段 | D1809: 时论 | E1809: 藕顿 | F1809: 第1版
A1810: =COUNTA($B$2:B1810) -> 1676 | B1810: 13532. | C1810: 一九三七年经济政策预测 | D1810: 时论 | E1810: 匿名 | F1810: 第1版
A1811: =COUNTA($B$2:B1811) -> 1677 | B1811: 13534. | C1811: “国防经济学”导言 | D1811: 时论 | E1811: 蒋方震 | F1811: 第1版
A1812: =COUNTA($B$2:B1812) -> 1678 | B1812: 13535. | C1812: 论户外周间 | D1812: 论说 | E1812: 匿名 | F1812: 第1版
A1813: =COUNTA($B$2:B1813) -> 1679 | B1813: 13536. | C1813: 日本政治外交之指标（上） | D1813: 时论 | E1813: 日本贵族院长议 | F1813: 第1版
A1814: =COUNTA($B$2:B1814) -> 1680 | B1814: 13537. | C1814: 日本政治外交之指标（中） | D1814: 时论 | E1814: 日本贵族院长议 | F1814: 第1版
A1815: =COUNTA($B$2:B1815) -> 1681 | B1815: 13538. | C1815: 日本政治外交之指标（下） | D1815: 时论 | E1815: 日本贵族院长议 | F1815: 第1版
A1816: =COUNTA($B$2:B1816) -> 1682 | B1816: 13539. | C1816: 解散*总辞职？ | D1816: 论说 | E1816: 傲霜庵 | F1816: 第1版
C1817: 西班牙之大走私 | D1817: 论说 | E1817: 傲霜庵 | F1817: 第1版
A1818: =COUNTA($B$2:B1818) -> 1684 | B1818: 13541. | C1818: 宵衣旰食之日皇 | D1818: 论说 | E1818: 傲霜庵 | F1818: 第1版
C1819: 经济路线之新计划 | D1819: 论说 | E1819: 傲霜庵 | F1819: 第1版
C1820: 陕局凶yan益炙 | D1820: 论说 | E1820: 傲霜庵 | F1820: 第1版
A1821: =COUNTA($B$2:B1821) -> 1687 | B1821: 13542. | C1821: 鸦片零售与保健 | D1821: 短评 | E1821: 匿名 | F1821: 第1版
C1822: 市联协会之声色 | D1822: 短评 | E1822: 匿名 | F1822: 第1版
A1823: =COUNTA($B$2:B1823) -> 1689 | B1823: 13543. | C1823: 关于中非航线之商榷 | D1823: 时论 | E1823: 梦蕉---转录《新闻报》 | F1823: 第1版
A1824: =COUNTA($B$2:B1824) -> 1690 | B1824: 13544. | C1824: 会议以后之希望 | D1824: 论说 | E1824: 傲霜庵 | F1824: 第1版
C1825: 俄党国之很奇怪 | D1825: 论说 | E1825: 傲霜庵 | F1825: 第1版
A1826: =COUNTA($B$2:B1826) -> 1692 | B1826: 13545. | C1826: 德意谈话结束后之欧局 | D1826: 时论 | E1826: 石龍 | F1826: 第1版
A1827: =COUNTA($B$2:B1827) -> 1693 | B1827: 13546. | C1827: 军扩财政的新姿态 | D1827: 时论 | E1827: 匿名 | F1827: 第1版
A1828: =COUNTA($B$2:B1828) -> 1694 | B1828: 13548. | C1828: 林内阁成立在即 | D1828: 论说 | E1828: 傲霜庵 | F1828: 第1版
C1829: 为山间农民请命 | D1829: 论说 | E1829: 傲霜庵 | F1829: 第1版
A1830: =COUNTA($B$2:B1830) -> 1696 | B1830: 13549. | C1830: 励中小学生 | D1830: 论说 | E1830: 匿名 | F1830: 第1版
A1831: =COUNTA($B$2:B1831) -> 1697 | B1831: 13550. | C1831: 祝林内阁成立 | D1831: 论说 | E1831: 傲霜庵 | F1831: 第1版
C1832: 满洲国与美术 | D1832: 论说 | E1832: 傲霜庵 | F1832: 第1版
A1833: =COUNTA($B$2:B1833) -> 1699 | B1833: 13551. | C1833: 西方语文与中国教育（上） | D1833: 时论 | E1833: 匿名 | F1833: 第1版
A1834: =COUNTA($B$2:B1834) -> 1700 | B1834: 13552. | C1834: 西方语文与中国教育（下） | D1834: 时论 | E1834: 匿名 | F1834: 第1版
A1835: =COUNTA($B$2:B1835) -> 1701 | B1835: 13553. | C1835: 旧日东北要人 | D1835: 论说 | E1835: 傲霜庵 | F1835: 第1版
C1836: 嗜杀之党魁斯达林 | D1836: 论说 | E1836: 傲霜庵 | F1836: 第1版
A1837: =COUNTA($B$2:B1837) -> 1703 | B1837: 13555. | C1837: 评“统一救国” | D1837: 论说 | E1837: 傲霜庵 | F1837: 第1版
C1838: 年关之与惨案 | D1838: 论说 | E1838: 傲霜庵 | F1838: 第1版
A1839: =COUNTA($B$2:B1839) -> 1705 | B1839: 13556. | C1839: 改革旧习惯之不易 | D1839: 论说 | E1839: 匿名 | F1839: 第1版
A1840: =COUNTA($B$2:B1840) -> 1706 | B1840: 13560. | C1840: 书希特勒演词后 | D1840: 时论 | E1840: *蓀 | F1840: 第1版
A1841: =COUNTA($B$2:B1841) -> 1707 | B1841: 13562. | C1841: 论安东戏院惨事 | D1841: 论说 | E1841: 傲霜庵 | F1841: 第1版
A1842: =COUNTA($B$2:B1842) -> 1708 | B1842: 13563. | C1842: 再论安东戏院惨事 | D1842: 论说 | E1842: 傲霜庵 | F1842: 第1版
A1843: =COUNTA($B$2:B1843) -> 1709 | B1843: 13564. | C1843: 废除长袍马褂 | D1843: 时论 | E1843: 天羽 | F1843: 第1版
A1844: =COUNTA($B$2:B1844) -> 1710 | B1844: 13565. | C1844: 三论安东戏院惨事 | D1844: 论说 | E1844: 丐 | F1844: 第1版
A1845: =COUNTA($B$2:B1845) -> 1711 | B1845: 13566. | C1845: 世界扩军不已 | D1845: 论说 | E1845: 傲霜庵 | F1845: 第1版
C1846: 三中全会开幕 | D1846: 论说 | E1846: 傲霜庵 | F1846: 第1版
A1847: =COUNTA($B$2:B1847) -> 1713 | B1847: 13567. | C1847: 礼俗宜革说 | D1847: 论说 | E1847: 丐 | F1847: 第1版
A1848: =COUNTA($B$2:B1848) -> 1714 | B1848: 13571. | C1848: 论学生会考问题（上） | D1848: 时论 | E1848: 吴世昌 | F1848: 第1版
A1849: =COUNTA($B$2:B1849) -> 1715 | B1849: 13572. | C1849: 论学生会考问题（下） | D1849: 时论 | E1849: 吴世昌 | F1849: 第1版
A1850: =COUNTA($B$2:B1850) -> 1716 | B1850: 13573. | C1850: 国际航空的新进展 | D1850: 时论 | E1850: 星---转录《申报》 | F1850: 第1版
A1851: =COUNTA($B$2:B1851) -> 1717 | B1851: 13574. | C1851: 世界景气恢复的透视 | D1851: 时论 | E1851: 孙 | F1851: 第1版
A1852: =COUNTA($B$2:B1852) -> 1718 | B1852: 13577. | C1852: 可亲之王道 | D1852: 论说 | E1852: 傲霜庵 | F1852: 第1版
C1853: 中国刘*隐案 | D1853: 论说 | E1853: 傲霜庵 | F1853: 第1版
A1854: =COUNTA($B$2:B1854) -> 1720 | B1854: 13578. | C1854: 论美国之司法改革 | D1854: 时论 | E1854: 星 | F1854: 第1版
A1855: =COUNTA($B$2:B1855) -> 1721 | B1855: 13579. | C1855: 德国四年计划与对外关系 | D1855: 时论 | E1855: 匿名 | F1855: 第1版
A1856: =COUNTA($B$2:B1856) -> 1722 | B1856: 13580. | C1856: 德奥关系与东欧问题 | D1856: 时论 | E1856: 匿名 | F1856: 第1版
A1857: =COUNTA($B$2:B1857) -> 1723 | B1857: 13581. | C1857: 中国集中人材问题 | D1857: 时论 | E1857: 公龙---转录《时事新报》 | F1857: 第1版
A1858: =COUNTA($B$2:B1858) -> 1724 | B1858: 13583. | C1858: 朱培德逝世与中医案 | D1858: 时论 | E1858: 公弼---转录《时事新报》 | F1858: 第1版
A1859: =COUNTA($B$2:B1859) -> 1725 | B1859: 13584. | C1859: 北平贫民的救济 | D1859: 时论 | E1859: 文---转录《北平晨报》 | F1859: 第1版
A1860: =COUNTA($B$2:B1860) -> 1726 | B1860: 13585. | C1860: 西班牙内战之将来 | D1860: 时论 | E1860: 转录天津《大公报》 | F1860: 第1版
A1861: =COUNTA($B$2:B1861) -> 1727 | B1861: 13586. | C1861: 中国不统一之纠正 | D1861: 时论 | E1861: 公弼---转录《新闻报》 | F1861: 第1版
A1862: =COUNTA($B$2:B1862) -> 1728 | B1862: 13587. | C1862: 中日外交有转机 | D1862: 论说 | E1862: 匿名 | F1862: 第1版
C1863: 语言之重要性 | D1863: 论说 | E1863: 匿名 | F1863: 第1版
A1864: =COUNTA($B$2:B1864) -> 1730 | B1864: 13588. | C1864: 中华民国的名词 | D1864: 论说 | E1864: 傲霜庵 | F1864: 第1版
C1865: 反宗教运动尾声 | D1865: 论说 | E1865: 傲霜庵 | F1865: 第1版
A1866: =COUNTA($B$2:B1866) -> 1732 | B1866: 13591. | C1866: 当前中国财政问题 | D1866: 时论 | E1866: 伯---转录《北平晨报》 | F1866: 第1版
A1867: =COUNTA($B$2:B1867) -> 1733 | B1867: 13592. | C1867: 没有法子 | D1867: 论说 | E1867: 匿名 | F1867: 第1版
A1868: =COUNTA($B$2:B1868) -> 1734 | B1868: 13593. | C1868: 法国最近财政整理之教训 | D1868: 时论 | E1868: 转录天津《大公报》 | F1868: 第1版
A1869: =COUNTA($B$2:B1869) -> 1735 | B1869: 13594. | C1869: 满洲最初之水利电气 | D1869: 论说 | E1869: 傲霜庵 | F1869: 第1版
A1870: =COUNTA($B$2:B1870) -> 1736 | B1870: 13595. | C1870: 钢铁行市暴涨 | D1870: 短评 | E1870: 傲霜庵 | F1870: 第1版
C1871: 得美诟骂剧正酣 | D1871: 短评 | E1871: 傲霜庵 | F1871: 第1版
C1872: 四月二十七日 | D1872: 短评 | E1872: 傲霜庵 | F1872: 第1版
A1873: =COUNTA($B$2:B1873) -> 1739 | B1873: 13597. | C1873: 国际原料会议 | D1873: 时评 | E1873: 转录天津《大公报》 | F1873: 第1版
A1874: =COUNTA($B$2:B1874) -> 1740 | B1874: 13598. | C1874: 春令与清洁 | D1874: 短评 | E1874: 傲霜庵 | F1874: 第1版
C1875: 商人之堕落 | D1875: 短评 | E1875: 傲霜庵 | F1875: 第1版
C1876: 恶习当知戒除 | D1876: 短评 | E1876: 傲霜庵 | F1876: 第1版
A1877: =COUNTA($B$2:B1877) -> 1743 | B1877: 13599. | C1877: 日本勿上英美当 | D1877: 论说 | E1877: 傲霜庵 | F1877: 第1版
C1878: 西乱仍然如故 | D1878: 论说 | E1878: 傲霜庵 | F1878: 第1版
A1879: =COUNTA($B$2:B1879) -> 1745 | B1879: 13600. | C1879: 对协和会之希望 | D1879: 论说 | E1879: 傲霜庵 | F1879: 第1版
C1880: 国家社会均进步 | D1880: 论说 | E1880: 傲霜庵 | F1880: 第1版
A1881: =COUNTA($B$2:B1881) -> 1747 | B1881: 13601. | C1881: 西北铁道于今日之关系 | D1881: 时论 | E1881: 梦蕉---转录《新闻报》 | F1881: 第1版
A1882: =COUNTA($B$2:B1882) -> 1748 | B1882: 13602. | C1882: 评所谓中俄密约 | D1882: 论说 | E1882: 傲霜庵 | F1882: 第1版
C1883: 航空与欧林匹克 | D1883: 论说 | E1883: 傲霜庵 | F1883: 第1版
A1884: =COUNTA($B$2:B1884) -> 1750 | B1884: 13604. | C1884: 意相北非之行与英国 | D1884: 时论 | E1884: 辅 | F1884: 第1版
A1885: =COUNTA($B$2:B1885) -> 1751 | B1885: 13605. | C1885: 所望与民生振兴会 | D1885: 论说 | E1885: 匿名 | F1885: 第1版
A1886: =COUNTA($B$2:B1886) -> 1752 | B1886: 13606. | C1886: 华北恐成沙漠 | D1886: 短评 | E1886: 儒丐 | F1886: 第1版
C1887: 棋在日本 | D1887: 短评 | E1887: 儒丐 | F1887: 第1版
A1888: =COUNTA($B$2:B1888) -> 1754 | B1888: 13607. | C1888: 中国经济建设的根本 | D1888: 时论 | E1888: 连士升 | F1888: 第1版
A1889: =COUNTA($B$2:B1889) -> 1755 | B1889: 13608. | C1889: 比利时中立问题 | D1889: 时论 | E1889: 远村 | F1889: 第1版
A1890: =COUNTA($B$2:B1890) -> 1756 | B1890: 13609. | C1890: 学优则仕，仕优则学---对中国林主席在鄂演讲的感想 | D1890: 时论 | E1890: 匿名 | F1890: 第1版
A1891: =COUNTA($B$2:B1891) -> 1757 | B1891: 13611. | C1891: 中国旧道德与政治道德 | D1891: 时论 | E1891: 张东荪 | F1891: 第1版
A1892: =COUNTA($B$2:B1892) -> 1758 | B1892: 13612. | C1892: 暂做五五分之邮票 | D1892: 短评 | E1892: 匿名 | F1892: 第1版
C1893: 不幸之人力车夫 | D1893: 短评 | E1893: 匿名 | F1893: 第1版
A1894: =COUNTA($B$2:B1894) -> 1760 | B1894: 13613. | C1894: 中国思想的危险（上） | D1894: 时论 | E1894: 朱光潜 | F1894: 第1版
A1895: =COUNTA($B$2:B1895) -> 1761 | B1895: 13614. | C1895: 中国思想的危险（下） | D1895: 时论 | E1895: 朱光潜 | F1895: 第1版
A1896: =COUNTA($B$2:B1896) -> 1762 | B1896: 13615. | C1896: 意南协定的影响 | D1896: 时论 | E1896: 隅 | F1896: 第1版
A1897: =COUNTA($B$2:B1897) -> 1763 | B1897: 13616. | C1897: 谈耕者有其田 | D1897: 时论 | E1897: 转录天津《益世報》 | F1897: 第1版
A1898: =COUNTA($B$2:B1898) -> 1764 | B1898: 13618. | C1898: 美国国际关系的展望 | D1898: 时论 | E1898: 匿名 | F1898: 第1版
A1899: =COUNTA($B$2:B1899) -> 1765 | B1899: 13619. | C1899: 改善生活运动 | D1899: 短评 | E1899: 匿名 | F1899: 第1版
C1900: 市民极宜防火 | D1900: 短评 | E1900: 匿名 | F1900: 第1版
A1901: =COUNTA($B$2:B1901) -> 1767 | B1901: 13620. | C1901: 评中国内政部体制乐典之争 | D1901: 时论 | E1901: 转录天津《大公报》 | F1901: 第1版
A1902: =COUNTA($B$2:B1902) -> 1768 | B1902: 13621. | C1902: 中国复兴农村根本问题（上） | D1902: 时论 | E1902: 赫---转录《晨报》 | F1902: 第1版
A1903: =COUNTA($B$2:B1903) -> 1769 | B1903: 13622. | C1903: 中国复兴农村根本问题（下） | D1903: 时论 | E1903: 赫---转录《晨报》 | F1903: 第1版
A1904: =COUNTA($B$2:B1904) -> 1770 | B1904: 13623. | C1904: 军缩会议能再开乎？ | D1904: 时论 | E1904: 赫---转录《晨报》 | F1904: 第1版
A1905: =COUNTA($B$2:B1905) -> 1771 | B1905: 13625. | C1905: 苗民为中国心腹之患 | D1905: 时论 | E1905: 梦蕉 | F1905: 第1版
A1906: =COUNTA($B$2:B1906) -> 1772 | B1906: 13626. | C1906: 应救济农村之春耕 | D1906: 论说 | E1906: 匿名 | F1906: 第1版
A1907: =COUNTA($B$2:B1907) -> 1773 | B1907: 13627. | C1907: 改良司法与改良狱政 | D1907: 时论 | E1907: 转录天津《益世報》 | F1907: 第1版
A1908: =COUNTA($B$2:B1908) -> 1774 | B1908: 13628. | C1908: 比国补缺选举与内政外交 | D1908: 时论 | E1908: 辅---转录《申报》 | F1908: 第1版
A1909: =COUNTA($B$2:B1909) -> 1775 | B1909: 13629. | C1909: 中国治乱之紧要关头 | D1909: 时论 | E1909: 转录天津《大公报》 | F1909: 第1版
A1910: =COUNTA($B$2:B1910) -> 1776 | B1910: 13630. | C1910: 中国试行强迫入学 | D1910: 时论 | E1910: 都---转录《申报》 | F1910: 第1版
A1911: =COUNTA($B$2:B1911) -> 1777 | B1911: 13632. | C1911: 科学化与科学精神（上） | D1911: 时论 | E1911: 徐旭生 | F1911: 第1版
A1912: =COUNTA($B$2:B1912) -> 1778 | B1912: 13633. | C1912: 科学化与科学精神（下） | D1912: 时论 | E1912: 徐旭生 | F1912: 第1版
A1913: =COUNTA($B$2:B1913) -> 1779 | B1913: 13634. | C1913: 物价与劳资生活 | D1913: 论说 | E1913: 匿名 | F1913: 第1版
A1914: =COUNTA($B$2:B1914) -> 1780 | B1914: 13636. | C1914: 德国路线是否改变 | D1914: 论说 | E1914: 转录《实事新闻》 | F1914: 第1版
A1915: =COUNTA($B$2:B1915) -> 1781 | B1915: 13637. | C1915: 对于川灾的感想 | D1915: 时论 | E1915: 都---转录《申报》 | F1915: 第1版
A1916: =COUNTA($B$2:B1916) -> 1782 | B1916: 13639. | C1916: 西班牙现状与欧洲局势 | D1916: 时论 | E1916: 赫 | F1916: 第1版
A1917: =COUNTA($B$2:B1917) -> 1783 | B1917: 13640. | C1917: 江西归来（上） | D1917: 时论 | E1917: 黃炎培 | F1917: 第1版
A1918: =COUNTA($B$2:B1918) -> 1784 | B1918: 13641. | C1918: 江西归来（下） | D1918: 时论 | E1918: 黃炎培 | F1918: 第1版
A1919: =COUNTA($B$2:B1919) -> 1785 | B1919: 13642. | C1919: 评新学制 | D1919: 论说 | E1919: 傲霜庵 | F1919: 第1版
A1920: =COUNTA($B$2:B1920) -> 1786 | B1920: 13643. | C1920: 最近之日本政局 | D1920: 短评 | E1920: 傲霜庵 | F1920: 第1版
C1921: 郑老与王道书院 | D1921: 短评 | E1921: 傲霜庵 | F1921: 第1版
C1922: 政府要路更勤 | D1922: 短评 | E1922: 傲霜庵 | F1922: 第1版
A1923: =COUNTA($B$2:B1923) -> 1789 | B1923: 13644. | C1923: 行政机构之大改革 | D1923: 论说 | E1923: 傲霜庵 | F1923: 第1版
A1924: =COUNTA($B$2:B1924) -> 1790 | B1924: 13646. | C1924: 比国拒绝军事合作与中立之关系 | D1924: 时论 | E1924: *蓀---转录《申报》 | F1924: 第1版
A1925: =COUNTA($B$2:B1925) -> 1791 | B1925: 13647. | C1925: 检查清洁与街市净化 | D1925: 论说 | E1925: 匿名 | F1925: 第1版
A1926: =COUNTA($B$2:B1926) -> 1792 | B1926: 13648. | C1926: 社会教育 | D1926: 短评 | E1926: 丐 | F1926: 第1版
C1927: 假死状态 | D1927: 短评 | E1927: 丐 | F1927: 第1版
C1928: 才子过时 | D1928: 短评 | E1928: 丐 | F1928: 第1版
A1929: =COUNTA($B$2:B1929) -> 1795 | B1929: 13649. | C1929: 枪毙麻疯病人 | D1929: 时论 | E1929: 允海 | F1929: 第1版
A1930: =COUNTA($B$2:B1930) -> 1796 | B1930: 13650. | C1930: 新闻绝交之儿媳 | D1930: 短评 | E1930: 傲霜庵 | F1930: 第1版
C1931: 满德协定将继续 | D1931: 短评 | E1931: 傲霜庵 | F1931: 第1版
C1932: 举办缅羊牧场 | D1932: 短评 | E1932: 傲霜庵 | F1932: 第1版
A1933: =COUNTA($B$2:B1933) -> 1799 | B1933: 13651. | C1933: 日英对华合作 | D1933: 论说 | E1933: 傲霜庵 | F1933: 第1版
C1934: 东京与新京天津 | D1934: 论说 | E1934: 傲霜庵 | F1934: 第1版
A1935: =COUNTA($B$2:B1935) -> 1801 | B1935: 13653. | C1935: 中国食监增税之感想 | D1935: 时论 | E1935: 治---转录《北平晨报》 | F1935: 第1版
A1936: =COUNTA($B$2:B1936) -> 1802 | B1936: 13654. | C1936: 以威止病 | D1936: 短评 | E1936: 丐 | F1936: 第1版
C1937: 导民奢侈 | D1937: 短评 | E1937: 丐 | F1937: 第1版
A1938: =COUNTA($B$2:B1938) -> 1804 | B1938: 13655. | C1938: 取缔交通 | D1938: 短评 | E1938: 匿名（懷疑是丐） | F1938: 第1版
C1939: 千山大火 | D1939: 短评 | E1939: 匿名（懷疑是丐） | F1939: 第1版
C1940: 冒充欺诈 | D1940: 短评 | E1940: 匿名（懷疑是丐） | F1940: 第1版
A1941: =COUNTA($B$2:B1941) -> 1807 | B1941: 13656. | C1941: 旧东北派之末路 | D1941: 论说 | E1941: 傲霜庵 | F1941: 第1版
C1942: 春徂夏来 | D1942: 论说 | E1942: 傲霜庵 | F1942: 第1版
A1943: =COUNTA($B$2:B1943) -> 1809 | B1943: 13657. | C1943: 中国与边疆脱难 | D1943: 论说 | E1943: 傲霜庵 | F1943: 第1版
C1944: 用刀又吃中国菜 | D1944: 论说 | E1944: 傲霜庵 | F1944: 第1版
A1945: =COUNTA($B$2:B1945) -> 1811 | B1945: 13658. | C1945: 工潮感言 | D1945: 时论 | E1945: 转录《北平晨报》 | F1945: 第1版
A1946: =COUNTA($B$2:B1946) -> 1812 | B1946: 13660. | C1946: 日本神风号凯旋 | D1946: 论说 | E1946: 傲霜庵 | F1946: 第1版
A1947: =COUNTA($B$2:B1947) -> 1813 | B1947: 13661. | C1947: 小学校禁用体罚 | D1947: 论说 | E1947: 匿名 | F1947: 第1版
A1948: =COUNTA($B$2:B1948) -> 1814 | B1948: 13662. | C1948: 东京太平洋会议 | D1948: 论说 | E1948: 傲霜庵 | F1948: 第1版
C1949: 洛翁与马相伯 | D1949: 论说 | E1949: 傲霜庵 | F1949: 第1版
A1950: =COUNTA($B$2:B1950) -> 1816 | B1950: 13663. | C1950: 德蕾机再接再厉 | D1950: 短评 | E1950: 傲霜庵 | F1950: 第1版
C1951: 苏俄北极根据地 | D1951: 短评 | E1951: 傲霜庵 | F1951: 第1版
C1952: 可怜的学生团 | D1952: 短评 | E1952: 傲霜庵 | F1952: 第1版
A1953: =COUNTA($B$2:B1953) -> 1819 | B1953: 13664. | C1953: 以留声机取供 | D1953: 时论 | E1953: 洪法---转录《申报》 | F1953: 第1版
A1954: =COUNTA($B$2:B1954) -> 1820 | B1954: 13665. | C1954: 欧洲两大轴心之厨法 | D1954: 时论 | E1954: 匿名 | F1954: 第1版
A1955: =COUNTA($B$2:B1955) -> 1821 | B1955: 13667. | C1955: 中国民治与割据 | D1955: 时论 | E1955: 陶希圣---转录天津《大公报》 | F1955: 第1版
A1956: =COUNTA($B$2:B1956) -> 1822 | B1956: 13668. | C1956: 论四川赈款横遭？滞 | D1956: 时论 | E1956: 都---转录《申报》 | F1956: 第1版
A1957: =COUNTA($B$2:B1957) -> 1823 | B1957: 13669. | C1957: 近衙公奉命组阁 | D1957: 论说 | E1957: 傲霜庵 | F1957: 第1版
C1958: 两京开始直飞 | D1958: 论说 | E1958: 傲霜庵 | F1958: 第1版
A1959: =COUNTA($B$2:B1959) -> 1825 | B1959: 13670. | C1959: 莫名其妙之巧取 | D1959: 短评 | E1959: 傲霜庵 | F1959: 第1版
C1960: 西洋战事更恶化 | D1960: 短评 | E1960: 傲霜庵 | F1960: 第1版
C1961: 文撒公今日结婚 | D1961: 短评 | E1961: 傲霜庵 | F1961: 第1版
A1962: =COUNTA($B$2:B1962) -> 1828 | B1962: 13671. | C1962: 英帝国会议前途的暗礁 | D1962: 时评 | E1962: 雨崑---转录《新闻报》 | F1962: 第1版
A1963: =COUNTA($B$2:B1963) -> 1829 | B1963: 13672. | C1963: 中国应厉行？洫之制 | D1963: 时论 | E1963: 李协---转录天津《大公报》 | F1963: 第1版
A1964: =COUNTA($B$2:B1964) -> 1830 | B1964: 13674. | C1964: 中国新监法 | D1964: 时论 | E1964: 转录天津《益世報》 | F1964: 第1版
A1965: =COUNTA($B$2:B1965) -> 1831 | B1965: 13675. | C1965: 端阳节近之商业 | D1965: 短评 | E1965: 匿名 | F1965: 第1版
C1966: 村长与不自爱 | D1966: 短评 | E1966: 匿名 | F1966: 第1版
C1967: 盗墓与活埋其母 | D1967: 短评 | E1967: 匿名 | F1967: 第1版
A1968: =COUNTA($B$2:B1968) -> 1834 | B1968: 13676. | C1968: 西班牙和平运动之检讨 | D1968: 时论 | E1968: 石龍 | F1968: 第1版
A1969: =COUNTA($B$2:B1969) -> 1835 | B1969: 13677. | C1969: 超空飞行之研究 | D1969: 论说 | E1969: 傲霜庵 | F1969: 第1版
C1970: 铁肺过神户东渡 | D1970: 论说 | E1970: 傲霜庵 | F1970: 第1版
A1971: =COUNTA($B$2:B1971) -> 1837 | B1971: 13678. | C1971: 豫皖苏整军会议后之一些感想 | D1971: 时论 | E1971: 梦蕉---转录《新闻报》 | F1971: 第1版
A1972: =COUNTA($B$2:B1972) -> 1838 | B1972: 13679. | C1972: 地方机构之改革 | D1972: 短评 | E1972: 傲霜庵 | F1972: 第1版
C1973: 军党竞争时代 | D1973: 短评 | E1973: 傲霜庵 | F1973: 第1版
C1974: 富翁遗产无几 | D1974: 短评 | E1974: 傲霜庵 | F1974: 第1版
A1975: =COUNTA($B$2:B1975) -> 1841 | B1975: 13681. | C1975: 世界经济的最近趋向 | D1975: 时论 | E1975: 转录《北平晨报》 | F1975: 第1版
A1976: =COUNTA($B$2:B1976) -> 1842 | B1976: 13682. | C1976: 赤军八将尽授首 | D1976: 论说 | E1976: 傲霜庵 | F1976: 第1版
C1977: 满洲亦竟有地震 | D1977: 论说 | E1977: 傲霜庵 | F1977: 第1版
A1978: =COUNTA($B$2:B1978) -> 1844 | B1978: 13683. | C1978: 中国之高等教育问题（上） | D1978: 时论 | E1978: 张纯明 | F1978: 第1版
A1979: =COUNTA($B$2:B1979) -> 1845 | B1979: 13684. | C1979: 中国之高等教育问题（下） | D1979: 时论 | E1979: 张纯明 | F1979: 第1版
A1980: =COUNTA($B$2:B1980) -> 1846 | B1980: 13685. | C1980: 西班牙问题之新阶段 | D1980: 时论 | E1980: 转录《时事新报》 | F1980: 第1版
A1981: =COUNTA($B$2:B1981) -> 1847 | B1981: 13686. | C1981: 咄咄冒充检查行抢 | D1981: 论说 | E1981: 匿名 | F1981: 第1版
A1982: =COUNTA($B$2:B1982) -> 1848 | B1982: 13688. | C1982: 最近伦敦金价暴涨暴落之谜 | D1982: 时论 | E1982: 匿名 | F1982: 第1版
A1983: =COUNTA($B$2:B1983) -> 1849 | B1983: 13689. | C1983: 论卫生即所以保健 | D1983: 时论 | E1983: 匿名 | F1983: 第1版
A1984: =COUNTA($B$2:B1984) -> 1850 | B1984: 13690. | C1984: 取缔中国官吏投机 | D1984: 时论 | E1984: 转录天津《益世報》 | F1984: 第1版
A1985: =COUNTA($B$2:B1985) -> 1851 | B1985: 13691. | C1985: 人才与资本宜速返农村 | D1985: 时论 | E1985: 转录《北平晨报》 | F1985: 第1版
A1986: =COUNTA($B$2:B1986) -> 1852 | B1986: 13692. | C1986: 中国怎样集中人才？ | D1986: 时论 | E1986: 转录天津《益世報》 | F1986: 第1版
A1987: =COUNTA($B$2:B1987) -> 1853 | B1987: 13693. | C1987: 法国内阁更迭 | D1987: 时论 | E1987: 匿名 | F1987: 第1版
A1988: =COUNTA($B$2:B1988) -> 1854 | B1988: 13695. | C1988: 欧洲又告急 | D1988: 论说 | E1988: 傲霜庵 | F1988: 第1版
A1989: =COUNTA($B$2:B1989) -> 1855 | B1989: 13696. | C1989: 街头绅士休矣 | D1989: 论说 | E1989: 匿名 | F1989: 第1版
A1990: =COUNTA($B$2:B1990) -> 1856 | B1990: 13697. | C1990: 南京政府之庐山茗叙 | D1990: 时论 | E1990: 转录天津《益世報》 | F1990: 第1版
A1991: =COUNTA($B$2:B1991) -> 1857 | B1991: 13698. | C1991: 论国境纷争 | D1991: 论说 | E1991: 傲霜庵 | F1991: 第1版
A1992: =COUNTA($B$2:B1992) -> 1858 | B1992: 13699. | C1992: 再论国境纷争 | D1992: 论说 | E1992: 傲霜庵 | F1992: 第1版
C1993: 殖民地果无价值？ | D1993: 论说 | E1993: 傲霜庵 | F1993: 第1版
A1994: =COUNTA($B$2:B1994) -> 1860 | B1994: 13700. | C1994: 翻译事业与中国文化 | D1994: 时论 | E1994: 转录《北平晨报》 | F1994: 第1版
A1995: =COUNTA($B$2:B1995) -> 1861 | B1995: 13702. | C1995: 中国手工艺展览会 | D1995: 时论 | E1995: 转录天津《大公报》 | F1995: 第1版
A1996: =COUNTA($B$2:B1996) -> 1862 | B1996: 13703. | C1996: 青纱帐起与城市治安 | D1996: 论说 | E1996: 匿名 | F1996: 第1版
A1997: =COUNTA($B$2:B1997) -> 1863 | B1997: 13704. | C1997: 不容忽视之中国防水工作 | D1997: 时论 | E1997: 转录《申报》 | F1997: 第1版
A1998: =COUNTA($B$2:B1998) -> 1864 | B1998: 13705. | C1998: 中国救灾的根本办法在解决人口过剩 | D1998: 时论 | E1998: 转录《北平晨报》 | F1998: 第1版
A1999: =COUNTA($B$2:B1999) -> 1865 | B1999: 13706. | C1999: 美国工潮（上） | D1999: 时论 | E1999: 转录天津《大公报》 | F1999: 第1版
A2000: =COUNTA($B$2:B2000) -> 1866 | B2000: 13707. | C2000: 美国工潮（下） | D2000: 时论 | E2000: 转录天津《大公报》 | F2000: 第1版

A1: 期数 | B1: 时间 | C1: 言论题目 | D1: 言论体裁 | E1: 作者 | F1: 版面位置
A2: 1 | B2: 12114. | C2: 建国纪念与本报刷新 | D2: 社说 | E2: 则 | F2: 第1版
A3: 2 | B3: 12117. | C3: 满洲国过去及将来 | D3: 社说 | E3: 新我 | F3: 第2版
A4: 3 | B4: 12118. | C4: 热河人民欢庆更生 | D4: 时评 | E4: 匿名 | F4: 第2版
A5: 4 | B5: 12120. | C5: 贺征热河成功 | D5: 说论 | E5: 新 | F5: 第2版
A6: 5 | B6: 12121. | C6: 大同解 | D6: 社说 | E6: 则 | F6: 第2版
A7: 6 | B7: 12122. | C7: 大同解（续前） | D7: 社说 | E7: 则 | F7: 第2版
A8: 7 | B8: 12123. | C8: 大同解（续前） | D8: 社说 | E8: 则 | F8: 第2版
A9: 8 | B9: 12124. | C9: 国联承认与否毫无障碍 | D9: 社说 | E9: 新 | F9: 第2版
A10: 9 | B10: 12125. | C10: 中国外交之错误 | D10: 社说 | E10: 新 | F10: 第2版
A11: 10 | B11: 12126. | C11: 中国外交之错误（续前） | D11: 社说 | E11: 新 | F11: 第2版
A12: 11 | B12: 12128. | C12: 华北政局改 变后之推测 | D12: 社说 | E12: 新 | F12: 第2版
A13: 12 | B13: 12130. | C13: 怪哉中国之伪宣传 | D13: 社说 | E13: 新 | F13: 第2版
A14: 13 | B14: 12131. | C14: 论蒋介石 宜速觉悟 | D14: 社说 | E14: 新 | F14: 第2版
A15: 14 | B15: 12132. | C15: 日本退出国联之真义 | D15: 社说 | E15: 新 | F15: 第2版
A16: 15 | B16: 12133. | C16: 王道政治惠及热河 | D16: 时评 | E16: 新 | F16: 第2版
A17: 16 | B17: 12134. | C17: 论全满铁路 委托满铁经营 | D17: 社说 | E17: 新 | F17: 第2版
A18: 17 | B18: 12135. | C18: 旌表孝子节妇感言 | D18: 社说 | E18: 新 | F18: 第2版
A19: 18 | B19: 12136. | C19: 教员待遇与欠薪 | D19: 社说 | E19: 老彭 | F19: 第2版
A20: 19 | B20: 12137. | C20: 蝙蝠式苏俄之外交政策 | D20: 社说 | E20: 新 | F20: 第2版
A21: 20 | B21: 12138. | C21: 汤玉麟死灰难复燃 | D21: 时评 | E21: 新 | F21: 第2版
A22: 21 | B22: 12139. | C22: 汪蒋暗潮与华北大局 | D22: 社说 | E22: 新 | F22: 第2版
A23: 22 | B23: 12141. | C23: 日俄不侵条约 前途乐观 | D23: 社说 | E23: 新 | F23: 第2版
A24: 23 | B24: 12143. | C24: 日本退出国联后面面观 | D24: 社说 | E24: 新 | F24: 第2版
A25: 24 | B25: 12144. | C25: 王道政治浅说 | D25: 社说 | E25: 则 | F25: 第2版
A26: 25 | B26: 12146. | C26: 满蒙将为黄金世界 | D26: 社说 | E26: 新 | F26: 第2版
A27: 26 | B27: 12149. | C27: 蒙玉一行来京感言 | D27: 社说 | E27: 无法确定（字迹不清） | F27: 第2版
A28: 27 | B28: 12150. | C28: 对振德妇女协会感言 | D28: 社说 | E28: 新 | F28: 第2版
A29: 28 | B29: 12152. | C29: 小学生账捐与满日协和 | D29: 社说 | E29: 新 | F29: 第2版
A30: 29 | B30: 12155. | C30: 满俄外交之前途 | D30: 社说 | E30: 新 | F30: 第2版
A31: 30 | B31: 12157. | C31: 论我国越长城线进兵 自保救民 必不得已 | D31: 社说 | E31: 则 | F31: 第2版
A32: 31 | B32: 12158. | C32: 满日军进击 关内华军 | D32: 社说 | E32: 新 | F32: 第2版
A33: 32 | B33: 12159. | C33: 满俄运输纷争之推测 | D33: 社说 | E33: 新 | F33: 第2版
A34: 33 | B34: 12162. | C34: 满洲国成立 之前因后果 | D34: 社说 | E34: 匿名 | F34: 第2版
A35: 34 | B35: 12163. | C35: 满洲国成立之前因后果（续） | D35: 社说 | E35: 匿名 | F35: 第2版
A36: 35 | B36: 12164. | C36: 满洲国成立之前因后果（续） | D36: 社说 | E36: 匿名 | F36: 第2版
A37: 36 | B37: 12166. | C37: 执政教书书后 根本大亚主义 维持世界和平 | D37: 社说 | E37: 则 | F37: 第2版
A38: 37 | B38: 12167. | C38: 南京又造谣 | D38: 时评 | E38: 新 | F38: 第2版
A39: 38 | B39: 12170. | C39: 中国未来之政局 | D39: 社说 | E39: 新 | F39: 第2版
A40: 39 | B40: 12171. | C40: 华府经济会议与满洲之关系 | D40: 社说 | E40: 新 | F40: 第2版
A41: 40 | B41: 12174. | C41: 振兴农业之急务 | D41: 社说 | E41: 新 | F41: 第2版
A42: 41 | B42: 12176. | C42: 宪法与民意 | D42: 社说 | E42: 新 | F42: 第2版
A43: 42 | B43: 12178. | C43: 丁公使赴任 | D43: 社说 | E43: 新 | F43: 第2版
A44: 43 | B44: 12179. | C44: 论华北人士 宜谋自救 | D44: 社说 | E44: 则 | F44: 第2版
A45: 44 | B45: 12181. | C45: 论整饬钱业 | D45: 社说 | E45: 新 | F45: 第2版
A46: 45 | B46: 12183. | C46: 黄郛长政委 会后之华北 | D46: 社说 | E46: 新 | F46: 第2版
A47: 46 | B47: 12189. | C47: 论东铁扣车事件俄方宜速觉悟 | D47: 社说 | E47: 则 | F47: 第2版
A48: 47 | B48: 12190. | C48: 满日军再度进兵栾东 | D48: 社说 | E48: 新 | F48: 第2版
A49: 48 | B49: 12192. | C49: 买收东铁日满两方孰为适宜 | D49: 社说 | E49: 新 | F49: 第2版
A50: 49 | B50: 12194. | C50: 端节表彰孝子节妇感言 | D50: 社说 | E50: 则 | F50: 第2版
A51: 50 | B51: 12198. | C51: 华北民众之心理与大局转变之关系 | D51: 社说 | E51: 新 | F51: 第2版
A52: 51 | B52: 12199. | C52: 斥蓝衣社 | D52: 社说 | E52: 则 | F52: 第2版
A53: 52 | B53: 12201. | C53: 中国危亡在内而不在外 | D53: 社说 | E53: 新 | F53: 第2版
A54: 53 | B54: 12207. | C54: 冯蒋关系恶化与中国未来之大局 | D54: 社说 | E54: 新 | F54: 第2版
A55: 54 | B55: 12208. | C55: 阎冯反蒋与华北政局 | D55: 社说 | E55: 则 | F55: 第2版
A56: 55 | B56: 12212. | C56: 华北和局之前途 | D56: 社说 | E56: 新 | F56: 第2版
A57: 56 | B57: 12214. | C57: 东亚大团结 宜速实现 | D57: 社说 | E57: 新 | F57: 第2版
A58: 57 | B58: 12218. | C58: 矿务会议感言 | D58: 社说 | E58: 新 | F58: 第2版
A59: 58 | B59: 12221. | C59: 肃清胡匪确立治安刍议（上） | D59: 社说 | E59: 新 | F59: 第2版
A60: 59 | B60: 12222. | C60: 肃清胡匪确立治安刍议（下） | D60: 社说 | E60: 新 | F60: 第2版
A61: 60 | B61: 12223. | C61: 第二次建国 运动会感言 | D61: 社说 | E61: 则 | F61: 第2版
A62: 61 | B62: 12225. | C62: 撤废治外法权先决问题 | D62: 社说 | E62: 新 | F62: 第2版
A63: 62 | B63: 12227. | C63: 论今日宜肃清匪患 | D63: 社说 | E63: 则 | F63: 第2版
A64: 63 | B64: 12228. | C64: 北铁交涉必顺利解决 | D64: 社说 | E64: 唐铁佛 | F64: 第2版
A65: 64 | B65: 12230. | C65: 华北和平之前途 | D65: 社说 | E65: 新 | F65: 第2版
A66: 65 | B66: 12232. | C66: 冯玉祥氏之不自量 | D66: 社说 | E66: 铁佛 | F66: 第2版
A67: 66 | B67: 12234. | C67: 官吏服务规程感言 | D67: 社说 | E67: 铁佛 | F67: 第2版
A68: 67 | B68: 12235. | C68: 大亚细亚协和与满日华关系（一） | D68: 社说 | E68: 唐铁佛 | F68: 第2版
A69: 68 | B69: 12236. | C69: 『大亚细亚协和与满日华关系』（二） | D69: 社说 | E69: 唐铁佛 | F69: 第2版
A70: 69 | B70: 12237. | C70: 北铁让渡会议 | D70: 社说 | E70: 唐铁佛 | F70: 第2版
A71: 70 | B71: 12239. | C71: 大亚细亚协和与满日华关系（三） | D71: 社说 | E71: 唐铁佛 | F71: 第2版
A72: 71 | B72: 12240. | C72: 大亚细亚协和与满日华关系（四） | D72: 社说 | E72: 唐铁佛 | F72: 第2版
A73: 72 | B73: 12241. | C73: 大亚细亚协和与满日华关系（五） | D73: 社说 | E73: 唐铁佛 | F73: 第2版
A74: 73 | B74: 12242. | C74: 大亚细亚协和与满日华关系（六） | D74: 社说 | E74: 唐铁佛 | F74: 第2版
A75: 74 | B75: 12244. | C75: 苏联让渡北铁 | D75: 时评 | E75: 新 | F75: 第2版
A76: 75 | B76: 12247. | C76: 冯蒋之迷 | D76: 社说 | E76: 唐铁佛 | F76: 第2版
A77: 76 | B77: 12249. | C77: 坂田大佐之哀荣 | D77: 社说 | E77: 新 | F77: 第2版
A78: 77 | B78: 12250. | C78: 读广东大亚协会吿新国民众书感言 | D78: 社说 | E78: 则 | F78: 第2版
A79: 78 | B79: 12253. | C79: 北铁让渡之私的会谈 | D79: 社说 | E79: 新 | F79: 第2版
A80: 79 | B80: 12255. | C80: 论满华宜协力制冯 | D80: 社说 | E80: 则 | F80: 第2版
A81: 80 | B81: 12262. | C81: 冯玉祥与宋子文 | D81: 社说 | E81: 铁佛 | F81: 第2版
A82: 81 | B82: 12265. | C82: 论远交近攻之谬误 | D82: 社说 | E82: 则 | F82: 第2版
A83: 82 | B83: 12271. | C83: 论中国与联盟合作无异共管 | D83: 社说 | E83: 则 | F83: 第2版
A84: 83 | B84: 12285. | C84: 论满日经济同盟 | D84: 社说 | E84: 则 | F84: 第2版
A85: 84 | B85: 12290. | C85: 菱刈司令官声明书书后 | D85: 社说 | E85: 则 | F85: 第2版
A86: 85 | B86: 12299. | C86: 宋子文返华 与日华关系 | D86: 社说 | E86: 则 | F86: 第2版
A87: 86 | B87: 12306. | C87: 吾人所希望于 庐山会议者 | D87: 社说 | E87: 则 | F87: 第2版
A88: 87 | B88: 12312. | C88: 友邦承认一周纪念书感 | D88: 社说 | E88: 则 | F88: 第2版
A89: 88 | B89: 12318. | C89: 论日华亲善 须先承认满洲国 | D89: 社说 | E89: 则 | F89: 第2版
A90: 89 | B90: 12341. | C90: 论友邦协助滦东剿匪 | D90: 社说 | E90: 则 | F90: 第2版
A91: 90 | B91: 12343. | C91: 孔子圣诞书所感 | D91: 社说 | E91: 则 | F91: 第2版
A92: 91 | B92: 12347. | C92: 德国脱退联盟与时局之关系 | D92: 社说 | E92: 则 | F92: 第2版
A93: 92 | B93: 12357. | C93: 王道救时论 | D93: 社说 | E93: 则 | F93: 第2版
A94: 93 | B94: 12358. | C94: 宋子文辞职原因及影响 | D94: 社说 | E94: 铁佛 | F94: 第2版
A95: 94 | B95: 12361. | C95: 由救济特产滞销 可证善政之真实 | D95: 社说 | E95: 铁佛 | F95: 第2版
A96: 95 | B96: 12363. | C96: 论东洋和平会议有急速成立之必要 | D96: 社说 | E96: 则 | F96: 第2版
A97: 96 | B97: 12365. | C97: 中俄互不侵 | D97: 社说 | E97: 铁佛 | F97: 第2版
A98: 97 | B98: 12369. | C98: 论列国联俄之可危 | D98: 社说 | E98: 则 | F98: 第2版
A99: 98 | B99: 12373. | C99: 中国果又改变政策耶 | D99: 社说 | E99: 则 | F99: 第2版
A100: 99 | B100: 12374. | C100: 蒋氏之末运 | D100: 社说 | E100: 铁佛 | F100: 第2版
A101: 100 | B101: 12377. | C101: 美国复交之前途 | D101: 社说 | E101: 铁佛 | F101: 第2版
A102: 101 | B102: 12379. | C102: 论福建独立运动 | D102: 社说 | E102: 则 | F102: 第2版
A103: 102 | B103: 12381. | C103: 远东风云势将缓和 | D103: 社说 | E103: 铁佛 | F103: 第2版
A104: 103 | B104: 12384. | C104: 张蒋之将来 | D104: 社说 | E104: 铁佛 | F104: 第2版
A105: 104 | B105: 12388. | C105: 日美亲善与东洋和平 | D105: 社说 | E105: 铁佛 | F105: 第2版
A106: 105 | B106: 12390. | C106: 论福建人民政府为中国赤化先声 | D106: 社说 | E106: 则 | F106: 第2版
A107: 106 | B107: 12393. | C107: 毅然减税 | D107: 时评 | E107: 铁佛 | F107: 第2版
C108: 英国造舰 | D108: 时评 | E108: 铁佛 | F108: 第2版
C109: 南京迎胡 | D109: 时评 | E109: 铁佛 | F109: 第2版
A110: 107 | B110: 12397. | C110: 谈谈大亚亚民族联盟 | D110: 社说 | E110: 铁佛 | F110: 第2版
A111: 108 | B111: 12400. | C111: 福建政变之调停说 | D111: 社说 | E111: 铁佛 | F111: 第2版
A112: 109 | B112: 12403. | C112: 国立学校教 职员计划增 薪感言 | D112: 社说 | E112: 则 | F112: 第2版
A113: 110 | B113: 12404. | C113: 德王取消自治条件说 | D113: 社说 | E113: 铁佛 | F113: 第2版
A114: 111 | B114: 12407. | C114: 异哉所谓黄祸者 | D114: 社说 | E114: 则 | F114: 第2版
A115: 112 | B115: 12408. | C115: 日美关系有好转可能 | D115: 时评 | E115: 铁佛 | F115: 第2版
A116: 113 | B116: 12411. | C116: 国联改组说感言 | D116: 社说 | E116: 铁佛 | F116: 第2版
A117: 114 | B117: 12412. | C117: 恭祝 日本皇太子诞生之禧 | D117: 社说 | E117: 铁佛 | F117: 第2版
A118: 115 | B118: 12425. | C118: 大同三年后之急务 | D118: 社说 | E118: 铁佛 | F118: 第2版
A119: 116 | B119: 12429. | C119: 决定根本国是感言 | D119: 社说 | E119: 则 | F119: 第2版
A120: 117 | B120: 12435. | C120: 难民回满感言 | D120: 社说 | E120: 铁佛 | F120: 第2版
A121: 118 | B121: 12437. | C121: 张学良图归华北之不可能 | D121: 社说 | E121: 则 | F121: 第2版
A122: 119 | B122: 12438. | C122: 思想与世界 | D122: 社说 | E122: 铁佛 | F122: 第2版
A123: 120 | B123: 12440. | C123: 天意所在之帝制 | D123: 社说 | E123: 铁佛 | F123: 第8版
A124: 121 | B124: 12441. | C124: 祝帝制实施 | D124: 社说 | E124: 则 | F124: 第2版
A125: 122 | B125: 12444. | C125: 大典与仁政 | D125: 社说 | E125: 铁佛 | F125: 第2版
A126: 123 | B126: 12449. | C126: 四中全会感言 | D126: 社说 | E126: 铁佛 | F126: 第2版
A127: 124 | B127: 12452. | C127: 全亚民族大会开会感言 | D127: 社说 | E127: 则 | F127: 第2版
A128: 125 | B128: 12453. | C128: 王道善政之当前问题（上） | D128: 社说 | E128: 铁佛 | F128: 第2版
A129: 126 | B129: 12454. | C129: 王道善政之当前问题（下） | D129: 社说 | E129: 铁佛 | F129: 第2版
A130: 127 | B130: 12460. | C130: 消灭孙军将 来之影向 | D130: 社说 | E130: 铁佛 | F130: 第2版
A131: 128 | B131: 12461. | C131: 论敬老 | D131: 社说 | E131: 则 | F131: 第2版
A132: 129 | B132: 12471. | C132: 旧历年感想 | D132: 社说 | E132: 新 | F132: 第2版
A133: 130 | B133: 12473. | C133: 大典日救济 难民感言 | D133: 社说 | E133: 则 | F133: 第2版
A134: 131 | B134: 12485. | C134: 帝政实施后感想 | D134: 社说 | E134: 铁佛 | F134: 第2版
A135: 132 | B135: 12488. | C135: 论北铁让渡交涉再开 | D135: 社说 | E135: 铁佛 | F135: 第2版
A136: 133 | B136: 12489. | C136: 帝制实行与承认问题 | D136: 社说 | E136: 则 | F136: 第2版
A137: 134 | B137: 12495. | C137: 丁祭感言（则） | D137: 社说 | E137: 则 | F137: 第2版
A138: 135 | B138: 12498. | C138: 论中国扩张空军 | D138: 社说 | E138: 铁佛 | F138: 第2版
A139: 136 | B139: 12499. | C139: 送郑熙两使东渡序 | D139: 社说 | E139: 则 | F139: 第2版
A140: 137 | B140: 12503. | C140: 蒋氏新生活运动 | D140: 社说 | E140: 铁佛 | F140: 第2版
A141: 138 | B141: 12506. | C141: 新生活与旧生活 | D141: 社说 | E141: 则 | F141: 第2版
A142: 139 | B142: 12510. | C142: 俄军之演习 | D142: 社说 | E142: 铁佛 | F142: 第2版
A143: 140 | B143: 12517. | C143: 黄郛南下与日华问题 | D143: 社说 | E143: 则 | F143: 第2版
A144: 141 | B144: 12519. | C144: 论中国生产建设 | D144: 社说 | E144: 铁佛 | F144: 第2版
A145: 142 | B145: 12521. | C145: 菱刈大使捧呈信任状感言 | D145: 社说 | E145: 铁佛 | F145: 第2版
A146: 143 | B146: 12523. | C146: 欧林比克大会之遗憾 | D146: 社说 | E146: 则 | F146: 第2版
A147: 144 | B147: 12524. | C147: 东亚和平之曙光 | D147: 社说 | E147: 铁佛 | F147: 第2版
A148: 145 | B148: 12529. | C148: 日华关系好转感言（则） | D148: 社说 | E148: 则 | F148: 第2版
A149: 146 | B149: 12530. | C149: 论中国之摩登破坏团 | D149: 社说 | E149: 铁佛 | F149: 第2版
A150: 147 | B150: 12533. | C150: 为满日鲜同胞进一言 | D150: 社说 | E150: 铁佛 | F150: 第2版
A151: 148 | B151: 12535. | C151: 掘墓与考古 | D151: 社说 | E151: 则 | F151: 第2版
A152: 149 | B152: 12536. | C152: 日本体协退出远东大会今其时矣 | D152: 社说 | E152: 铁佛 | F152: 第2版
A153: 150 | B153: 12538. | C153: 欲大同极乐宜尊师重道 | D153: 社说 | E153: 梦仙 | F153: 第2版
A154: 151 | B154: 12539. | C154: 日华亲善应毅然行之 | D154: 社说 | E154: 铁佛 | F154: 第2版
A155: 152 | B155: 12543. | C155: 夏季的卫生 | D155: 社说 | E155: 铁佛 | F155: 第2版
A156: 153 | B156: 12544. | C156: 对华声明之误解 | D156: 社说 | E156: 则 | F156: 第2版
A157: 154 | B157: 12549. | C157: 大阅感言 | D157: 社说 | E157: 则 | F157: 第2版
A158: 155 | B158: 12550. | C158: 观兵式后感言 | D158: 社说 | E158: 铁佛 | F158: 第2版
A159: 156 | B159: 12554. | C159: 可怪之中国外交 | D159: 社说 | E159: 铁佛 | F159: 第2版
A160: 157 | B160: 12556. | C160: 论国立文化院有急于设立之必要 | D160: 社说 | E160: 则 | F160: 第2版
A161: 158 | B161: 12561. | C161: 冯玉祥下山 | D161: 社说 | E161: 铁佛 | F161: 第2版
A162: 159 | B162: 12563. | C162: 萨耳瓦多亦承认我国矣 欧美列邦盍兴乎来 | D162: 社说 | E162: 则 | F162: 第2版
A163: 160 | B163: 12565. | C163: 怪牧师事件感想 | D163: 社说 | E163: 铁佛 | F163: 第2版
A164: 161 | B164: 12570. | C164: （diao)吊东乡元帅 | D164: 社说 | E164: 铁佛 | F164: 第2版
A165: 162 | B165: 12572. | C165: 呜呼军缩会议前途 | D165: 社说 | E165: 则 | F165: 第2版
A166: 163 | B166: 12573. | C166: 整顿警政感言 | D166: 社说 | E166: 铁佛 | F166: 第2版
A167: 164 | B167: 12576. | C167: 秩父宫殿下 莅京欢迎词 | D167: 社说 | E167: 则 | F167: 第2版
A168: 165 | B168: 12578. | C168: 西南服从南京？ | D168: 社说 | E168: 铁佛 | F168: 第2版
A169: 166 | B169: 12580. | C169: 最近两大奇闻 | D169: 社说 | E169: 铁佛 | F169: 第2版
A170: 167 | B170: 12583. | C170: 秩父宫殿下 归国恭送词 | D170: 社说 | E170: 铁佛 | F170: 第2版
A171: 168 | B171: 12585. | C171: 藏本失踪事件与 日本亲善前途 | D171: 社说 | E171: 则 | F171: 第2版
A172: 169 | B172: 12589. | C172: 唤醒苏联 | D172: 社说 | E172: 铁佛 | F172: 第2版
A173: 170 | B173: 12591. | C173: 论军制改革 | D173: 社说 | E173: 铁佛 | F173: 第2版
A174: 171 | B174: 12592. | C174: 通车与通邮 | D174: 社说 | E174: 则 | F174: 第2版
A175: 172 | B175: 12598. | C175: 读美报承认论书后 | D175: 社说 | E175: 则 | F175: 第2版
A176: 173 | B176: 12599. | C176: 实行通车之真价値 | D176: 社说 | E176: 铁佛 | F176: 第2版
A177: 174 | B177: 12603. | C177: 平奉通车被炸 | D177: 社说 | E177: 铁佛 | F177: 第2版
A178: 175 | B178: 12605. | C178: 因举行防空节敬吿市民 | D178: 社说 | E178: 则 | F178: 第2版
A179: 176 | B179: 12610. | C179: 日本新内阁今后设施之推想 | D179: 社说 | E179: 铁佛 | F179: 第2版
A180: 177 | B180: 12614. | C180: 王道与党政 | D180: 社说 | E180: 则 | F180: 第2版
A181: 178 | B181: 12617. | C181: 涨水后住房的问题 | D181: 社说 | E181: 铁佛 | F181: 第2版
A182: 179 | B182: 12620. | C182: 美国罢工风潮感言 | D182: 社说 | E182: 则 | F182: 第2版
A183: 180 | B183: 12622. | C183: 北平大学生职业运动 | D183: 社说 | E183: 铁佛 | F183: 第2版
A184: 181 | B184: 12624. | C184: 中国废除苛杂 | D184: 社说 | E184: 铁佛 | F184: 第2版
A185: 182 | B185: 12626. | C185: 论军缩平等 | D185: 社说 | E185: 则 | F185: 第2版
A186: 183 | B186: 12631. | C186: 倒汪拥胡与中国大局 | D186: 社说 | E186: 铁佛 | F186: 第2版
A187: 184 | B187: 12632. | C187: 论日满无线电话开通 | D187: 社说 | E187: 则 | F187: 第2版
A188: 185 | B188: 12636. | C188: 中国复活总统制 | D188: 社说 | E188: 铁佛 | F188: 第2版
A189: 186 | B189: 12641. | C189: 文部通令保存古迹感言 | D189: 社说 | E189: 则 | F189: 第2版
A190: 187 | B190: 12649. | C190: 对全国司法 会议之期待 | D190: 社说 | E190: 铁佛 | F190: 第2版
A191: 188 | B191: 12650. | C191: 北铁让渡停 顿后之观察 | D191: 社说 | E191: 则 | F191: 第2版
A192: 189 | B192: 12656. | C192: 论日英美有同盟之必要 | D192: 社说 | E192: 则 | F192: 第2版
A193: 190 | B193: 12661. | C193: 高等师范成立感言 | D193: 社说 | E193: 则 | F193: 第2版
A194: 191 | B194: 12667. | C194: 饮鸩止渴之国联 | D194: 社说 | E194: 则 | F194: 第2版
A195: 192 | B195: 12673. | C195: 黄郛返任与华北悬案 | D195: 社说 | E195: 佛 | F195: 第2版
A196: 193 | B196: 12689. | C196: 论北铁让渡交涉再开 | D196: 社说 | E196: 则 | F196: 第2版
A197: 194 | B197: 12691. | C197: 拜观联合舰队后感想 | D197: 社说 | E197: 铁佛 | F197: 第2版
A198: 195 | B198: 12697. | C198: 孔子圣诞感言 | D198: 社说 | E198: 则 | F198: 第2版
A199: 196 | B199: 12699. | C199: 论新行政区域 | D199: 社说 | E199: 铁佛 | F199: 第2版
A200: 197 | B200: 12700. | C200: 吾人所期望于美记者团者 | D200: 社说 | E200: 则 | F200: 第2版
A201: 198 | B201: 12702. | C201: 北铁交涉复 活感想 | D201: 社说 | E201: 铁佛 | F201: 第2版
A202: 199 | B202: 12704. | C202: 蒋汪陈李关系恶化 | D202: 社说 | E202: 铁佛 | F202: 第2版
A203: 200 | B203: 12708. | C203: 陆军特别大演习感想 | D203: 社说 | E203: 铁佛 | F203: 第2版
A204: 201 | B204: 12712. | C204: 今上巡幸奉吉敬书所感 | D204: 社说 | E204: 则 | F204: 第2版
A205: 202 | B205: 12715. | C205: 中国五全大会之我观 | D205: 社说 | E205: 佛 | F205: 第2版
A206: 203 | B206: 12717. | C206: 巡狩与改革政区 | D206: 社说 | E206: 梦仙 | F206: 第2版
A207: 204 | B207: 12718. | C207: 论亟宜肃清匪患 | D207: 社说 | E207: 则 | F207: 第2版
A208: 205 | B208: 12722. | C208: 日华悬案解决说 | D208: 社说 | E208: 铁佛 | F208: 第2版
A209: 206 | B209: 12725. | C209: 论石油专卖问题 | D209: 社说 | E209: 则 | F209: 第2版
A210: 207 | B210: 12729. | C210: 海军军缩豫备会之我观 | D210: 社说 | E210: 铁佛 | F210: 第2版
A211: 208 | B211: 12731. | C211: 论施行新度量衡制 | D211: 社说 | E211: 则 | F211: 第2版
A212: 209 | B212: 12733. | C212: 蒋氏赴华北 | D212: 社说 | E212: 铁佛 | F212: 第2版
A213: 210 | B213: 12737. | C213: 论英美禁售石油 | D213: 社说 | E213: 铁佛 | F213: 第2版
A214: 211 | B214: 12738. | C214: 日本德川公倡言和平感言 | D214: 社说 | E214: 则 | F214: 第2版
A215: 212 | B215: 12739. | C215: 论关税修正 | D215: 社说 | E215: 铁佛 | F215: 第2版
A216: 213 | B216: 12744. | C216: 中国亦欲实行新省制 | D216: 社说 | E216: 铁佛 | F216: 第2版
A217: 214 | B217: 12746. | C217: 改省及人选 | D217: 社说 | E217: 则 | F217: 第2版
A218: 215 | B218: 12747. | C218: 中国征银出口税 | D218: 社说 | E218: 铁佛 | F218: 第2版
A219: 216 | B219: 12751. | C219: 宁粤妥协说 之我观 | D219: 社说 | E219: 铁佛 | F219: 第2版
A220: 217 | B220: 12754. | C220: 我国筹开大博览会感言 | D220: 社说 | E220: 则 | F220: 第2版
A221: 218 | B221: 12755. | C221: 北苏让渡与军缩之微妙关系 | D221: 社说 | E221: 铁佛 | F221: 第2版
A222: 219 | B222: 12757. | C222: 中国准备科学战争 | D222: 社说 | E222: 铁佛 | F222: 第2版
A223: 220 | B223: 12759. | C223: 论外商石油禁运 | D223: 社说 | E223: 则 | F223: 第2版
A224: 221 | B224: 12760. | C224: 通吿废弃华府条约 | D224: 社说 | E224: 则 | F224: 第2版
A225: 222 | B225: 12765. | C225: 继黄郛者 谁乎 | D225: 社说 | E225: 铁佛 | F225: 第2版
A226: 223 | B226: 12766. | C226: 中国又分 裂矣 | D226: 社说 | E226: 铁佛 | F226: 第2版
A227: 224 | B227: 12769. | C227: 钱行与粮价之我见 | D227: 社说 | E227: 铁佛 | F227: 第2版
A228: 225 | B228: 12771. | C228: 海军缩减预商休会 | D228: 社说 | E228: 铁佛 | F228: 第2版
A229: 226 | B229: 12773. | C229: 胡汉民鱼电之硏究 | D229: 社说 | E229: 铁佛 | F229: 第2版
A230: 227 | B230: 12775. | C230: 返还附属地及撤废治外法权 | D230: 社说 | E230: 铁佛 | F230: 第2版
A231: 228 | B231: 12775. | C231: 军缩预备会休会感言 | D231: 社说 | E231: 则 | F231: 第2版
A232: 229 | B232: 12777. | C232: 铲除民众恶习感言 | D232: 社说 | E232: 铁佛 | F232: 第2版
A233: 230 | B233: 12779. | C233: 欢迎南全权大使 | D233: 社说 | E233: 铁佛 | F233: 第2版
A234: 231 | B234: 12781. | C234: 中国向英抗议乎 | D234: 社说 | E234: 铁佛 | F234: 第2版
A235: 232 | B235: 12792. | C235: 满日华亲善今后之进展 | D235: 社说 | E235: 铁佛 | F235: 第2版
A236: 233 | B236: 12794. | C236: 欧洲和平与亚洲和平 | D236: 社说 | E236: 铁佛 | F236: 第2版
A237: 234 | B237: 12795. | C237: 孙科又唱高调 | D237: 社说 | E237: 铁佛 | F237: 第2版
A238: 235 | B238: 12796. | C238: 萨尔投票 | D238: 社说 | E238: 则 | F238: 第2版
A239: 236 | B239: 12798. | C239: 赈灾之急救策 | D239: 社说 | E239: 铁佛 | F239: 第2版
A240: 237 | B240: 12800. | C240: 美派极东商业视察团 | D240: 社说 | E240: 铁佛 | F240: 第2版
A241: 238 | B241: 12801. | C241: 柏林将开满洲展览会 | D241: 社说 | E241: 则 | F241: 第2版
A242: 239 | B242: 12804. | C242: 慰劳讨匪军队意义 | D242: 社说 | E242: 铁佛 | F242: 第2版
A243: 240 | B243: 12807. | C243: 宋哲元狼狈矣 | D243: 社说 | E243: 铁佛 | F243: 第2版
A244: 241 | B244: 12808. | C244: 北铁交涉成立矣（则） | D244: 社说 | E244: 则 | F244: 第2版
A245: 242 | B245: 12810. | C245: 中日关系改善 | D245: 社说 | E245: 铁佛 | F245: 第2版
A246: 243 | B246: 12813. | C246: 宋军事件 不致扩大 | D246: 社说 | E246: 铁佛 | F246: 第2版
A247: 244 | B247: 12815. | C247: 日华和好进展之我观 | D247: 社说 | E247: 铁佛 | F247: 第2版
A248: 245 | B248: 12848. | C248: 孔道在中国复活矣 | D248: 社说 | E248: 铁佛 | F248: 第2版
A249: 246 | B249: 12850. | C249: 举行全国慰灵祭感言（则） | D249: 社说 | E249: 则 | F249: 第2版
A250: 247 | B250: 12853. | C250: 英美援华与西南反蒋 | D250: 社说 | E250: 则 | F250: 第2版
A251: 248 | B251: 12855. | C251: 日陆军纪念日感言 | D251: 社说 | E251: 铁佛 | F251: 第2版
A252: 249 | B252: 12859. | C252: 北铁让渡签字感言 | D252: 社说 | E252: 则 | F252: 第2版
A253: 250 | B253: 12860. | C253: 中国学欧美 不如学日本 | D253: 社说 | E253: 铁佛 | F253: 第2版
A254: 251 | B254: 12864. | C254: 德片面废弃凡尔塞和约 | D254: 社说 | E254: 铁佛 | F254: 第2版
A255: 252 | B255: 12866. | C255: 论东洋儒者大会 | D255: 社说 | E255: 则 | F255: 第2版
A256: 253 | B256: 12871. | C256: 四川未来政局难乐观 | D256: 社说 | E256: 铁佛 | F256: 第2版
A257: 254 | B257: 12876. | C257: 恭送 皇帝陛下访日谨言 | D257: 社说 | E257: 铁佛 | F257: 第2版
A258: 255 | B258: 12887. | C258: 圣上赐谒建国勛劳者 | D258: 社说 | E258: 铁佛 | F258: 第2版
A259: 256 | B259: 12901. | C259: 皇帝陛下归国奉迎词 | D259: 社说 | E259: 铁佛 | F259: 第1版
A260: 257 | B260: 12904. | C260: 日华和好复活感言 | D260: 社说 | E260: 铁佛 | F260: 第2版
A261: 258 | B261: 12911. | C261: 中央调查地方礼俗 | D261: 社说 | E261: 铁佛 | F261: 第2版
A262: 259 | B262: 12912. | C262: 中央调查地方礼俗 续昨 | D262: 社说 | E262: 铁佛 | F262: 第2版
A263: 260 | B263: 12913. | C263: 中央调查地方礼俗 | D263: 社说 | E263: 铁佛 | F263: 第2版
A264: 261 | B264: 12914. | C264: 中央调查地方礼俗 | D264: 社说 | E264: 铁佛 | F264: 第2版
A265: 262 | B265: 12915. | C265: 中央调查地方礼俗 | D265: 社说 | E265: 铁佛 | F265: 第2版
A266: 263 | B266: 12933. | C266: 欢迎林陆相 | D266: 社说 | E266: 铁佛 | F266: 第2版
A267: 264 | B267: 12938. | C267: 祝新京教育展览会开幕 | D267: 社说 | E267: 则 | F267: 第2版
A268: 265 | B268: 12948. | C268: 防空演习 | D268: 社说 | E268: 则 | F268: 第2版
A269: 266 | B269: 12952. | C269: 对华北问题之感想 | D269: 社说 | E269: 铁佛 | F269: 第2版
A270: 267 | B270: 12955. | C270: 林陆相维持我国治安感言 | D270: 社说 | E270: 则 | F270: 第2版
A271: 268 | B271: 12962. | C271: 论政府注重 留学生经费 | D271: 社说 | E271: 则 | F271: 第2版
A272: 269 | B272: 12970. | C272: 论以工代赈 | D272: 社说 | E272: 则 | F272: 第2版
A273: 270 | B273: 12978. | C273: 国联将至 总崩溃 | D273: 社说 | E273: 则 | F273: 第2版
A274: 271 | B274: 12983. | C274: 今上巡幸双阳观稼感言 | D274: 社说 | E274: 则 | F274: 第2版
A275: 272 | B275: 12989. | C275: 中政府仍不觉悟耶 | D275: 社说 | E275: 则 | F275: 第2版
A276: 273 | B276: 12998. | C276: 文教部开催全国教育精神作兴大会 | D276: 社说 | E276: 则 | F276: 第2版
A277: 274 | B277: 13000. | C277: 中国对时势 应有之认识 | D277: 社说 | E277: 铁佛 | F277: 第2版
A278: 275 | B278: 13003. | C278: 意阿纷争之观测 | D278: 社说 | E278: 铁佛 | F278: 第2版
A279: 276 | B279: 13004. | C279: 绑票夺还之满日军殊勛 | D279: 社说 | E279: 铁佛 | F279: 第2版
A280: 277 | B280: 13005. | C280: 论华北情势 将再恶化 | D280: 社说 | E280: 则 | F280: 第2版
A281: 278 | B281: 13008. | C281: 撤废治外法权日 本阁议决定 | D281: 社说 | E281: 铁佛 | F281: 第2版
A282: 279 | B282: 13009. | C282: 颠倒是非之中国报 | D282: 社说 | E282: 铁佛 | F282: 第2版
A283: 280 | B283: 13012. | C283: 斥中国欧美派 | D283: 社说 | E283: 则 | F283: 第2版
A284: 281 | B284: 13013. | C284: 汪氏一派总 退却？ | D284: 社说 | E284: 铁佛 | F284: 第2版
A285: 282 | B285: 13019. | C285: 意阿纷争与世界和平 | D285: 社说 | E285: 则 | F285: 第2版
A286: 283 | B286: 13025. | C286: 可纪念的京滨路变轨完成 | D286: 社说 | E286: 则 | F286: 第2版
A287: 284 | B287: 13033. | C287: 苏联国际立场 | D287: 社说 | E287: 则 | F287: 第2版
A288: 285 | B288: 13047. | C288: 欧洲纠纷与东亚国家之觉悟 | D288: 社说 | E288: 则 | F288: 第2版
A289: 286 | B289: 13054. | C289: 论中国万不可容共 | D289: 社说 | E289: 则 | F289: 第2版
A290: 287 | B290: 13060. | C290: 德国与我互换邮汇 | D290: 社说 | E290: 则 | F290: 第2版
A291: 288 | B291: 13067. | C291: 恭读大演习后皇帝勅语感言 | D291: 社说 | E291: 则 | F291: 第2版
A292: 289 | B292: 13070. | C292: 有色人种宜大彻悟 | D292: 社说 | E292: 铁佛 | F292: 第2版
A293: 290 | B293: 13073. | C293: 意国代表之谬论 | D293: 社说 | E293: 铁佛 | F293: 第2版
A294: 291 | B294: 13075. | C294: 满苏国境问题 | D294: 社说 | E294: 则 | F294: 第2版
A295: 292 | B295: 13077. | C295: 蒋介石与华北 | D295: 社说 | E295: 铁佛 | F295: 第2版
A296: 293 | B296: 13081. | C296: 根绝满苏国境纠纷策 | D296: 社说 | E296: 铁佛 | F296: 第2版
A297: 294 | B297: 13082. | C297: 解决满苏国境纠纷 | D297: 社说 | E297: 则 | F297: 第2版
A298: 295 | B298: 13089. | C298: 华北人士宜急图自救 | D298: 社说 | E298: 则 | F298: 第2版
A299: 296 | B299: 13090. | C299: 德经济视察团来满 | D299: 社说 | E299: 则 | F299: 第2版
A300: 297 | B300: 13093. | C300: 汪精卫被刺之面面观 | D300: 社说 | E300: 铁佛 | F300: 第2版
A301: 298 | B301: 13096. | C301: 国币从此安定矣 | D301: 社说 | E301: 则 | F301: 第2版
A302: 299 | B302: 13098. | C302: 应坚决反对中英借款 | D302: 社说 | E302: 新 | F302: 第2版
A303: 300 | B303: 13101. | C303: 五强海军军缩会议 | D303: 社说 | E303: 铁佛 | F303: 第2版
A304: 301 | B304: 13104. | C304: 上海水兵事件感言 | D304: 社说 | E304: 铁佛 | F304: 第2版
A305: 302 | B305: 13105. | C305: 河北独立机运益熟 | D305: 社说 | E305: 则 | F305: 第2版
A306: 303 | B306: 13112. | C306: 华北自治终须成功 | D306: 社说 | E306: 则 | F306: 第2版
A307: 304 | B307: 13119. | C307: 教育厅长会议张总理训示书后 | D307: 社说 | E307: 则 | F307: 第2版
A308: 305 | B308: 13120. | C308: 华北自治问题面面观（上） | D308: 社说 | E308: 铁佛 | F308: 第2版
A309: 306 | B309: 13121. | C309: 华北自治问题面面观（中） | D309: 社说 | E309: 铁佛 | F309: 第2版
A310: 307 | B310: 13122. | C310: 华北自治问题面面观（下） | D310: 社说 | E310: 铁佛 | F310: 第2版
A311: 308 | B311: 13123. | C311: 德经济使节与我农工前途 | D311: 社说 | E311: 则 | F311: 第2版
A312: 309 | B312: 13125. | C312: 慰问雪地冰天中的满日军队 | D312: 社说 | E312: 铁佛 | F312: 第2版
A313: 310 | B313: 13131. | C313: 军缩会议前途 | D313: 社说 | E313: 则 | F313: 第2版
A314: 311 | B314: 13138. | C314: 意阿和解试案之我观 | D314: 社说 | E314: 铁佛 | F314: 第2版
A315: 312 | B315: 13140. | C315: 关于日华合作吿华北学生 | D315: 社说 | E315: 则 | F315: 第2版
A316: 313 | B316: 13143. | C316: 日华应合作防共 | D316: 社说 | E316: 新 | F316: 第2版
A317: 314 | B317: 13154. | C317: 狡哉外蒙与 苏俄 | D317: 社说 | E317: 铁佛 | F317: 第2版
A318: 315 | B318: 13158. | C318: 一年之计在于春 | D318: 社说 | E318: 铁佛 | F318: 第2版
A319: 316 | B319: 13160. | C319: 慰问袋纷至沓来 | D319: 社说 | E319: 铁佛 | F319: 第2版
A320: 317 | B320: 13161. | C320: 中国赤化之危机 | D320: 社说 | E320: 则 | F320: 第2版
A321: 318 | B321: 13165. | C321: 愚哉外蒙 | D321: 社说 | E321: 铁佛 | F321: 第2版
A322: 319 | B322: 13166. | C322: 防碍世界和平之两危险主义我国王道是对症下药 | D322: 社说 | E322: 则 | F322: 第2版
A323: 320 | B323: 13167. | C323: 日本退出海缩感言 | D323: 社说 | E323: 铁佛 | F323: 第2版
A324: 321 | B324: 13180. | C324: 对军警要有新认识 | D324: 社说 | E324: 新 | F324: 第2版
A325: 322 | B325: 13181. | C325: 千叶气球队来满演习 | D325: 社说 | E325: 则 | F325: 第2版
A326: 323 | B326: 13182. | C326: 友邦以德服人 | D326: 社说 | E326: 佛 | F326: 第2版
A327: 324 | B327: 13189. | C327: 苏联极东军部之荒谬 | D327: 社说 | E327: 铁佛 | F327: 第2版
A328: 325 | B328: 13192. | C328: 比国经济使者将来满 | D328: 短评 | E328: 铁佛 | F328: 第2版
A329: 326 | B329: 13195. | C329: 论设建国寮 | D329: 社说 | E329: 则 | F329: 第2版
A330: 327 | B330: 13196. | C330: 对汎美会议感想 | D330: 社说 | E330: 铁佛 | F330: 第2版
A331: 328 | B331: 13199. | C331: 论国境调整混委会 | D331: 社说 | E331: 铁佛 | F331: 第2版
A332: 329 | B332: 13201. | C332: 将设立国立图书 馆及编辑处 | D332: 社说 | E332: 则 | F332: 第2版
A333: 330 | B333: 13203. | C333: 正义团合并于协和会 | D333: 社说 | E333: 铁佛 | F333: 第2版
A334: 331 | B334: 13212. | C334: 东邻变故平息 | D334: 社说 | E334: 铁佛 | F334: 第2版
A335: 332 | B335: 13214. | C335: 市立职业所感言 | D335: 社说 | E335: 铁佛 | F335: 第2版
A336: 333 | B336: 13216. | C336: 东京事件平息感言 | D336: 社说 | E336: 则 | F336: 第2版
A337: 334 | B337: 13220. | C337: 友邦新内阁 | D337: 社说 | E337: 铁佛 | F337: 第2版
A338: 335 | B338: 13221. | C338: 欧局突然紧张 | D338: 社说 | E338: 铁佛 | F338: 第2版
A339: 336 | B339: 13222. | C339: 山西共祸与华北危机 | D339: 社说 | E339: 则 | F339: 第2版
A340: 337 | B340: 13227. | C340: 满蒙纠纷解决正途 | D340: 社说 | E340: 铁佛 | F340: 第2版
A341: 338 | B341: 13230. | C341: 广田内阁声 明感言 | D341: 社说 | E341: 则 | F341: 第2版
A342: 339 | B342: 13232. | C342: 未来之国际和平会议 | D342: 社说 | E342: 铁佛 | F342: 第2版
A343: 340 | B343: 13236. | C343: 植田军司令官谈 话感 | D343: 社说 | E343: 则 | F343: 第2版
A344: 341 | B344: 13237. | C344: 南全权将归国感想 | D344: 社说 | E344: 铁佛 | F344: 第2版
A345: 342 | B345: 13244. | C345: 山西共匪猖獗感言 | D345: 社说 | E345: 铁佛 | F345: 第2版
A346: 343 | B346: 13245. | C346: 南大将临别之希望 | D346: 社说 | E346: 则 | F346: 第2版
A347: 344 | B347: 13249. | C347: 奉省宣抚的好办法 | D347: 社说 | E347: 佛声 | F347: 第2版
A348: 345 | B348: 13250. | C348: 苏蒙协定与我国关系 | D348: 社说 | E348: 则 | F348: 第2版
A349: 346 | B349: 13252. | C349: 对苏联应勿客气 | D349: 社说 | E349: 铁佛 | F349: 第2版
A350: 347 | B350: 13256. | C350: 欢迎冀东专使来京 | D350: 社说 | E350: 则 | F350: 第2版
A351: 348 | B351: 13257. | C351: 抗议直抗议耳 | D351: 社评 | E351: 铁佛 | F351: 第2版
A352: 349 | B352: 13261. | C352: 植树节感言 | D352: 社说 | E352: 铁佛 | F352: 第2版
A353: 350 | B353: 13263. | C353: 国联骗人 | D353: 社说 | E353: 则 | F353: 第2版
A354: 351 | B354: 13278. | C354: 阿国覆亡言 | D354: 社说 | E354: 则 | F354: 第2版
A355: 352 | B355: 13284. | C355: 国联前途与东亚 | D355: 社说 | E355: 则 | F355: 第2版
A356: 353 | B356: 16941. | C356: 应预防天花猩红热 | D356: 社会短评 | E356: 铁佛 | F356: 第2版
A357: 354 | B357: 13292. | C357: 满冀协定及其影响 | D357: 社说 | E357: 则 | F357: 第2版
A358: 355 | B358: 13294. | C358: 意大利旁若无人 | D358: 社说 | E358: 铁佛 | F358: 第2版
C359: 国联遇着硬对头 | D359: 社说 | E359: 铁佛 | F359: 第2版
C360: 总理大臣之谦德 | D360: 社说 | E360: 铁佛 | F360: 第2版
A361: 356 | B361: 13297. | C361: 论张群之外交演说 | D361: 社说 | E361: 铁佛 | F361: 第2版
A362: 357 | B362: 13300. | C362: 日华关系好转 | D362: 社说 | E362: 则 | F362: 第1版
A363: 358 | B363: 13306. | C363: 论蒋与西南之争 | D363: 社说 | E363: 铁佛 | F363: 第2版
A364: 359 | B364: 13311. | C364: 祝撤废治外法权签字 | D364: 社说 | E364: 铁佛 | F364: 第2版
A365: 360 | B365: 13323. | C365: 苏联之诈伪宣传 | D365: 社说 | E365: 铁佛 | F365: 第2版
A366: 361 | B366: 13328. | C366: 论蒋与陈李白 | D366: 社说 | E366: 铁佛 | F366: 第2版
A367: 362 | B367: 13331. | C367: 无人欢迎阿皇 | D367: 社说 | E367: 铁佛 | F367: 第2版
A368: 363 | B368: 13331. | C368: 机心机事之国家 | D368: 社说 | E368: 铁佛 | F368: 第2版
A369: 364 | B369: 13332. | C369: 精神一致之亲善 | D369: 社说 | E369: 铁佛 | F369: 第2版
A370: 365 | B370: 13336. | C370: 我邦正义的措置 | D370: 社说 | E370: 铁佛 | F370: 第2版
A371: 366 | B371: 13339. | C371: 英国官宪之 非法处分 | D371: 社说 | E371: 铁佛 | F371: 第2版
A372: 367 | B372: 13341. | C372: 国联撤销对意制裁 | D372: 社说 | E372: 铁佛 | F372: 第2版
A373: 368 | B373: 13357. | C373: 对中国内乱之我观 | D373: 社说 | E373: 敢言 | F373: 第2版
A374: 369 | B374: 13346. | C374: 应体恤小贩 | D374: 短评 | E374: 铁佛 | F374: 第2版
A375: 370 | B375: 13346. | C375: 萱生事件感言 | D375: 短评 | E375: 铁佛 | F375: 第2版
A376: 371 | B376: 13364. | C376: 呜呼世道人心 | D376: 社说 | E376: 铁佛 | F376: 第2版
C377: 论妓女传习所 | D377: 社说 | E377: 铁佛 | F377: 第2版
C378: 清道夫可恶 | D378: 社说 | E378: 铁佛 | F378: 第2版
A379: 372 | B379: 13365. | C379: 呜呼世道人心 | D379: 社说 | E379: 铁佛 | F379: 第2版
A380: 373 | B380: 13366. | C380: 莫氏假面具 | D380: 社说 | E380: 敢言 | F380: 第2版
C381: 蒋氏擅长烟幕 | D381: 社说 | E381: 敢言 | F381: 第2版
A382: 374 | B382: 13369. | C382: 蒋介石铲锄 异派之辣手 | D382: 社说 | E382: 敢言 | F382: 第2版
A383: 375 | B383: 13373. | C383: 西班牙内乱面面观 | D383: 社说 | E383: 敢言 | F383: 第2版
A384: 376 | B384: 13375. | C384: 城墻可拆乎 | D384: 社说 | E384: 敢言 | F384: 第2版
C385: 向协和会进一言 | D385: 社说 | E385: 敢言 | F385: 第2版
A386: 377 | B386: 13380. | C386: 苏联对满日 尙乏认识 | D386: 社说 | E386: 敢言 | F386: 第1版
A387: 378 | B387: 13382. | C387: 世运闭幕满洲国体育 界应有之觉悟 | D387: 社说 | E387: 渤阳 | F387: 第1版
A388: 379 | B388: 13383. | C388: 蒋与李白之双方作用 | D388: 社说 | E388: 松下士 | F388: 第1版
A389: 380 | B389: 13384. | C389: 二重放送问题之检讨 | D389: 社说 | E389: 松下士 | F389: 第2版
A390: 381 | B390: 13385. | C390: 新京商业不振与商会改组 | D390: 社说 | E390: 松下士 | F390: 第2版
A391: 382 | B391: 13387. | C391: 如何使首都生活向上 | D391: 社说 | E391: 松下士 | F391: 第1版
A392: 383 | B392: 13388. | C392: 苏联可以废然返矣 | D392: 社评 | E392: 松下士 | F392: 第1版
A393: 384 | B393: 13390. | C393: 论中国之内讧 | D393: 社评 | E393: 渤阳 | F393: 第1版
A394: 385 | B394: 13391. | C394: 西国内乱（上） | D394: 社评 | E394: 松下士 | F394: 第2版
A395: 386 | B395: 13392. | C395: 西国内乱（下） | D395: 社评 | E395: 松下士 | F395: 第2版
A396: 387 | B396: 13393. | C396: 再开满蒙会议 | D396: 社评 | E396: 松下士 | F396: 第1版
A397: 388 | B397: 13394. | C397: 再论蒋与李白之双方作用 | D397: 社评 | E397: 松下士 | F397: 第2版
A398: 389 | B398: 13396. | C398: 成都惨案之因果 | D398: 社评 | E398: 渤阳 | F398: 第2版
A399: 390 | B399: 13397. | C399: 太平洋会议告终 | D399: 社评 | E399: 松下士 | F399: 第1版
A400: 391 | B400: 13398. | C400: 新京马粪与卫生 | D400: 社评 | E400: 松下士 | F400: 第2版
A401: 392 | B401: 13399. | C401: 弘报协会之使命 | D401: 社评 | E401: 松下士 | F401: 第1版
A402: 393 | B402: 13400. | C402: 日华外交 | D402: 社评 | E402: 松下士 | F402: 第1版
A403: 394 | B403: 13402. | C403: 党 | D403: 社评 | E403: 松下士 | F403: 第1版
A404: 395 | B404: 13403. | C404: 国境 | D404: 社评 | E404: 松下士 | F404: 第1版
A405: 396 | B405: 13404. | C405: 本社主办京市商工恳谈会之收获（上） | D405: 社评 | E405: 松下士 | F405: 第1版
A406: 397 | B406: 13405. | C406: 本社主办京市商工恳谈会之收获（下） | D406: 社评 | E406: 松下士 | F406: 第1版
A407: 398 | B407: 13406. | C407: 北海事件 | D407: 社评 | E407: 松下士 | F407: 第1版
A408: 399 | B408: 13409. | C408: 友邦移民 | D408: 社评 | E408: 松下士 | F408: 第1版
A409: 400 | B409: 13413. | C409: 四届日满实协大会 | D409: 社评 | E409: 松下士 | F409: 第1版
A410: 401 | B410: 13414. | C410: 隐跃战乱之国际危机 | D410: 社评 | E410: 松下士 | F410: 第1版
A411: 402 | B411: 13415. | C411: 丰台与汉口事件之观感 | D411: 社评 | E411: 松下士 | F411: 第1版
A412: 403 | B412: 13416. | C412: 祭孔 祭关岳 | D412: 社评 | E412: 松下士 | F412: 第1版
A413: 404 | B413: 13419. | C413: 五届体育大会感言 | D413: 社评 | E413: 松下士 | F413: 第1版
A414: 405 | B414: 13420. | C414: 由于上海事件之推测 | D414: 社说 | E414: 松下士 | F414: 第1版
A415: 406 | B415: 13421. | C415: 中国排日索隐 | D415: 社说 | E415: 松下士 | F415: 第1版
A416: 407 | B416: 13423. | C416: 关东州及满铁附属地之治绩 | D416: 社说 | E416: 匿名 | F416: 第1版
A417: 408 | B417: 13433. | C417: 川越与蒋会谈圆满 | D417: 短评 | E417: 松下士 | F417: 第1版
C418: 宋哲元之人士华北 | D418: 短评 | E418: 松下士 | F418: 第1版
C419: 奉天教育 | D419: 短评 | E419: 松下士 | F419: 第1版
A420: 409 | B420: 13435. | C420: 电影协会之使命 | D420: 社评 | E420: 松下士 | F420: 第1版
A421: 410 | B421: 13440. | C421: 欧洲对立日近尖锐化 | D421: 社说 | E421: 松下士 | F421: 第1版
A422: 411 | B422: 13441. | C422: 日华交涉与苏联（上） | D422: 社论 | E422: 松下士 | F422: 第1版
A423: 412 | B423: 13442. | C423: 日华交涉与苏联（下） | D423: 社论 | E423: 松下士 | F423: 第1版
A424: 413 | B424: 13443. | C424: 祝盛京时报卅十周年暨纪念 | D424: 社说 | E424: 匿名 | F424: 第1版
A425: 414 | B425: 13444. | C425: 安全保障已不可恃 | D425: 社说 | E425: 松下士 | F425: 第1版
C426: 平津学团血气兴奋 | D426: 社说 | E426: 松下士 | F426: 第1版
A427: 415 | B427: 13445. | C427: 日华交涉与欧美列国 | D427: 社说 | E427: 松下士 | F427: 第1版
A428: 416 | B428: 13448. | C428: 日华交涉之逆转 | D428: 社评 | E428: 松下士 | F428: 第1版
C429: 地籍整理 | D429: 社评 | E429: 松下士 | F429: 第1版
A430: 417 | B430: 13449. | C430: 解救堕落妇女 | D430: 社说 | E430: 松下士 | F430: 第1版
A431: 418 | B431: 13450. | C431: 驻华苏使之恫吓中国与日华交涉 | D431: 社说 | E431: 松下士 | F431: 第1版
A432: 419 | B432: 13452. | C432: 哀杨永泰 | D432: 短评 | E432: 松下士 | F432: 第1版
C433: 意阿合并 | D433: 短评 | E433: 松下士 | F433: 第1版
A434: 420 | B434: 13453. | C434: 吉垣中央三机关移京 | D434: 社评 | E434: 松下士 | F434: 第1版
A435: 421 | B435: 13454. | C435: 蒋寿 | D435: 社评 | E435: 松下士 | F435: 第1版
A436: 422 | B436: 13455. | C436: 苏联之危机暴性欲烈 | D436: 社评 | E436: 松下士 | F436: 第1版
A437: 423 | B437: 13456. | C437: 王道与治术及主义社论 | D437: 社评 | E437: 松下士 | F437: 第1版
A438: 424 | B438: 13457. | C438: 华苏密谋对日开战 | D438: 社评 | E438: 松下士 | F438: 第1版
A439: 425 | B439: 13458. | C439: 蒋介石果堕苏联之？中耶 | D439: 社评 | E439: 松下士 | F439: 第1版
A440: 426 | B440: 13459. | C440: 京市防空预习之灯火管制 | D440: 社评 | E440: 松下士 | F440: 第1版
A441: 427 | B441: 13460. | C441: 整理私塾与普及教育 | D441: 社评 | E441: 松下士 | F441: 第1版
A442: 428 | B442: 13461. | C442: 风化好音 | D442: 社评 | E442: 松下士 | F442: 第1版
A443: 429 | B443: 13463. | C443: 西乱果将告终yu | D443: 社评 | E443: 松下士 | F443: 第1版
A444: 430 | B444: 13464. | C444: 美大总统罗斯福之连任 | D444: 社评 | E444: 松下士 | F444: 第1版
A445: 431 | B445: 13465. | C445: 论段祺瑞及国葬 | D445: 社评 | E445: 松下士 | F445: 第1版
A446: 432 | B446: 13466. | C446: 上海文化会盲动与华北 | D446: 社评 | E446: 松下士 | F446: 第1版
A447: 433 | B447: 13467. | C447: 苏联之罢敝与鸱张 | D447: 社说 | E447: 匿名 | F447: 第1版
A448: 434 | B448: 13469. | C448: 水火 | D448: 社说 | E448: 匿名 | F448: 第1版
A449: 435 | B449: 13471. | C449: 化与忠孝 | D449: 社评 | E449: 匿名 | F449: 第1版
A450: 436 | B450: 13473. | C450: 德王防共 | D450: 社说 | E450: 匿名 | F450: 第1版
A451: 437 | B451: 13474. | C451: 危如累卵之欧局由何处崩断乎 | D451: 社评 | E451: 匿名 | F451: 第1版
A452: 438 | B452: 13475. | C452: 法内相自杀与苏联 | D452: 社评 | E452: 匿名 | F452: 第1版
A453: 439 | B453: 13476. | C453: 绥蒙风云 | D453: 社评 | E453: 匿名 | F453: 第1版
C454: 翁照垣果将赴苏联与 | D454: 社评 | E454: 匿名 | F454: 第1版
A455: 440 | B455: 13478. | C455: 防毒 | D455: 社评 | E455: 匿名 | F455: 第1版
A456: 441 | B456: 13479. | C456: 慰问军警 | D456: 社评 | E456: 匿名 | F456: 第1版
A457: 442 | B457: 13480. | C457: 冀东防共自治政府周年纪念感言 | D457: 社评 | E457: 匿名 | F457: 第1版
A458: 443 | B458: 13482. | C458: 健康运动 | D458: 社评 | E458: 匿名 | F458: 第1版
A459: 444 | B459: 13483. | C459: 大雪与贫民 | D459: 社评 | E459: 匿名 | F459: 第1版
A460: 445 | B460: 13485. | C460: 西班牙政府与国联 | D460: 社评 | E460: 匿名 | F460: 第1版
A461: 446 | B461: 13486. | C461: 勗汉医 | D461: 社评 | E461: 匿名 | F461: 第1版
A462: 447 | B462: 13488. | C462: 德意事实上承认我国 | D462: 社评 | E462: 匿名 | F462: 第1版
A463: 448 | B463: 13489. | C463: 国联局面果将如何支持 | D463: 社评 | E463: 匿名 | F463: 第1版
A464: 449 | B464: 13490. | C464: 英皇婚姻问题 | D464: 社评 | E464: 匿名 | F464: 第1版
A465: 450 | B465: 13492. | C465: 中国赤货之一班与内蒙义军之奋？ | D465: 社评 | E465: 匿名 | F465: 第1版
A466: 451 | B466: 13493. | C466: 在论英皇婚姻问题 | D466: 社评 | E466: 匿名 | F466: 第1版
A467: 452 | B467: 13494. | C467: 日华交涉停顿下的中国态度 | D467: 社评 | E467: 匿名 | F467: 第1版
A468: 453 | B468: 13495. | C468: 排共运动 | D468: 社评 | E468: 匿名 | F468: 第1版
A469: 454 | B469: 13496. | C469: 满鲜架桥之关系 | D469: 社评 | E469: 匿名 | F469: 第1版
C470: 青岛问题之好转 | D470: 社评 | E470: 匿名 | F470: 第1版
A471: 455 | B471: 13498. | C471: 调停西乱 | D471: 社评 | E471: 匿名 | F471: 第1版
A472: 456 | B472: 13499. | C472: 中国西安之变 | D472: 社评 | E472: 匿名 | F472: 第1版
A473: 457 | B473: 13501. | C473: 陕乱侧面观与蒋氏之亡 | D473: 社评 | E473: 匿名 | F473: 第1版
A474: 458 | B474: 13502. | C474: 德意葡三国拒绝调解西乱 | D474: 社评 | E474: 匿名 | F474: 第1版
A475: 459 | B475: 13503. | C475: 时势与英雄 | D475: 社评 | E475: 匿名 | F475: 第1版
A476: 460 | B476: 13505. | C476: 改正电费 | D476: 社评 | E476: 匿名 | F476: 第1版
A477: 461 | B477: 13506. | C477: 德王通电停战 | D477: 社评 | E477: 匿名 | F477: 第1版
A478: 462 | B478: 13507. | C478: 粮价与年关 | D478: 社评 | E478: 匿名 | F478: 第1版
A479: 463 | B479: 13508. | C479: 陕变之再检讨 | D479: 社评 | E479: 匿名 | F479: 第1版
A480: 464 | B480: 13509. | C480: 陕变之再检讨（续昨） | D480: 社评 | E480: 匿名 | F480: 第1版
A481: 465 | B481: 13511. | C481: 西乱之近势 | D481: 社评 | E481: 匿名 | F481: 第1版
A482: 466 | B482: 13513. | C482: 波兰纵横之陕变 | D482: 社评 | E482: 匿名 | F482: 第1版
A483: 467 | B483: 13514. | C483: 送岁词 | D483: 社评 | E483: 匿名 | F483: 第1版
A484: 468 | B484: 13520. | C484: 新年感言 | D484: 社评 | E484: 匿名 | F484: 第1版
A485: 469 | B485: 13522. | C485: 论进行国策不遣民间疾苦之具体策 | D485: 年征文伦说丙等当选 | E485: 刘德懿 | F485: 第1版
A486: 470 | B486: 13523. | C486: 蒋介石自劾与张学良罪案 | D486: 社评 | E486: 匿名 | F486: 第1版
A487: 471 | B487: 13524. | C487: 表彰孝子节妇 | D487: 社评 | E487: 匿名 | F487: 第1版
A488: 472 | B488: 13526. | C488: 本年之世界趋势（上） | D488: 社评 | E488: 匿名 | F488: 第1版
A489: 473 | B489: 13527. | C489: 本年之世界趋势（中） | D489: 社评 | E489: 匿名 | F489: 第1版
A490: 474 | B490: 13528. | C490: 本年之世界趋势（下） | D490: 社评 | E490: 匿名 | F490: 第1版
A491: 475 | B491: 13530. | C491: 旧？紧迫声中确保安全之注意事项 | D491: 社评 | E491: 匿名 | F491: 第1版
A492: 476 | B492: 13531. | C492: 我国之映画事业 | D492: 社评 | E492: 匿名 | F492: 第1版
A493: 477 | B493: 13534. | C493: 陕乱日极与汪精卫归国 | D493: 社评 | E493: 匿名 | F493: 第1版
A494: 478 | B494: 13535. | C494: 读新刑法 | D494: 社评 | E494: 匿名 | F494: 第1版
A495: 479 | B495: 13536. | C495: 不良井水封锁之必要 | D495: 社评 | E495: 匿名 | F495: 第1版
A496: 480 | B496: 13538. | C496: 论地方长官会议 | D496: 社评 | E496: 匿名 | F496: 第1版
A497: 481 | B497: 13539. | C497: 命相与伟人 | D497: 社评 | E497: 匿名 | F497: 第1版
A498: 482 | B498: 13540. | C498: 刷新监政于民生 | D498: 社评 | E498: 匿名 | F498: 第1版
A499: 483 | B499: 13542. | C499: 最近欧局之鸟瞰（上） | D499: 社评 | E499: 匿名 | F499: 第1版
A500: 484 | B500: 13543. | C500: 最近欧局之鸟瞰（下） | D500: 社评 | E500: 匿名 | F500: 第1版
A501: 485 | B501: 13545. | C501: 最近旧历年关所望于警戒与救济者 | D501: 社评 | E501: 匿名 | F501: 第1版
A502: 486 | B502: 13546. | C502: 亚洲门罗主义（上） | D502: 社评 | E502: 匿名 | F502: 第1版
A503: 487 | B503: 13547. | C503: 亚洲门罗主义（下） | D503: 社评 | E503: 匿名 | F503: 第1版
A504: 488 | B504: 13549. | C504: 再混沌之陕局果将不再绵延耶（上） | D504: 社评 | E504: 匿名 | F504: 第1版
A505: 489 | B505: 13550. | C505: 再混沌之陕局果将不再绵延耶（下） | D505: 社评 | E505: 匿名 | F505: 第1版
A506: 490 | B506: 13551. | C506: 日本新内阁组织成功 | D506: 社评 | E506: 匿名 | F506: 第1版
A507: 491 | B507: 13553. | C507: 吉垣施行联保制 | D507: 社评 | E507: 匿名 | F507: 第1版
A508: 492 | B508: 13554. | C508: 设职员共济社 | D508: 社评 | E508: 匿名 | F508: 第1版
A509: 493 | B509: 13556. | C509: 满华铁路交欢 | D509: 社评 | E509: 匿名 | F509: 第1版
A510: 494 | B510: 13566. | C510: 对于影戏院设置之？议（上） | D510: 社评 | E510: 匿名 | F510: 第1版
A511: 495 | B511: 13567. | C511: 对于影戏院设置之？议（下） | D511: 社评 | E511: 匿名 | F511: 第1版
A512: 496 | B512: 13569. | C512: 论三中全会 | D512: 社评 | E512: 匿名 | F512: 第1版
A513: 497 | B513: 13571. | C513: 读星野总务厅长民生向上谈 | D513: 社评 | E513: 匿名 | F513: 第1版
A514: 498 | B514: 13573. | C514: 王道国民应有之态度 | D514: 社评 | E514: 匿名 | F514: 第1版
A515: 499 | B515: 13577. | C515: 祝帝位继承法隆重公布 | D515: 社评 | E515: 匿名 | F515: 第1版
A516: 500 | B516: 13578. | C516: 满意交互设领 | D516: 社评 | E516: 匿名 | F516: 第1版
A517: 501 | B517: 13580. | C517: 论教育作用与青年思想 | D517: 社评 | E517: 匿名 | F517: 第1版
A518: 502 | B518: 13581. | C518: 论政务会议 | D518: 社评 | E518: 匿名 | F518: 第1版
A519: 503 | B519: 13582. | C519: 监察西战又发生波折 | D519: 社评 | E519: 匿名 | F519: 第1版
A520: 504 | B520: 13585. | C520: 振兴农村 | D520: 社评 | E520: 匿名 | F520: 第1版
A521: 505 | B521: 13587. | C521: 欧美扩军与恐慌影响 | D521: 社评 | E521: 匿名 | F521: 第1版
A522: 506 | B522: 13589. | C522: 论中国撤废领权运动 | D522: 社评 | E522: 匿名 | F522: 第1版
A523: 507 | B523: 13590. | C523: 论反复东边地域 | D523: 社评 | E523: 匿名 | F523: 第1版
A524: 508 | B524: 13591. | C524: 京市影戏院将严限改策 | D524: 社评 | E524: 匿名 | F524: 第1版
A525: 509 | B525: 13593. | C525: 大奉天市实行扩展 | D525: 社评 | E525: 匿名 | F525: 第1版
A526: 510 | B526: 13594. | C526: 混沌之西乱难忘解息 | D526: 社评 | E526: 匿名 | F526: 第1版
A527: 511 | B527: 13595. | C527: 祀孔感言 | D527: 社评 | E527: 匿名 | F527: 第1版
A528: 512 | B528: 13596. | C528: 祀开岳 | D528: 社评 | E528: 匿名 | F528: 第1版
A529: 513 | B529: 13598. | C529: 日华贸易协会与经济提携 | D529: 社评 | E529: 匿名 | F529: 第1版
A530: 514 | B530: 13599. | C530: 实施青年训练之管见 | D530: 社评 | E530: 匿名 | F530: 第1版
A531: 515 | B531: 13600. | C531: 鸭江水利之开发 | D531: 社评 | E531: 匿名 | F531: 第1版
A532: 516 | B532: 13602. | C532: 激荡之欧局作为日拙 | D532: 社评 | E532: 匿名 | F532: 第1版
A533: 517 | B533: 13604. | C533: 妇女与国防 | D533: 社评 | E533: 匿名 | F533: 第1版
A534: 518 | B534: 13605. | C534: 御弟溥杰与嵯峨女士结婚 | D534: 社评 | E534: 匿名 | F534: 第1版
A535: 519 | B535: 13606. | C535: 论王凤阁落网与东边治安 | D535: 社评 | E535: 匿名 | F535: 第1版
A536: 520 | B536: 13608. | C536: 广真生活运动 | D536: 社评 | E536: 匿名 | F536: 第1版
A537: 521 | B537: 13609. | C537: 我国外交关系明朗跃进 | D537: 社评 | E537: 匿名 | F537: 第1版
A538: 522 | B538: 13611. | C538: 保障劳工 | D538: 社评 | E538: 匿名 | F538: 第1版
A539: 523 | B539: 13612. | C539: 论无谓之谀颂 | D539: 社评 | E539: 匿名 | F539: 第1版
A540: 524 | B540: 13615. | C540: 如此苏俄 | D540: 社评 | E540: 匿名 | F540: 第1版
A541: 525 | B541: 13617. | C541: 英皇加冕典礼与世界之关系 | D541: 社评 | E541: 匿名 | F541: 第1版
A542: 526 | B542: 13618. | C542: 图书馆应劝导民众阅读 | D542: 社评 | E542: 匿名 | F542: 第1版
A543: 527 | B543: 13620. | C543: 红十字吉林分会之黑幕 | D543: 社评 | E543: 匿名 | F543: 第1版
A544: 528 | B544: 13621. | C544: 查禁暴利 | D544: 社评 | E544: 匿名 | F544: 第1版
A545: 529 | B545: 13622. | C545: 放火的重要季节 | D545: 社评 | E545: 匿名 | F545: 第1版
A546: 530 | B546: 13624. | C546: 谋国民体育强化 | D546: 社评 | E546: 匿名 | F546: 第1版
A547: 531 | B547: 13625. | C547: 植树运动 | D547: 社评 | E547: 匿名 | F547: 第1版
A548: 532 | B548: 13627. | C548: 欧美列国的空军竞争 | D548: 社评 | E548: 匿名 | F548: 第1版
A549: 533 | B549: 13628. | C549: 为小学教育进一言 | D549: 社评 | E549: 匿名 | F549: 第1版
A550: 534 | B550: 13629. | C550: 备极纷纭的西乱调停案国能实际运行与 | D550: 社评 | E550: 匿名 | F550: 第1版
A551: 535 | B551: 13631. | C551: 缠足之禁当申 | D551: 社评 | E551: 匿名 | F551: 第1版
A552: 536 | B552: 13632. | C552: 英意之关系 | D552: 社评 | E552: 匿名 | F552: 第1版
A553: 537 | B553: 13634. | C553: 和平之希望 | D553: 社评 | E553: 匿名 | F553: 第1版
A554: 538 | B554: 13635. | C554: 植树的成绩问题 | D554: 社评 | E554: 匿名 | F554: 第1版
A555: 539 | B555: 13641. | C555: 论新学制 | D555: 社评 | E555: 匿名 | F555: 第1版
A556: 540 | B556: 13642. | C556: 苏联政况日显兀隍 | D556: 社评 | E556: 匿名 | F556: 第1版
A557: 541 | B557: 13643. | C557: 安定生活 | D557: 社评 | E557: 匿名 | F557: 第1版
A558: 542 | B558: 13644. | C558: 内阁更新 | D558: 社评 | E558: 匿名 | F558: 第1版
A559: 543 | B559: 13645. | C559: 行政机构之改革 | D559: 社评 | E559: 匿名 | F559: 第1版
A560: 544 | B560: 13647. | C560: 英意之关系一张一弛 | D560: 社评 | E560: 匿名 | F560: 第1版
A561: 545 | B561: 13649. | C561: 为促进教育向上当注意改善的先决条件 | D561: 社评 | E561: 匿名 | F561: 第1版
A562: 546 | B562: 13650. | C562: 应注意的几项卫生事件 | D562: 社评 | E562: 匿名 | F562: 第1版
A563: 547 | B563: 13652. | C563: 日华提携之明朗象征 | D563: 社评 | E563: 匿名 | F563: 第1版
A564: 548 | B564: 13654. | C564: 德意两揆之会见与欧局 | D564: 社评 | E564: 匿名 | F564: 第1版
A565: 549 | B565: 13655. | C565: 奉吉哈三市之善政 | D565: 社评 | E565: 匿名 | F565: 第1版
A566: 550 | B566: 13656. | C566: 商人之道德观念应修养 | D566: 社评 | E566: 匿名 | F566: 第1版
A567: 551 | B567: 13658. | C567: 哀西乱 | D567: 社评 | E567: 匿名 | F567: 第1版
A568: 552 | B568: 13659. | C568: 欧局现状将如何维持 | D568: 社评 | E568: 匿名 | F568: 第1版
A569: 553 | B569: 13661. | C569: 满德贸易协定延长之关系 | D569: 社评 | E569: 匿名 | F569: 第1版
A570: 554 | B570: 13663. | C570: 苏联当局顽冥不灵 | D570: 社评 | E570: 匿名 | F570: 第1版
A571: 555 | B571: 13664. | C571: 日华国交调整须扫除故障 | D571: 社评 | E571: 匿名 | F571: 第1版
A572: 556 | B572: 13666. | C572: 科学进步与道德 | D572: 社评 | E572: 匿名 | F572: 第1版
A573: 557 | B573: 13667. | C573: 满洲输入会社与满铁将合谋扩充采买网 | D573: 社评 | E573: 匿名 | F573: 第1版
A574: 558 | B574: 13668. | C574: 及时好雨慰三农 | D574: 社评 | E574: 匿名 | F574: 第1版
A575: 559 | B575: 13670. | C575: 祝满日两京之超特飞行成功 | D575: 社评 | E575: 匿名 | F575: 第1版
A576: 560 | B576: 13671. | C576: 对近衙公奉命组阁之观感 | D576: 社评 | E576: 匿名 | F576: 第1版
A577: 561 | B577: 13672. | C577: 不干涉西乱又掀巨波 | D577: 社评 | E577: 匿名 | F577: 第1版
A578: 562 | B578: 13673. | C578: 本报主办之京市中小学校运动会 | D578: 社评 | E578: 匿名 | F578: 第1版
A579: 563 | B579: 13675. | C579: 造林事业之百年大计 | D579: 社评 | E579: 匿名 | F579: 第1版
A580: 564 | B580: 13676. | C580: 唤起大众减蝇运动 | D580: 社评 | E580: 匿名 | F580: 第1版
A581: 565 | B581: 13678. | C581: 守时刻 | D581: 社评 | E581: 匿名 | F581: 第1版
A582: 566 | B582: 13679. | C582: 蒲节感言 | D582: 社评 | E582: 匿名 | F582: 第1版
A583: 567 | B583: 13681. | C583: 政府机构整饬的新阵容 | D583: 社评 | E583: 匿名 | F583: 第1版
A584: 568 | B584: 13682. | C584: 苏联内讧--兔死狐悲 | D584: 社评 | E584: 匿名 | F584: 第1版
A585: 569 | B585: 13684. | C585: 夏日卫生 | D585: 社评 | E585: 匿名 | F585: 第1版
A586: 570 | B586: 13685. | C586: 苏联自此多事矣 | D586: 社评 | E586: 匿名 | F586: 第1版
A587: 571 | B587: 13688. | C587: 谋民间金融之圆活 | D587: 社评 | E587: 匿名 | F587: 第1版
A588: 572 | B588: 13689. | C588: 提倡增产羊毛 | D588: 社评 | E588: 匿名 | F588: 第1版
A589: 573 | B589: 13691. | C589: 普及防空思想 | D589: 社评 | E589: 匿名 | F589: 第1版
A590: 574 | B590: 13693. | C590: 确保交通安全 | D590: 社评 | E590: 匿名 | F590: 第1版
A591: 575 | B591: 13694. | C591: 欧局俄又紧张 | D591: 社评 | E591: 匿名 | F591: 第1版
A592: 576 | B592: 13697. | C592: 咄嗟怪事！苏联之妄动 | D592: 社评 | E592: 匿名 | F592: 第1版
A593: 577 | B593: 13698. | C593: 苏联自取咎戾之谬行竟变本加厉 | D593: 社评 | E593: 匿名 | F593: 第1版
A594: 578 | B594: 13699. | C594: 下层民众与灯火管制 | D594: 社评 | E594: 匿名 | F594: 第1版
A595: 579 | B595: 13702. | C595: 政府新机构及新人员均踏入新阶段矣 | D595: 社评 | E595: 匿名 | F595: 第1版